,index,Filename,Date,JDate,Days,Julian,TTR,WordCount,UniqueWords,UniqueStems,MLU,Fillers,NSNouns,LIVerbs,$,'',",",.,:,CC,CD,DT,EX,FW,IN,JJ,JJR,JJS,MD,NN,NNP,NNPS,NNS,PDT,POS,PRP,PRP$,RB,RBR,RBS,RP,TO,UH,VB,VBD,VBG,VBN,VBP,VBZ,WDT,WP,WRB,``,WP$,SYM,Segment,WC,Analytic,Clout,Authentic,Tone,WPS,Sixltr,Dic,function,pronoun,ppron,i,we,you,shehe,they,ipron,article,prep,auxverb,adverb,conj,negate,verb,adj,compare,interrog,number,quant,affect,posemo,negemo,anx,anger,sad,social,family,friend,female,male,cogproc,insight,cause,discrep,tentat,certain,differ,percept,see,hear,feel,bio,body,health,sexual,ingest,drives,affiliation,achieve,power,reward,risk,focuspast,focuspresent,focusfuture,relativ,motion,space,time,work,leisure,home,money,relig,death,informal,swear,netspeak,assent,nonflu,filler,AllPunc,Period,Comma,Colon,SemiC,QMark,Exclam,Dash,Quote,Apostro,Parenth,OtherP,Nouns,Nouns/100,NounsNormalised,Adjectives,Adjectives/100,AdjectivesNormalised,Adverbs,Adverbs/100,AdverbsNormalised,Verbs,Verbs/100,VerbsNormalised,Pronouns,PronounsNormalised,UniqueWordsNormalised,UniqueStemsNormalised
0,0,Bush - Speech1 - Edited.txt,27/01/1989,1989-01-27,0,2447553.5,0.2277812961790162,4737.0,1079.0,879.0,18.33910034602076,19.0,16.0,191.0,2.0,3.0,263.0,289.0,79.0,212.0,37.0,486.0,30.0,2.0,551.0,243.0,13.0,4.0,89.0,517.0,193.0,3.0,180.0,5.0,9.0,496.0,47.0,307.0,5.0,1.0,20.0,151.0,16.0,270.0,60.0,104.0,80.0,289.0,163.0,24.0,23.0,31.0,3.0,0.0,0.0,1,4434,42.64,45.77,75.3,66.73,15.29,17.34,90.84,59.79,17.95,10.08,5.64,1.94,1.06,0.54,0.9,7.87,6.9,14.68,11.25,5.57,7.69,2.66,20.37,3.68,2.17,1.47,1.11,2.32,4.58,3.34,1.17,0.23,0.29,0.11,8.73,0.02,0.07,0.09,0.61,14.7,3.56,1.47,1.94,3.16,1.89,4.49,2.19,0.81,0.9,0.41,0.43,0.11,0.2,0.0,0.09,8.64,2.5,1.17,3.11,1.65,0.72,2.82,14.5,1.76,13.89,2.41,8.28,3.72,3.25,0.27,0.14,1.38,0.02,0.09,0.83,0.0,0.02,0.54,0.29,0.0,20.64,6.11,5.93,0.25,0.23,0.52,0.0,2.12,0.14,4.94,0.0,0.41,893.0,8.93,0.1885159383576103,260.0,2.6,0.05488705932024488,313.0,3.13,0.06607557525860248,966.0,9.66,0.2039265357821406,543.0,0.11462951234958835,0.28679381072328175,0.2428931270241094
1,1,Bush - Speech2 - Edited.txt,06/02/1989,1989-02-06,10,2447563.5,0.2798232695139911,2037.0,570.0,482.0,19.87719298245614,14.0,5.0,102.0,0.0,0.0,112.0,114.0,18.0,92.0,10.0,223.0,12.0,0.0,217.0,97.0,3.0,6.0,58.0,196.0,69.0,2.0,76.0,2.0,2.0,177.0,17.0,162.0,3.0,1.0,11.0,97.0,3.0,160.0,39.0,35.0,57.0,109.0,49.0,6.0,19.0,12.0,0.0,0.0,0.0,1,1938,33.31,45.08,57.18,56.98,17.0,16.77,90.76,61.82,17.44,8.98,4.95,1.81,0.98,0.41,0.83,8.46,6.04,14.71,12.75,6.09,8.41,3.04,22.19,3.82,2.22,1.75,0.67,2.63,3.66,2.58,0.93,0.05,0.15,0.1,8.26,0.1,0.0,0.0,0.52,16.87,4.02,1.55,2.79,3.97,2.43,4.23,2.94,1.19,0.93,0.36,0.41,0.21,0.15,0.05,0.05,7.95,2.32,1.5,2.22,1.6,0.72,4.02,15.48,2.37,12.07,2.37,6.3,3.66,2.53,0.1,0.15,0.41,0.21,0.05,0.31,0.05,0.0,0.15,0.1,0.0,17.03,5.47,5.78,0.21,0.0,0.41,0.05,0.83,0.0,4.28,0.0,0.0,343.0,3.43,0.16838487972508592,106.0,1.06,0.052037309769268535,166.0,1.66,0.08149239077074129,449.0,4.49,0.22042218949435444,194.0,0.09523809523809523,0.2571667130531589,0.21486223211800723
2,2,Bush - Speech3 - Edited.txt,21/02/1989,1989-02-21,25,2447578.5,0.2817204301075269,2325.0,655.0,544.0,17.841379310344827,14.0,13.0,112.0,0.0,0.0,114.0,145.0,34.0,116.0,9.0,241.0,12.0,0.0,242.0,110.0,7.0,2.0,50.0,227.0,123.0,6.0,75.0,1.0,6.0,230.0,18.0,152.0,1.0,1.0,17.0,91.0,3.0,150.0,48.0,44.0,54.0,144.0,66.0,17.0,21.0,10.0,0.0,0.0,0.0,1,2192,36.39,44.93,56.25,44.11,15.01,15.65,90.01,61.68,18.89,9.99,6.07,1.87,0.68,0.91,0.46,8.9,6.84,14.32,12.32,5.84,7.62,2.33,21.58,2.92,1.82,1.46,0.68,2.33,4.29,2.51,1.51,0.27,0.5,0.32,7.71,0.0,0.05,0.0,1.09,13.55,3.33,1.23,1.6,3.47,1.96,3.15,2.51,1.19,0.87,0.46,0.41,0.18,0.18,0.0,0.09,8.44,2.19,0.96,3.6,1.37,0.68,3.83,14.92,2.1,11.91,2.42,7.53,2.28,3.19,0.27,0.18,0.59,0.09,0.09,0.59,0.0,0.09,0.23,0.32,0.0,18.66,6.52,5.2,0.14,0.32,0.32,0.0,1.32,0.0,4.74,0.0,0.09,431.0,4.31,0.1853763440860215,119.0,1.19,0.051182795698924734,154.0,1.54,0.06623655913978495,506.0,5.06,0.21763440860215053,248.0,0.10666666666666667,0.27158071748878926,0.2312219730941704
3,3,Bush - Speech4 - Edited.txt,24/02/1989,1989-02-24,28,2447581.5,0.3101604278074866,1309.0,406.0,354.0,18.1875,5.0,2.0,68.0,0.0,2.0,66.0,80.0,17.0,66.0,6.0,119.0,4.0,0.0,115.0,58.0,5.0,1.0,34.0,120.0,55.0,7.0,25.0,0.0,6.0,153.0,16.0,92.0,0.0,0.0,7.0,51.0,2.0,87.0,19.0,33.0,28.0,93.0,45.0,11.0,17.0,11.0,2.0,2.0,0.0,1,1210,17.92,24.88,85.21,85.19,15.12,15.29,93.06,62.4,21.16,11.74,8.51,0.66,0.25,1.24,1.07,9.42,5.54,12.89,13.8,5.62,8.26,3.39,23.06,3.8,2.15,2.64,0.5,1.82,6.12,4.71,1.32,0.17,0.17,0.08,8.43,0.08,0.0,0.0,1.32,14.38,4.05,1.65,1.57,2.73,1.49,4.21,2.15,0.99,0.5,0.66,0.58,0.08,0.25,0.0,0.25,8.68,1.24,1.49,4.46,1.65,0.91,2.73,17.19,3.64,13.31,2.31,7.77,4.3,2.64,0.41,0.0,0.08,0.0,0.0,0.58,0.0,0.0,0.08,0.5,0.0,20.17,6.28,5.45,0.08,0.33,0.33,0.08,0.99,0.33,6.12,0.0,0.17,207.0,2.07,0.15813598166539344,64.0,0.64,0.04889228418640183,92.0,0.92,0.07028265851795264,305.0,3.05,0.23300229182582124,169.0,0.12910618792971734,0.2639040348964013,0.22055616139585604
4,4,Bush - Speech5 - Edited.txt,25/02/1989,1989-02-25,29,2447582.5,0.2388906397730854,3173.0,758.0,641.0,18.892473118279568,13.0,11.0,132.0,0.0,3.0,154.0,186.0,28.0,171.0,10.0,354.0,25.0,0.0,353.0,164.0,5.0,2.0,68.0,336.0,102.0,13.0,104.0,0.0,6.0,318.0,39.0,243.0,6.0,1.0,16.0,97.0,1.0,177.0,55.0,54.0,69.0,193.0,97.0,27.0,19.0,15.0,3.0,0.0,0.0,1,3013,30.87,50.0,73.64,69.56,16.2,15.93,90.28,61.96,19.08,10.49,5.61,2.46,0.9,0.6,0.93,8.6,6.67,13.38,11.92,6.17,8.0,2.82,20.94,3.78,1.86,1.46,0.43,2.39,5.14,3.58,1.26,0.23,0.43,0.07,9.59,0.0,0.2,0.03,0.56,15.3,3.75,1.59,2.06,2.75,2.19,4.51,2.12,0.8,0.46,0.53,0.33,0.03,0.13,0.0,0.13,8.46,3.62,0.86,2.52,1.36,0.56,4.08,14.14,1.69,13.57,2.46,8.3,3.39,1.59,0.2,0.13,0.46,0.03,0.17,0.5,0.0,0.0,0.1,0.4,0.0,17.26,6.21,5.11,0.07,0.27,0.17,0.03,0.86,0.2,4.35,0.0,0.0,555.0,5.55,0.1749133312322723,171.0,1.71,0.05389221556886228,250.0,2.5,0.0787897888433659,645.0,6.45,0.20327765521588403,357.0,0.1125118184683265,0.2509773260359656,0.21553296846494657
5,5,Bush - Speech6 - Edited.txt,07/03/1989,1989-03-07,39,2447592.5,0.2411402157164869,3894.0,939.0,773.0,18.50423728813559,11.0,15.0,146.0,0.0,8.0,235.0,236.0,78.0,168.0,30.0,391.0,22.0,0.0,403.0,191.0,12.0,6.0,84.0,382.0,145.0,8.0,141.0,3.0,11.0,416.0,52.0,291.0,3.0,1.0,37.0,112.0,3.0,199.0,76.0,88.0,92.0,218.0,132.0,31.0,27.0,26.0,8.0,1.0,0.0,1,3671,39.41,51.42,67.19,44.2,15.56,15.58,89.65,60.17,18.58,10.79,5.75,1.53,1.58,1.33,0.6,7.79,6.67,13.81,11.17,5.99,6.84,2.62,20.48,2.81,1.5,1.66,1.14,2.45,3.98,2.48,1.47,0.3,0.35,0.16,9.4,0.03,0.05,0.0,1.55,13.81,3.35,1.93,1.61,2.94,1.69,3.79,2.34,0.9,1.04,0.35,0.38,0.14,0.11,0.03,0.11,8.72,2.07,1.53,3.7,1.8,0.68,3.43,13.92,2.4,13.73,2.62,7.95,3.92,3.11,0.14,0.22,0.49,0.05,0.08,0.38,0.0,0.0,0.11,0.22,0.0,20.16,6.13,6.43,0.11,0.38,0.33,0.05,2.26,0.44,3.95,0.0,0.08,676.0,6.76,0.17360041088854647,209.0,2.09,0.05367231638418079,295.0,2.95,0.07575757575757576,805.0,8.05,0.20672829994863892,468.0,0.12018489984591679,0.24605433376455368,0.2056921086675291
6,6,Bush - Speech7 - Edited.txt,10/03/1989,1989-03-10,42,2447595.5,0.2845714285714286,1750.0,498.0,435.0,17.025862068965516,12.0,4.0,84.0,0.0,0.0,109.0,116.0,29.0,106.0,10.0,145.0,8.0,0.0,160.0,78.0,1.0,3.0,49.0,134.0,76.0,2.0,42.0,0.0,2.0,223.0,14.0,151.0,0.0,1.0,14.0,62.0,6.0,118.0,66.0,24.0,44.0,96.0,52.0,9.0,14.0,11.0,0.0,0.0,0.0,1,1637,17.51,44.18,79.58,60.51,14.11,13.13,92.18,62.68,21.32,12.58,6.84,2.63,0.86,1.65,0.61,8.74,5.31,12.46,12.58,5.99,9.41,2.5,23.7,2.99,1.28,1.77,0.67,1.59,3.97,2.87,1.04,0.12,0.31,0.06,9.65,0.0,0.0,0.12,1.53,14.84,4.15,1.59,1.28,2.69,1.41,4.83,2.5,0.55,1.1,0.79,0.55,0.49,0.06,0.43,0.0,9.04,2.87,1.1,3.48,1.59,0.37,6.41,15.64,2.87,13.07,3.12,5.86,5.25,1.71,0.06,0.24,0.37,0.06,0.0,1.22,0.43,0.0,0.43,0.37,0.0,20.89,6.9,6.66,0.0,0.12,0.37,0.0,1.71,0.0,5.13,0.0,0.0,254.0,2.54,0.14514285714285713,82.0,0.82,0.046857142857142854,152.0,1.52,0.08685714285714285,400.0,4.0,0.22857142857142856,237.0,0.13542857142857143,0.27155053704213716,0.2299641971908565
7,7,Bush - Speech9 - Edited.txt,07/04/1989,1989-04-07,70,2447623.5,0.3483309143686502,1378.0,480.0,416.0,20.13157894736842,9.0,1.0,60.0,0.0,0.0,73.0,76.0,19.0,71.0,3.0,128.0,4.0,0.0,168.0,77.0,2.0,1.0,32.0,138.0,57.0,9.0,54.0,0.0,2.0,125.0,11.0,80.0,1.0,1.0,11.0,63.0,4.0,101.0,23.0,26.0,28.0,73.0,39.0,10.0,10.0,10.0,0.0,0.0,0.0,1,1336,61.35,61.78,45.74,86.63,17.58,20.13,88.32,59.36,15.64,9.51,4.27,2.25,0.82,0.82,1.35,6.14,6.51,16.62,10.48,4.34,7.63,1.95,17.74,3.67,2.1,1.65,0.37,2.4,5.31,4.42,0.9,0.22,0.37,0.0,10.48,0.0,0.07,0.0,1.05,13.92,3.14,1.42,2.1,2.54,1.72,4.34,2.77,1.5,0.67,0.6,0.6,0.0,0.3,0.0,0.3,9.36,4.12,1.42,2.62,1.12,0.45,2.32,13.1,1.5,11.53,2.1,7.34,2.4,2.17,0.22,0.22,0.0,0.07,0.07,0.6,0.0,0.0,0.3,0.22,0.0,15.87,5.54,5.46,0.22,0.22,0.3,0.0,1.95,0.0,2.02,0.0,0.15,258.0,2.58,0.18722786647314948,80.0,0.8,0.05805515239477504,82.0,0.82,0.059506531204644414,290.0,2.9,0.2104499274310595,136.0,0.09869375907111756,0.2835348301669545,0.24467472654001152
8,8,Bush - Speech10 - Edited.txt,21/05/1989,1989-05-21,114,2447667.5,0.3506969919295671,1363.0,478.0,416.0,19.68831168831169,9.0,1.0,61.0,0.0,0.0,73.0,77.0,17.0,71.0,4.0,127.0,4.0,0.0,165.0,76.0,2.0,0.0,31.0,135.0,57.0,9.0,54.0,0.0,2.0,122.0,10.0,81.0,1.0,2.0,11.0,63.0,4.0,101.0,23.0,26.0,27.0,72.0,39.0,10.0,10.0,10.0,0.0,0.0,0.0,1,1326,61.83,60.71,47.25,87.69,17.22,20.06,88.24,59.43,15.46,9.28,4.22,2.26,0.75,0.75,1.28,6.18,6.49,16.67,10.41,4.37,7.62,2.04,17.8,3.62,2.11,1.66,0.38,2.26,5.28,4.45,0.83,0.23,0.38,0.0,10.26,0.0,0.08,0.0,0.98,13.8,3.09,1.43,2.11,2.49,1.66,4.3,2.79,1.51,0.68,0.6,0.53,0.0,0.23,0.0,0.3,9.35,4.15,1.51,2.56,1.06,0.45,2.26,13.27,1.51,11.84,2.26,7.47,2.41,2.11,0.23,0.23,0.0,0.08,0.08,0.6,0.0,0.0,0.3,0.23,0.0,15.38,5.58,5.51,0.23,0.23,0.38,0.0,1.43,0.0,1.89,0.0,0.15,255.0,2.55,0.18708730741012472,78.0,0.78,0.05722670579603815,84.0,0.84,0.061628760088041086,288.0,2.88,0.21129860601614087,132.0,0.09684519442406456,0.23955296404275997,0.20262390670553937
9,9,Bush - Speech11 - Edited.txt,30/05/1989,1989-05-30,123,2447676.5,0.2883959044368601,2344.0,676.0,579.0,19.66417910447761,13.0,5.0,104.0,0.0,2.0,154.0,134.0,36.0,119.0,17.0,212.0,13.0,2.0,239.0,144.0,5.0,1.0,67.0,219.0,76.0,9.0,79.0,0.0,1.0,249.0,28.0,184.0,4.0,0.0,9.0,87.0,6.0,159.0,64.0,33.0,62.0,115.0,59.0,15.0,17.0,12.0,2.0,1.0,0.0,1,2230,25.27,52.69,50.51,80.91,16.64,17.26,89.55,60.63,19.64,10.13,5.29,2.51,0.81,0.58,0.94,9.46,5.25,12.56,12.33,5.78,7.8,2.51,21.3,3.18,1.61,1.66,1.08,2.42,4.53,3.72,0.67,0.04,0.09,0.18,9.01,0.0,0.18,0.0,0.63,15.29,3.86,1.61,2.83,3.59,1.66,3.86,2.24,0.85,1.12,0.27,0.45,0.27,0.04,0.0,0.13,9.37,4.26,1.39,2.78,1.66,0.36,4.62,13.5,2.2,11.48,2.24,6.5,3.14,2.33,0.13,0.18,0.36,0.09,0.0,1.03,0.0,0.0,0.4,0.54,0.09,19.01,5.56,6.95,0.13,0.22,0.54,0.0,1.7,0.18,3.63,0.0,0.09,383.0,3.83,0.16339590443686006,150.0,1.5,0.06399317406143344,188.0,1.88,0.08020477815699659,492.0,4.92,0.2098976109215017,277.0,0.1181740614334471,0.2488062327217894,0.20985172153807488
10,10,Bush - Speech12 - Edited.txt,05/06/1989,1989-06-05,129,2447682.5,0.2858435097241067,2211.0,632.0,548.0,21.136752136752136,13.0,3.0,71.0,0.0,0.0,141.0,117.0,29.0,99.0,8.0,224.0,10.0,0.0,245.0,128.0,4.0,3.0,42.0,247.0,78.0,5.0,86.0,1.0,3.0,219.0,28.0,168.0,6.0,0.0,5.0,85.0,3.0,130.0,50.0,36.0,43.0,137.0,56.0,9.0,20.0,8.0,0.0,0.0,0.0,1,2119,50.8,58.04,73.28,66.84,17.96,18.17,88.34,59.6,17.79,9.63,5.14,1.6,0.99,0.42,1.46,8.16,7.55,14.35,9.82,5.52,7.46,1.98,18.59,3.54,1.84,1.46,0.42,1.75,4.48,3.26,1.09,0.28,0.24,0.14,9.39,0.09,0.19,0.0,0.52,11.85,3.35,1.98,1.56,1.56,1.04,2.83,2.55,1.56,0.38,0.47,0.52,0.09,0.24,0.0,0.09,7.93,2.78,0.99,3.4,0.85,0.52,3.73,13.45,1.51,15.38,2.74,8.16,5.05,1.46,0.24,0.05,0.14,0.0,0.05,0.52,0.0,0.0,0.28,0.24,0.0,17.23,5.47,6.65,0.19,0.38,0.14,0.0,1.09,0.0,3.3,0.0,0.0,416.0,4.16,0.18815015829941203,135.0,1.35,0.06105834464043419,174.0,1.74,0.07869742198100407,452.0,4.52,0.20443238353686116,247.0,0.1117141564902759,0.2575019235701462,0.21697871249038214
11,11,Bush - Speech13 - Edited.txt,08/06/1989,1989-06-08,132,2447685.5,0.2483204777307788,4019.0,998.0,832.0,18.14516129032258,19.0,7.0,140.0,0.0,6.0,228.0,248.0,64.0,212.0,22.0,352.0,28.0,1.0,419.0,215.0,11.0,2.0,96.0,395.0,153.0,19.0,157.0,2.0,6.0,418.0,50.0,270.0,2.0,3.0,24.0,120.0,12.0,255.0,105.0,70.0,99.0,222.0,131.0,21.0,36.0,17.0,6.0,3.0,0.0,1,3790,35.86,74.37,42.18,53.55,15.28,17.12,88.58,58.6,18.39,10.74,4.27,2.66,1.35,1.35,1.11,7.65,6.25,12.93,11.82,4.78,7.81,2.4,21.03,3.03,1.56,1.66,0.92,1.93,4.85,3.11,1.64,0.18,0.42,0.29,12.9,0.08,0.11,0.32,1.21,13.54,3.35,1.61,2.43,2.66,1.45,3.69,2.59,1.06,1.06,0.42,0.71,0.11,0.4,0.05,0.13,9.26,3.75,1.69,2.72,1.27,0.84,4.38,13.85,1.82,12.27,2.74,7.02,3.35,2.19,0.32,0.11,0.26,0.05,0.08,0.69,0.0,0.0,0.37,0.32,0.0,19.45,6.39,6.12,0.13,0.53,0.29,0.0,1.35,0.32,4.27,0.0,0.05,724.0,7.24,0.18014431450609605,228.0,2.28,0.05673052998258273,275.0,2.75,0.06842498133864146,882.0,8.82,0.21945757651157005,468.0,0.11644687733266981,0.2570056044835869,0.2201761409127302
12,12,Bush - Speech14 - Edited.txt,27/06/1989,1989-06-27,151,2447704.5,0.2259700176366843,4536.0,1025.0,840.0,19.10188679245283,14.0,13.0,192.0,1.0,5.0,252.0,265.0,76.0,222.0,19.0,411.0,15.0,1.0,492.0,233.0,6.0,8.0,95.0,435.0,227.0,20.0,162.0,4.0,7.0,454.0,60.0,301.0,5.0,1.0,20.0,174.0,17.0,291.0,76.0,97.0,92.0,291.0,135.0,19.0,53.0,15.0,5.0,0.0,0.0,1,4290,41.68,49.25,58.76,72.47,16.07,17.51,89.51,59.21,18.11,10.28,6.13,1.89,1.1,0.58,0.58,7.83,6.46,14.08,11.63,4.94,7.44,2.31,21.42,3.59,1.66,1.68,0.63,1.68,4.27,3.31,0.82,0.09,0.26,0.19,9.51,0.07,0.19,0.19,0.54,13.99,3.1,1.14,2.31,3.03,1.68,4.24,2.8,1.45,0.77,0.51,0.28,0.12,0.09,0.02,0.09,8.3,2.98,1.61,2.77,1.68,0.33,3.17,15.34,2.54,11.75,2.54,6.6,3.15,2.56,0.47,0.05,0.75,0.07,0.0,0.79,0.0,0.0,0.49,0.26,0.0,18.74,5.94,5.9,0.21,0.42,0.42,0.0,1.63,0.23,3.82,0.0,0.16,844.0,8.44,0.18606701940035272,247.0,2.47,0.05445326278659612,307.0,3.07,0.06768077601410935,982.0,9.82,0.21649029982363316,514.0,0.11331569664902998,0.2505347593582888,0.20935828877005347
13,13,Bush - Speech15 - Edited.txt,06/07/1989,1989-07-06,160,2447713.5,0.228515625,3584.0,819.0,684.0,21.73224043715847,6.0,8.0,150.0,2.0,3.0,204.0,183.0,64.0,167.0,20.0,334.0,8.0,2.0,400.0,208.0,13.0,5.0,96.0,341.0,136.0,19.0,142.0,3.0,10.0,349.0,40.0,237.0,6.0,1.0,21.0,143.0,6.0,258.0,42.0,87.0,48.0,190.0,116.0,18.0,29.0,22.0,3.0,1.0,0.0,1,3370,40.96,71.56,52.04,81.01,18.42,17.15,88.64,59.73,18.61,10.39,3.89,4.09,1.34,0.59,0.47,8.22,5.82,14.96,11.16,4.75,7.8,2.61,20.18,3.95,1.9,1.66,0.71,2.08,5.04,4.01,0.95,0.27,0.03,0.12,11.34,0.03,0.15,0.0,0.65,13.26,2.61,1.19,2.34,3.77,1.22,4.54,2.4,0.86,1.04,0.5,0.27,0.24,0.0,0.0,0.03,11.48,5.31,2.05,2.67,2.05,0.71,2.31,14.84,2.28,13.2,3.18,8.46,2.05,2.7,0.15,0.21,0.68,0.06,0.0,0.5,0.03,0.0,0.24,0.24,0.0,19.23,5.52,6.05,0.18,0.47,0.24,0.0,1.81,0.18,4.72,0.0,0.06,638.0,6.38,0.17801339285714285,226.0,2.26,0.06305803571428571,244.0,2.44,0.06808035714285714,741.0,7.41,0.20675223214285715,389.0,0.10853794642857142,0.2594534915815622,0.21887938172784985
14,14,Bush - Speech16 - Edited.txt,16/07/1989,1989-07-16,170,2447723.5,0.2412689949346841,3751.0,905.0,748.0,19.9,23.0,8.0,112.0,0.0,4.0,214.0,210.0,79.0,194.0,20.0,388.0,30.0,3.0,407.0,184.0,20.0,2.0,66.0,418.0,158.0,6.0,121.0,0.0,12.0,348.0,38.0,279.0,7.0,2.0,23.0,112.0,4.0,190.0,135.0,70.0,72.0,154.0,123.0,16.0,38.0,27.0,4.0,1.0,0.0,1,3539,39.9,67.33,59.26,56.17,16.85,16.59,89.63,60.02,17.43,8.93,3.7,2.49,1.44,0.76,0.54,8.51,7.06,13.53,10.6,6.53,8.25,2.32,19.13,4.04,2.26,2.03,0.73,2.83,4.07,2.83,1.22,0.2,0.34,0.17,10.45,0.0,0.06,0.0,0.9,13.59,3.76,1.44,1.7,3.11,1.38,3.84,1.89,0.82,0.76,0.25,0.45,0.17,0.08,0.03,0.2,8.79,3.9,1.41,1.92,1.53,0.82,4.94,11.84,1.7,13.56,2.63,7.88,3.22,2.29,0.14,0.4,1.24,0.03,0.06,0.79,0.03,0.0,0.2,0.54,0.03,18.85,6.05,6.05,0.14,0.17,0.23,0.03,2.18,0.23,3.73,0.0,0.06,703.0,7.03,0.18741668888296453,206.0,2.06,0.05491868834977339,288.0,2.88,0.07677952545987736,744.0,7.44,0.19834710743801653,386.0,0.10290589176219675,0.2573898494143893,0.21751254880089235
15,15,Bush - Speech17 - Edited.txt,28/07/1989,1989-07-28,182,2447735.5,0.2746781115879828,2796.0,768.0,651.0,20.72,12.0,7.0,117.0,2.0,0.0,160.0,150.0,46.0,120.0,18.0,296.0,12.0,0.0,298.0,131.0,5.0,3.0,64.0,290.0,133.0,5.0,79.0,0.0,8.0,292.0,19.0,206.0,2.0,1.0,13.0,87.0,0.0,175.0,62.0,68.0,68.0,148.0,89.0,21.0,26.0,10.0,0.0,0.0,1.0,1,2630,39.39,40.08,55.71,63.98,17.53,17.64,90.0,60.04,18.06,9.81,6.08,1.71,1.1,0.46,0.46,8.25,7.38,13.27,11.67,5.48,7.38,2.78,21.71,3.08,1.6,1.71,0.8,2.43,5.7,3.69,1.67,0.11,0.46,0.38,8.02,0.04,0.0,0.0,0.65,14.87,3.61,1.63,2.66,3.27,1.33,4.49,2.17,0.95,0.57,0.53,0.57,0.19,0.27,0.0,0.11,8.48,2.24,2.17,2.66,1.94,0.76,3.65,14.87,1.86,10.8,2.17,6.43,2.47,2.93,0.3,0.27,0.99,0.04,0.0,0.49,0.0,0.04,0.0,0.46,0.0,18.52,5.67,6.08,0.08,0.34,0.11,0.0,1.52,0.0,4.37,0.0,0.34,507.0,5.07,0.1813304721030043,139.0,1.39,0.04971387696709585,209.0,2.09,0.07474964234620887,610.0,6.1,0.21816881258941345,311.0,0.11123032904148784,0.2627262443438914,0.22483031674208145
16,16,Bush - Speech18 - Edited.txt,15/08/1989,1989-08-15,200,2447753.5,0.2598930481283422,2805.0,729.0,622.0,21.12837837837838,12.0,3.0,124.0,0.0,3.0,170.0,148.0,35.0,123.0,4.0,308.0,24.0,0.0,342.0,167.0,10.0,0.0,80.0,292.0,94.0,11.0,108.0,3.0,1.0,260.0,25.0,193.0,5.0,1.0,14.0,95.0,6.0,189.0,43.0,53.0,61.0,144.0,72.0,11.0,20.0,11.0,1.0,0.0,0.0,1,2671,48.14,59.31,56.97,59.82,18.05,17.41,90.49,59.94,16.47,9.02,4.12,2.43,1.46,0.45,0.56,7.45,7.3,14.68,11.64,5.84,7.23,2.4,20.22,3.52,2.17,1.27,0.26,2.92,5.02,3.33,1.54,0.26,0.3,0.22,8.99,0.07,0.04,0.0,0.52,15.28,3.56,1.72,2.7,3.82,1.57,3.97,1.83,0.67,0.67,0.45,0.71,0.07,0.6,0.04,0.04,9.62,3.33,1.68,2.77,1.61,0.79,3.59,14.08,1.65,13.55,2.55,8.16,3.52,1.98,0.26,0.11,0.26,0.07,0.11,0.9,0.04,0.0,0.3,0.52,0.0,18.01,5.43,6.36,0.11,0.22,0.3,0.0,1.42,0.15,3.93,0.0,0.07,505.0,5.05,0.1800356506238859,177.0,1.77,0.06310160427807486,199.0,1.99,0.07094474153297682,562.0,5.62,0.20035650623885917,285.0,0.10160427807486631,0.2518775274407857,0.21663778162911612
17,17,Bush - Speech19 - Edited.txt,23/08/1989,1989-08-23,208,2447761.5,0.2314730100640439,4372.0,1012.0,832.0,19.647773279352226,22.0,10.0,181.0,1.0,4.0,232.0,247.0,74.0,220.0,22.0,488.0,28.0,0.0,496.0,229.0,14.0,8.0,101.0,466.0,184.0,17.0,163.0,0.0,3.0,423.0,49.0,299.0,4.0,3.0,22.0,122.0,7.0,257.0,75.0,69.0,80.0,234.0,139.0,28.0,29.0,12.0,4.0,0.0,0.0,1,4133,40.71,48.84,58.0,83.73,16.73,16.38,90.83,60.17,18.22,9.56,5.35,1.62,0.82,0.7,1.06,8.66,7.36,13.55,11.61,5.23,7.77,2.32,19.33,4.43,1.96,1.11,0.65,2.27,5.95,4.5,1.23,0.17,0.24,0.17,8.47,0.05,0.48,0.07,0.87,13.91,3.39,1.45,1.72,3.44,1.65,3.53,2.06,1.04,0.46,0.41,0.27,0.02,0.19,0.0,0.05,9.97,2.64,1.91,3.73,1.77,0.92,3.17,14.11,1.67,12.36,2.25,7.89,2.54,2.88,0.39,0.22,0.58,0.15,0.0,0.73,0.0,0.0,0.24,0.48,0.0,18.12,5.86,5.61,0.05,0.29,0.19,0.0,1.79,0.19,4.11,0.0,0.02,830.0,8.3,0.1898444647758463,251.0,2.51,0.057410795974382436,306.0,3.06,0.06999085086916743,854.0,8.54,0.19533394327538883,472.0,0.10795974382433669,0.2577951002227171,0.21603563474387527
18,18,Bush - Speech20 - Edited.txt,31/08/1989,1989-08-31,216,2447769.5,0.2887588800668617,2393.0,691.0,582.0,21.524193548387096,9.0,9.0,94.0,0.0,1.0,148.0,124.0,39.0,106.0,7.0,223.0,20.0,0.0,290.0,120.0,6.0,3.0,49.0,251.0,120.0,10.0,95.0,1.0,8.0,202.0,23.0,164.0,5.0,1.0,15.0,95.0,5.0,138.0,35.0,74.0,45.0,106.0,86.0,13.0,14.0,23.0,1.0,1.0,2.0,1,2289,51.44,68.92,54.44,68.64,18.46,18.17,89.25,59.63,16.16,8.61,3.45,3.41,0.61,0.83,0.31,7.56,6.51,15.68,10.66,6.64,7.34,1.83,19.13,3.98,2.1,1.79,0.66,1.92,4.98,3.54,1.27,0.22,0.17,0.13,9.74,0.0,0.31,0.04,0.92,13.94,3.32,1.57,2.18,3.06,2.05,3.54,1.83,0.83,0.35,0.52,0.48,0.09,0.22,0.0,0.17,11.14,4.89,2.01,3.1,1.18,0.83,2.62,13.06,2.62,14.37,3.01,8.34,3.54,2.58,0.44,0.09,0.61,0.35,0.0,0.79,0.0,0.0,0.26,0.52,0.0,17.34,5.46,6.47,0.17,0.31,0.13,0.0,1.53,0.09,3.01,0.0,0.17,476.0,4.76,0.19891349770162975,129.0,1.29,0.053907229419139155,170.0,1.7,0.0710405348934392,484.0,4.84,0.20225658169661512,225.0,0.09402423735896365,0.273678094131319,0.22922719349215573
19,19,Bush - Speech21 - Edited.txt,06/09/1989,1989-09-06,222,2447775.5,0.2529824561403508,2850.0,721.0,606.0,20.025316455696203,18.0,7.0,119.0,4.0,2.0,151.0,158.0,51.0,150.0,28.0,303.0,17.0,0.0,296.0,174.0,12.0,1.0,52.0,317.0,96.0,5.0,113.0,1.0,5.0,269.0,23.0,190.0,6.0,1.0,18.0,90.0,8.0,162.0,34.0,71.0,60.0,152.0,102.0,14.0,14.0,12.0,2.0,0.0,0.0,1,2688,43.04,63.39,40.33,72.44,16.91,17.93,90.66,58.89,17.0,8.37,3.5,2.16,1.08,0.63,1.0,8.63,7.07,13.73,11.35,5.51,8.04,2.31,19.68,3.42,1.79,1.23,1.34,2.05,5.54,3.91,1.41,0.11,0.45,0.19,9.9,0.37,0.26,0.19,0.67,12.98,2.86,2.01,2.08,3.2,1.15,3.91,1.75,0.67,0.56,0.33,1.12,0.15,0.82,0.04,0.04,10.64,3.46,1.82,3.57,1.9,0.56,2.6,15.14,1.6,11.98,2.05,7.7,2.53,3.87,0.41,0.33,1.38,0.04,0.07,0.86,0.0,0.04,0.26,0.52,0.0,18.08,5.73,5.62,0.26,0.22,0.26,0.07,1.53,0.15,4.02,0.0,0.22,531.0,5.31,0.1863157894736842,187.0,1.87,0.0656140350877193,197.0,1.97,0.06912280701754386,581.0,5.81,0.20385964912280702,292.0,0.10245614035087719,0.24057084607543322,0.20489296636085627
20,20,Bush - Speech22 - Edited.txt,18/09/1989,1989-09-18,234,2447787.5,0.2402458578300374,3742.0,899.0,745.0,19.70754716981132,20.0,13.0,172.0,0.0,0.0,214.0,212.0,67.0,183.0,25.0,371.0,32.0,1.0,405.0,202.0,15.0,7.0,98.0,380.0,149.0,9.0,111.0,1.0,5.0,368.0,40.0,296.0,5.0,1.0,23.0,114.0,2.0,256.0,60.0,76.0,62.0,214.0,101.0,29.0,28.0,16.0,0.0,0.0,0.0,1,3527,36.52,46.14,76.13,73.43,16.72,16.59,90.39,60.5,18.26,9.84,4.91,2.61,1.05,0.34,0.94,8.36,6.41,13.89,11.4,5.95,7.4,3.06,20.98,3.4,1.59,1.42,0.96,2.32,4.88,3.66,1.11,0.23,0.37,0.14,8.39,0.0,0.03,0.0,0.4,15.68,3.8,1.22,2.21,3.35,1.67,5.02,2.58,0.71,1.19,0.6,0.4,0.2,0.17,0.03,0.03,8.36,3.46,1.11,2.44,1.33,0.65,2.75,15.51,2.27,14.09,3.23,8.19,3.23,2.47,0.11,0.2,0.65,0.06,0.03,0.85,0.03,0.03,0.14,0.65,0.0,19.05,5.87,6.12,0.23,0.28,0.2,0.0,1.59,0.0,4.56,0.0,0.2,649.0,6.49,0.1734366648850882,224.0,2.24,0.05986103687867451,302.0,3.02,0.08070550507749866,769.0,7.69,0.2055050774986638,408.0,0.10903260288615714,0.23919172932330826,0.19713345864661655
21,21,Bush - Speech23 - Edited.txt,13/10/1989,1989-10-13,259,2447812.5,0.2372340425531915,2820.0,669.0,555.0,16.746031746031747,12.0,13.0,121.0,0.0,0.0,149.0,189.0,48.0,130.0,13.0,302.0,23.0,0.0,270.0,139.0,8.0,5.0,75.0,281.0,87.0,2.0,80.0,5.0,5.0,314.0,29.0,205.0,4.0,0.0,25.0,88.0,9.0,183.0,60.0,63.0,53.0,168.0,87.0,13.0,37.0,16.0,0.0,0.0,0.0,1,2625,21.17,34.3,64.56,55.96,13.67,14.9,91.89,63.09,20.3,11.12,6.82,2.29,1.22,0.34,0.46,9.18,6.25,12.61,13.56,5.37,7.28,4.5,22.78,3.35,1.87,2.25,0.69,2.74,5.03,3.28,1.68,0.3,0.99,0.11,9.3,0.0,0.04,0.0,0.42,16.27,2.59,1.94,2.13,3.43,2.29,5.49,3.12,1.68,1.03,0.42,0.34,0.08,0.23,0.04,0.04,9.22,2.9,1.75,3.43,2.17,0.42,4.42,16.15,1.94,10.82,1.83,6.67,2.63,2.32,0.27,0.15,0.19,0.11,0.04,1.07,0.04,0.04,0.53,0.42,0.04,21.56,7.16,5.68,0.23,0.23,0.34,0.0,1.64,0.0,6.13,0.0,0.15,450.0,4.5,0.1595744680851064,152.0,1.52,0.05390070921985816,209.0,2.09,0.07411347517730496,614.0,6.14,0.21773049645390072,343.0,0.12163120567375886,0.25572621934788464,0.21719213150094313
22,22,Bush - Speech24 - Edited.txt,28/10/1989,1989-10-28,274,2447827.5,0.2436433859028001,3107.0,757.0,627.0,18.808743169398905,6.0,6.0,107.0,0.0,0.0,145.0,183.0,64.0,141.0,21.0,312.0,17.0,0.0,311.0,174.0,4.0,0.0,76.0,330.0,89.0,9.0,94.0,0.0,10.0,324.0,34.0,217.0,4.0,2.0,16.0,117.0,9.0,205.0,83.0,76.0,63.0,145.0,105.0,22.0,28.0,12.0,0.0,0.0,0.0,1,2931,37.57,59.02,32.36,70.69,16.02,16.65,90.41,60.39,18.83,10.47,4.71,1.91,0.82,2.22,0.82,8.36,6.99,13.07,12.25,5.15,6.69,2.52,21.05,2.8,0.72,1.64,1.02,2.39,6.0,4.16,1.77,0.0,0.89,0.34,10.92,0.1,0.07,0.03,2.42,14.5,3.07,1.23,2.42,3.17,1.84,4.13,2.63,0.92,0.85,0.78,0.24,0.03,0.17,0.03,0.03,8.46,2.66,1.47,2.87,1.5,0.61,4.06,14.19,1.6,10.99,2.22,6.35,2.66,2.18,0.58,0.17,0.48,0.07,0.0,0.68,0.0,0.03,0.31,0.31,0.0,18.39,6.14,4.95,0.27,0.17,0.34,0.03,2.15,0.0,4.26,0.0,0.07,522.0,5.22,0.16800772449308013,178.0,1.78,0.05728999034438365,223.0,2.23,0.07177341486964918,677.0,6.77,0.2178950756356614,358.0,0.11522368844544577,0.2630992196209587,0.22826086956521738
23,23,Bush - Speech25 - Edited.txt,31/10/1989,1989-10-31,277,2447830.5,0.1951332560834299,4315.0,842.0,695.0,19.23293172690763,18.0,16.0,195.0,0.0,4.0,216.0,249.0,70.0,198.0,29.0,451.0,30.0,5.0,448.0,185.0,9.0,3.0,103.0,405.0,151.0,10.0,141.0,8.0,5.0,479.0,38.0,312.0,3.0,3.0,26.0,142.0,6.0,270.0,103.0,98.0,106.0,255.0,129.0,20.0,37.0,38.0,4.0,0.0,0.0,1,4011,27.33,57.23,64.39,66.8,16.04,15.11,91.05,62.4,19.97,11.04,5.61,2.87,1.17,0.7,0.7,8.93,6.43,13.76,12.84,5.96,7.75,3.07,22.61,2.99,1.62,2.04,0.82,2.09,3.76,2.97,0.8,0.22,0.2,0.17,10.62,0.0,0.1,0.0,0.72,15.03,3.34,2.44,1.89,2.84,1.72,4.16,2.77,1.17,1.07,0.47,0.52,0.4,0.07,0.0,0.05,9.15,3.66,1.5,2.42,2.32,0.32,4.81,14.63,2.62,12.69,2.89,7.16,3.32,2.97,0.22,0.15,0.32,0.1,0.0,0.75,0.0,0.0,0.15,0.6,0.0,20.24,6.63,5.39,0.2,0.2,0.2,0.0,1.57,0.2,5.66,0.0,0.2,707.0,7.07,0.1638470451911935,197.0,1.97,0.045654692931633836,318.0,3.18,0.07369640787949015,961.0,9.61,0.2227114716106605,517.0,0.11981460023174971,0.2679087696755541,0.23128814648249277
24,24,Bush - Speech26 - Edited.txt,07/11/1989,1989-11-07,284,2447837.5,0.2335433412991527,4603.0,1075.0,860.0,17.033112582781456,9.0,10.0,172.0,1.0,1.0,232.0,302.0,64.0,187.0,32.0,467.0,24.0,0.0,473.0,228.0,5.0,10.0,90.0,479.0,156.0,5.0,176.0,4.0,13.0,486.0,44.0,349.0,4.0,2.0,29.0,185.0,4.0,283.0,92.0,95.0,74.0,277.0,156.0,26.0,51.0,37.0,1.0,0.0,0.0,1,4376,41.15,51.65,64.43,72.8,14.49,17.32,90.06,59.32,18.85,10.24,5.32,1.44,1.26,1.01,1.21,8.62,6.54,13.87,10.35,5.92,6.7,2.67,20.29,3.66,1.39,2.17,0.96,2.4,5.55,3.91,1.39,0.18,0.53,0.09,9.96,0.07,0.09,0.09,1.07,14.58,3.68,1.55,1.9,3.43,1.92,4.23,2.24,1.01,0.82,0.34,0.48,0.11,0.25,0.09,0.11,8.84,2.58,1.71,2.81,2.03,0.64,3.22,15.29,1.6,12.89,2.79,7.43,3.38,2.26,0.41,0.23,0.66,0.16,0.07,0.64,0.02,0.0,0.21,0.41,0.0,18.53,6.63,5.3,0.16,0.11,0.48,0.0,1.55,0.05,4.23,0.0,0.02,816.0,8.16,0.1772756897675429,243.0,2.43,0.052791657614599176,355.0,3.55,0.0771236150336737,977.0,9.77,0.21225287855746253,530.0,0.11514229850097762,0.26822157434402333,0.2294460641399417
25,25,Bush - Speech27 - Edited.txt,04/12/1989,1989-12-04,311,2447864.5,0.2574903589439336,3371.0,868.0,722.0,17.30275229357798,13.0,8.0,121.0,0.0,5.0,172.0,218.0,51.0,138.0,16.0,346.0,18.0,1.0,371.0,196.0,9.0,10.0,58.0,329.0,148.0,10.0,118.0,1.0,2.0,372.0,41.0,231.0,7.0,2.0,20.0,115.0,4.0,208.0,118.0,53.0,49.0,164.0,100.0,21.0,25.0,20.0,5.0,0.0,0.0,1,3209,46.73,65.51,41.8,71.93,14.72,16.08,89.44,59.8,18.42,11.06,4.67,2.49,1.03,2.43,0.44,7.35,7.29,14.4,10.97,5.33,6.7,2.37,20.01,4.3,2.37,1.62,0.75,2.18,4.64,3.49,1.03,0.19,0.22,0.06,11.0,0.0,0.16,0.03,2.49,13.15,3.27,1.68,2.06,3.27,0.97,3.49,2.24,1.06,0.56,0.59,0.34,0.19,0.06,0.0,0.09,9.29,3.8,1.28,2.87,1.68,0.62,4.55,12.9,1.37,12.81,2.49,8.1,2.84,2.12,0.25,0.16,1.15,0.0,0.06,0.69,0.0,0.0,0.25,0.44,0.0,18.73,6.95,5.36,0.31,0.12,0.41,0.0,1.5,0.31,3.58,0.0,0.19,605.0,6.05,0.17947196677543756,215.0,2.15,0.06377929397804806,240.0,2.4,0.07119549095223969,692.0,6.92,0.20528033224562445,413.0,0.12251557401364581,0.24646572419311816,0.20672179247799413
26,26,Bush - Speech28 - Edited.txt,16/12/1989,1989-12-16,323,2447876.5,0.3017492711370262,2058.0,621.0,531.0,20.889908256880734,7.0,2.0,67.0,0.0,1.0,106.0,109.0,30.0,98.0,9.0,216.0,9.0,0.0,222.0,102.0,2.0,2.0,62.0,186.0,134.0,10.0,74.0,1.0,3.0,217.0,17.0,127.0,7.0,1.0,8.0,68.0,3.0,126.0,45.0,37.0,53.0,119.0,47.0,9.0,9.0,6.0,1.0,1.0,0.0,1,1975,46.64,65.37,38.78,66.05,18.29,18.53,88.15,58.13,17.52,10.28,4.61,3.44,0.86,0.71,0.66,7.24,6.99,13.57,10.99,4.71,7.24,2.23,20.0,3.59,1.92,0.86,0.71,2.08,4.96,3.54,1.42,0.46,0.2,0.2,10.08,0.0,0.1,0.0,0.81,13.67,3.7,1.32,2.73,2.48,1.27,3.59,2.68,1.67,0.76,0.25,0.71,0.1,0.1,0.0,0.51,9.97,4.25,1.32,3.04,1.52,0.56,3.59,12.81,1.97,10.84,2.03,6.68,2.23,2.53,0.41,0.41,0.61,0.05,0.1,0.46,0.0,0.0,0.25,0.2,0.0,16.05,5.92,5.37,0.2,0.41,0.1,0.0,1.06,0.1,2.78,0.0,0.1,404.0,4.04,0.19630709426627793,106.0,1.06,0.05150631681243926,135.0,1.35,0.06559766763848396,427.0,4.27,0.20748299319727892,234.0,0.11370262390670553,0.2639578163771712,0.22766749379652607
27,27,Bush - Speech29 - Edited.txt,21/12/1989,1989-12-21,328,2447881.5,0.2850838481906443,2266.0,646.0,563.0,19.12878787878788,12.0,3.0,91.0,0.0,2.0,118.0,132.0,51.0,95.0,11.0,251.0,14.0,0.0,242.0,123.0,2.0,4.0,46.0,227.0,83.0,5.0,69.0,1.0,5.0,232.0,24.0,161.0,3.0,0.0,17.0,80.0,5.0,147.0,68.0,39.0,54.0,103.0,77.0,8.0,14.0,10.0,2.0,0.0,0.0,1,2130,37.15,67.21,39.41,56.82,16.14,15.96,88.64,60.7,18.12,10.19,3.8,2.91,1.31,1.41,0.75,7.93,7.32,13.85,12.54,5.59,7.98,2.49,21.41,2.72,1.64,1.31,0.66,1.92,4.6,3.05,1.41,0.28,0.8,0.14,10.52,0.14,0.0,0.19,1.46,12.77,2.77,1.36,1.78,3.15,1.36,3.99,1.78,0.61,0.66,0.52,0.94,0.05,0.75,0.09,0.05,9.53,3.8,0.8,3.47,1.5,0.85,5.92,13.62,1.83,12.02,2.35,6.57,3.43,2.3,0.19,0.0,0.47,0.0,0.38,0.66,0.0,0.0,0.33,0.33,0.0,19.72,6.29,5.54,0.42,0.28,0.23,0.0,2.11,0.19,4.55,0.0,0.09,384.0,3.84,0.16946160635481025,129.0,1.29,0.05692850838481906,164.0,1.64,0.07237422771403354,488.0,4.88,0.21535745807590467,256.0,0.11297440423654016,0.2635958395245171,0.224962852897474
28,28,Bush - Speech30 - Edited.txt,05/01/1990,1990-01-05,343,2447896.5,0.2773722627737226,2466.0,684.0,581.0,17.75,13.0,8.0,87.0,0.0,0.0,143.0,156.0,48.0,108.0,10.0,261.0,14.0,0.0,244.0,123.0,3.0,2.0,65.0,254.0,95.0,6.0,90.0,0.0,8.0,251.0,38.0,169.0,3.0,1.0,15.0,86.0,4.0,160.0,69.0,28.0,70.0,113.0,85.0,20.0,16.0,11.0,0.0,0.0,0.0,1,2328,35.59,59.85,54.32,42.94,14.83,17.91,89.91,60.31,19.37,10.7,5.24,2.36,1.16,0.95,0.99,8.68,6.83,12.84,11.94,4.94,7.3,2.23,20.62,2.36,1.46,1.42,0.52,2.06,3.99,2.36,1.42,0.3,0.56,0.34,10.7,0.04,0.21,0.09,1.2,15.81,4.51,2.28,2.06,4.08,1.03,4.21,1.98,0.9,0.73,0.3,0.9,0.13,0.69,0.04,0.09,8.63,3.09,0.86,3.35,1.12,0.95,4.68,14.18,2.28,10.7,2.15,6.44,2.66,2.23,0.09,0.13,0.34,0.09,0.21,0.95,0.04,0.04,0.34,0.52,0.0,19.54,6.79,6.14,0.17,0.26,0.17,0.04,1.76,0.0,3.95,0.0,0.26,445.0,4.45,0.18045417680454176,128.0,1.28,0.05190592051905921,173.0,1.73,0.07015409570154096,525.0,5.25,0.21289537712895376,289.0,0.11719383617193836,0.27754415475189237,0.23507148864592095
29,29,Bush - Speech31 - Edited.txt,24/01/1990,1990-01-24,362,2447915.5,0.2674157303370786,3115.0,833.0,690.0,19.227777777777774,14.0,5.0,138.0,0.0,1.0,161.0,180.0,42.0,149.0,19.0,345.0,15.0,2.0,336.0,155.0,1.0,4.0,52.0,289.0,138.0,9.0,127.0,0.0,9.0,326.0,19.0,208.0,4.0,3.0,18.0,101.0,3.0,191.0,55.0,56.0,71.0,216.0,103.0,21.0,19.0,12.0,1.0,0.0,0.0,1,2936,42.57,52.86,56.42,69.43,16.31,17.61,90.19,58.75,18.09,9.78,5.28,1.94,1.12,0.61,0.82,8.31,7.53,13.11,11.21,5.07,7.25,2.59,21.19,2.96,1.12,1.23,0.72,2.21,5.89,3.99,1.67,0.03,0.58,0.34,9.43,0.0,0.41,0.0,0.72,14.0,3.85,1.23,1.98,2.9,1.43,3.88,2.55,1.26,0.89,0.37,0.61,0.24,0.34,0.03,0.03,9.5,3.07,1.02,3.0,1.91,1.12,3.58,15.4,1.7,11.55,2.79,6.13,3.37,2.62,0.07,0.17,0.95,0.03,0.07,0.78,0.03,0.03,0.14,0.51,0.0,18.73,6.37,5.48,0.17,0.07,0.2,0.0,1.4,0.07,4.77,0.0,0.2,563.0,5.63,0.18073836276083466,160.0,1.6,0.051364365971107544,215.0,2.15,0.06902086677367576,692.0,6.92,0.22215088282504014,345.0,0.11075441412520064,0.25486250838363517,0.21830985915492956
30,30,Bush - Speech32 - Edited.txt,25/01/1990,1990-01-25,363,2447916.5,0.2255062944718117,3654.0,824.0,685.0,18.86111111111111,13.0,16.0,144.0,0.0,1.0,201.0,216.0,51.0,165.0,19.0,382.0,31.0,0.0,393.0,171.0,9.0,5.0,73.0,361.0,93.0,4.0,122.0,2.0,5.0,436.0,39.0,235.0,4.0,3.0,14.0,118.0,7.0,207.0,122.0,60.0,91.0,249.0,92.0,28.0,33.0,31.0,1.0,0.0,0.0,1,3460,28.36,47.23,73.02,85.44,16.02,15.69,92.11,62.4,20.35,11.5,6.94,1.65,1.24,0.32,1.36,8.84,6.71,12.8,12.25,5.92,7.57,2.37,21.76,3.7,1.85,2.08,0.72,2.72,4.97,4.13,0.72,0.03,0.32,0.09,9.48,0.0,0.12,0.03,0.38,16.45,5.17,1.97,1.85,4.39,1.45,3.76,2.31,0.98,0.72,0.58,0.32,0.06,0.09,0.0,0.2,8.12,2.54,1.73,2.83,1.71,0.35,5.17,14.65,1.76,10.98,2.05,6.42,3.09,2.66,0.17,0.17,0.2,0.03,0.06,0.69,0.0,0.0,0.32,0.38,0.0,17.72,6.16,5.81,0.09,0.09,0.17,0.0,1.33,0.06,4.02,0.0,0.0,580.0,5.8,0.15873015873015872,185.0,1.85,0.05062944718117132,242.0,2.42,0.0662287903667214,821.0,8.21,0.22468527640941435,475.0,0.12999452654625068,0.23858811040339703,0.19957537154989385
31,31,Bush - Speech33 - Edited.txt,12/02/1990,1990-02-12,381,2447934.5,0.2245301681503461,4044.0,908.0,748.0,18.6597510373444,26.0,5.0,178.0,0.0,1.0,206.0,241.0,60.0,167.0,25.0,435.0,18.0,0.0,418.0,183.0,12.0,3.0,112.0,372.0,156.0,22.0,164.0,7.0,6.0,435.0,39.0,312.0,6.0,3.0,13.0,127.0,5.0,260.0,76.0,70.0,82.0,257.0,123.0,29.0,36.0,15.0,1.0,0.0,0.0,1,3812,31.42,55.42,53.06,79.0,15.75,16.58,87.93,59.26,19.44,10.7,5.25,2.83,1.0,0.73,0.89,8.74,6.61,12.22,12.25,5.46,6.93,2.49,22.01,2.41,1.26,1.57,1.05,2.91,4.98,3.93,1.02,0.13,0.18,0.08,9.26,0.13,0.16,0.08,0.87,16.42,3.99,1.84,2.91,3.65,2.05,3.96,2.47,1.15,0.79,0.34,0.08,0.08,0.0,0.0,0.0,8.6,3.86,0.92,1.97,1.6,0.71,3.57,15.53,2.1,11.91,2.23,7.27,2.73,1.63,0.08,0.08,0.47,0.05,0.0,0.92,0.03,0.03,0.18,0.66,0.03,19.41,6.74,5.48,0.18,0.18,0.29,0.0,1.47,0.05,4.91,0.0,0.1,714.0,7.14,0.17655786350148367,198.0,1.98,0.04896142433234421,321.0,3.21,0.07937685459940653,868.0,8.68,0.21463897131552917,474.0,0.1172106824925816,0.25434844596521244,0.21385799828913601
32,32,Bush - Speech35 - Edited.txt,15/02/1990,1990-02-15,384,2447937.5,0.3253676470588235,1088.0,354.0,320.0,19.15873015873016,4.0,2.0,52.0,0.0,0.0,54.0,63.0,18.0,52.0,8.0,114.0,10.0,0.0,124.0,45.0,3.0,1.0,21.0,119.0,31.0,4.0,45.0,0.0,1.0,124.0,5.0,72.0,2.0,0.0,2.0,41.0,3.0,71.0,32.0,24.0,12.0,68.0,23.0,6.0,7.0,2.0,0.0,0.0,0.0,1,1038,43.01,60.27,50.01,49.05,16.48,15.61,90.75,60.98,18.02,9.63,4.62,2.7,1.16,0.0,1.16,8.38,7.42,13.68,10.6,5.59,7.61,2.7,20.04,2.12,1.16,1.06,1.06,1.73,4.24,2.7,1.45,0.1,0.0,0.1,10.4,0.0,0.1,0.0,0.1,15.61,4.53,1.93,2.41,3.76,0.96,4.34,1.25,0.19,0.48,0.48,0.58,0.0,0.19,0.0,0.39,10.69,3.95,2.5,2.41,1.35,1.35,3.47,14.64,1.73,9.92,1.73,6.36,1.93,4.05,0.39,0.1,1.06,0.1,0.0,0.87,0.0,0.0,0.29,0.58,0.0,17.53,6.17,5.2,0.19,0.19,0.1,0.0,1.93,0.0,3.76,0.0,0.0,199.0,1.99,0.18290441176470587,49.0,0.49,0.04503676470588235,74.0,0.74,0.06801470588235294,230.0,2.3,0.2113970588235294,129.0,0.11856617647058823,0.2508970466464256,0.21004692243996687
33,33,Bush - Speech34 - Edited.txt,15/02/1990,1990-02-15,384,2447937.5,0.4435643564356435,505.0,224.0,205.0,20.55555555555556,0.0,0.0,15.0,0.0,0.0,23.0,27.0,8.0,19.0,3.0,66.0,2.0,0.0,69.0,22.0,0.0,1.0,12.0,57.0,24.0,5.0,23.0,0.0,0.0,43.0,6.0,31.0,0.0,0.0,1.0,12.0,0.0,28.0,8.0,11.0,10.0,21.0,14.0,2.0,4.0,3.0,0.0,0.0,0.0,1,481,52.83,50.83,31.38,75.85,17.81,21.0,88.98,59.46,16.84,8.94,5.41,1.25,1.46,0.62,0.21,7.9,7.69,14.76,10.81,5.41,6.86,2.49,17.46,1.66,1.25,1.66,1.04,2.7,7.07,4.78,2.08,0.21,1.25,0.0,9.36,0.0,0.0,0.0,0.83,14.35,2.7,0.62,3.74,5.41,1.04,3.95,1.04,0.0,0.62,0.42,1.04,0.21,0.83,0.0,0.0,10.81,1.87,1.66,4.99,0.83,2.08,2.91,11.64,1.87,10.4,0.62,6.44,3.33,4.16,0.0,0.0,0.42,0.42,0.42,0.62,0.0,0.0,0.62,0.0,0.0,15.38,5.41,4.78,0.0,0.0,0.21,0.0,1.66,0.0,3.33,0.0,0.0,109.0,1.09,0.21584158415841584,23.0,0.23,0.04554455445544554,31.0,0.31,0.061386138613861385,92.0,0.92,0.18217821782178217,49.0,0.09702970297029703,0.24483306836248012,0.2056173820879703
34,34,Bush - Speech36 - Edited.txt,25/02/1990,1990-02-25,394,2447947.5,0.2775510204081632,2205.0,612.0,501.0,19.228346456692915,17.0,4.0,80.0,0.0,0.0,108.0,127.0,27.0,105.0,12.0,237.0,14.0,0.0,256.0,116.0,7.0,1.0,58.0,217.0,129.0,9.0,87.0,6.0,2.0,181.0,24.0,152.0,0.0,1.0,21.0,69.0,2.0,126.0,39.0,35.0,52.0,97.0,77.0,17.0,20.0,11.0,0.0,0.0,0.0,1,2131,50.06,65.51,39.95,84.52,16.78,17.74,87.42,59.74,15.53,7.98,3.33,3.28,0.8,0.28,0.28,7.56,7.51,14.64,11.31,5.91,8.12,2.21,18.49,3.28,1.69,1.74,1.41,2.06,5.02,4.18,0.84,0.14,0.38,0.05,10.04,0.09,0.14,0.0,0.47,13.75,2.53,1.6,2.16,2.72,1.83,4.6,1.97,0.84,0.89,0.23,0.42,0.19,0.09,0.0,0.09,10.32,5.3,1.31,1.97,1.97,0.47,3.33,12.95,1.74,11.45,1.31,8.07,2.25,1.64,0.14,0.09,0.23,0.05,0.09,0.52,0.0,0.0,0.14,0.38,0.0,17.32,6.76,5.07,0.09,0.19,0.28,0.0,1.83,0.0,2.91,0.0,0.19,442.0,4.42,0.20045351473922904,124.0,1.24,0.05623582766439909,153.0,1.53,0.06938775510204082,426.0,4.26,0.19319727891156463,205.0,0.09297052154195011,0.29016890428757036,0.24252923343438718
35,35,Bush - Speech37 - Edited.txt,03/03/1990,1990-03-03,400,2447953.5,0.260545905707196,2821.0,735.0,628.0,18.538011695906437,16.0,8.0,98.0,1.0,0.0,176.0,171.0,43.0,133.0,17.0,292.0,8.0,0.0,307.0,149.0,5.0,1.0,53.0,287.0,119.0,6.0,97.0,1.0,4.0,321.0,29.0,206.0,4.0,2.0,4.0,100.0,6.0,159.0,90.0,51.0,54.0,156.0,77.0,12.0,15.0,14.0,0.0,0.0,0.0,1,2694,34.27,69.98,41.03,89.29,15.66,18.52,90.13,60.36,20.01,11.36,5.42,3.04,1.15,0.82,0.93,8.65,6.31,13.36,10.76,6.05,7.87,1.6,20.27,3.53,2.0,1.37,0.85,2.19,5.09,4.42,0.63,0.19,0.22,0.04,11.51,0.0,0.11,0.04,0.93,13.99,3.64,1.08,2.38,3.41,2.08,3.45,2.52,1.26,0.82,0.37,0.26,0.0,0.07,0.0,0.26,9.21,4.16,1.34,2.64,1.71,0.33,4.6,13.07,1.67,10.32,1.89,6.68,2.26,3.01,0.15,0.15,0.82,0.3,0.0,1.15,0.0,0.0,0.3,0.85,0.0,19.08,6.79,6.53,0.07,0.11,0.19,0.0,1.78,0.0,3.34,0.0,0.26,509.0,5.09,0.1804324707550514,155.0,1.55,0.054945054945054944,212.0,2.12,0.07515065579581709,587.0,5.87,0.20808224034030487,350.0,0.12406947890818859,0.24506283662477557,0.20825852782764812
36,36,Bush - Speech38 - Edited.txt,13/03/1990,1990-03-13,410,2447963.5,0.2296541200406917,3932.0,903.0,740.0,17.171206225680933,18.0,9.0,152.0,0.0,1.0,218.0,257.0,62.0,187.0,23.0,413.0,27.0,2.0,428.0,167.0,9.0,2.0,76.0,396.0,159.0,5.0,134.0,3.0,5.0,446.0,28.0,280.0,5.0,0.0,25.0,125.0,10.0,219.0,71.0,97.0,65.0,287.0,109.0,23.0,27.0,21.0,1.0,0.0,0.0,1,3685,37.16,51.09,72.94,61.8,14.34,16.82,90.39,60.68,18.78,10.99,5.94,2.52,1.28,0.62,0.62,7.79,6.87,14.08,11.18,6.32,7.44,2.77,21.76,3.34,1.68,1.63,0.71,2.23,4.53,3.04,1.14,0.03,0.3,0.19,9.34,0.03,0.05,0.03,0.76,14.71,4.1,1.25,2.01,3.28,1.14,4.15,1.76,0.71,0.62,0.38,0.43,0.22,0.05,0.0,0.16,9.2,3.2,1.36,2.66,1.93,0.6,3.34,15.96,2.2,13.11,2.55,7.65,3.23,2.63,0.38,0.11,0.79,0.05,0.03,0.71,0.0,0.0,0.33,0.33,0.0,20.62,6.49,5.92,0.33,0.19,0.65,0.03,1.55,0.05,5.26,0.0,0.16,694.0,6.94,0.17650050864699898,178.0,1.78,0.045269582909460836,285.0,2.85,0.07248219735503561,848.0,8.48,0.21566632756866735,474.0,0.12054933875890132,0.2373712604217754,0.20181461500735653
37,37,Bush - Speech39 - Edited.txt,22/03/1990,1990-03-22,419,2447972.5,0.2733333333333333,2250.0,615.0,516.0,16.766666666666666,11.0,7.0,99.0,0.0,0.0,112.0,150.0,32.0,96.0,11.0,235.0,9.0,0.0,256.0,111.0,4.0,1.0,53.0,232.0,131.0,15.0,68.0,2.0,1.0,221.0,39.0,149.0,0.0,0.0,14.0,77.0,1.0,143.0,34.0,39.0,49.0,130.0,62.0,12.0,11.0,15.0,0.0,0.0,0.0,1,2156,51.68,51.67,48.84,79.78,14.37,17.63,87.29,59.74,17.12,10.34,5.66,1.81,0.65,1.07,1.16,6.77,7.84,14.66,11.32,5.06,7.0,2.37,19.85,3.2,1.58,1.3,0.97,1.95,4.68,3.8,0.83,0.14,0.14,0.14,9.18,0.09,0.09,0.28,0.83,14.47,3.99,2.37,2.5,2.55,1.02,3.2,1.53,0.88,0.32,0.23,0.65,0.19,0.14,0.0,0.28,7.61,2.78,0.93,2.92,0.88,0.56,2.6,14.66,1.81,11.55,1.99,7.14,2.6,1.86,0.42,0.19,0.19,0.14,0.09,0.7,0.0,0.0,0.09,0.6,0.0,17.76,7.1,5.19,0.14,0.23,0.23,0.0,1.53,0.0,3.25,0.0,0.09,446.0,4.46,0.19822222222222222,116.0,1.16,0.051555555555555556,149.0,1.49,0.06622222222222222,457.0,4.57,0.2031111111111111,260.0,0.11555555555555555,0.23340218353496606,0.2009442313366775
38,38,Bush - Speech40 - Edited.txt,23/03/1990,1990-03-23,420,2447973.5,0.2929014472777395,2902.0,850.0,723.0,19.18452380952381,7.0,7.0,93.0,1.0,1.0,147.0,168.0,48.0,133.0,19.0,306.0,13.0,0.0,320.0,154.0,4.0,2.0,64.0,312.0,160.0,5.0,92.0,2.0,7.0,281.0,32.0,182.0,5.0,2.0,14.0,111.0,7.0,175.0,55.0,72.0,45.0,149.0,78.0,19.0,21.0,16.0,1.0,0.0,0.0,1,2758,55.12,55.62,51.41,73.81,16.42,17.84,88.18,58.19,17.08,9.61,5.0,1.99,1.09,0.76,0.76,7.43,7.29,14.76,10.55,4.71,6.89,1.96,18.38,3.55,1.63,1.52,0.98,2.54,5.18,3.81,1.23,0.22,0.25,0.07,8.92,0.0,0.07,0.07,0.83,12.47,2.86,1.38,1.45,3.41,1.41,3.63,1.89,0.98,0.62,0.22,0.44,0.15,0.18,0.0,0.18,8.96,2.72,1.52,3.01,1.67,0.69,2.97,12.73,1.89,11.93,2.14,7.69,2.28,3.08,0.65,0.22,1.38,0.0,0.04,0.69,0.0,0.04,0.36,0.29,0.0,17.4,6.09,5.33,0.18,0.07,0.33,0.0,1.56,0.07,3.73,0.0,0.04,569.0,5.69,0.19607167470709855,160.0,1.6,0.05513439007580979,189.0,1.89,0.0651274982770503,574.0,5.74,0.1977946243969676,313.0,0.10785665058580289,0.22875102487018312,0.19950806231210713
39,39,Bush - Speech41 - Edited.txt,10/04/1990,1990-04-10,438,2447991.5,0.3484848484848485,1320.0,460.0,405.0,24.35,4.0,2.0,49.0,0.0,0.0,80.0,60.0,20.0,60.0,6.0,148.0,3.0,1.0,160.0,77.0,2.0,1.0,31.0,147.0,80.0,7.0,40.0,0.0,0.0,114.0,12.0,76.0,2.0,0.0,4.0,43.0,0.0,77.0,20.0,20.0,29.0,64.0,48.0,14.0,6.0,9.0,0.0,0.0,0.0,1,1267,55.02,62.98,41.64,87.8,21.12,20.99,86.82,57.62,16.97,7.97,3.87,1.66,1.18,0.87,0.39,9.0,7.66,14.36,10.81,4.34,7.34,1.74,17.44,4.26,2.21,1.34,0.71,1.82,6.24,4.89,1.26,0.24,0.08,0.08,9.39,0.0,0.08,0.08,0.87,14.36,4.81,0.95,1.97,2.84,2.13,3.31,1.66,0.79,0.71,0.08,0.0,0.0,0.0,0.0,0.0,8.29,2.45,1.18,2.6,1.82,0.95,3.0,13.18,1.58,10.58,1.5,6.55,3.16,2.37,0.16,0.16,0.39,0.39,0.0,0.24,0.0,0.0,0.16,0.08,0.0,16.1,4.81,6.31,0.08,0.32,0.24,0.0,1.42,0.0,2.76,0.0,0.16,274.0,2.74,0.20757575757575758,80.0,0.8,0.06060606060606061,78.0,0.78,0.05909090909090909,258.0,2.58,0.19545454545454546,126.0,0.09545454545454546,0.28576821442053607,0.24839562098905246
40,40,Bush - Speech42 - Edited.txt,13/04/1990,1990-04-13,441,2447994.5,0.310589519650655,1832.0,569.0,497.0,21.806451612903224,5.0,2.0,72.0,0.0,1.0,101.0,93.0,21.0,100.0,8.0,162.0,11.0,0.0,201.0,102.0,3.0,0.0,45.0,164.0,100.0,9.0,72.0,2.0,1.0,193.0,20.0,130.0,2.0,0.0,10.0,73.0,0.0,112.0,30.0,39.0,39.0,112.0,43.0,9.0,14.0,5.0,1.0,0.0,0.0,1,1760,39.07,61.2,42.99,52.41,18.14,17.5,88.58,59.77,18.58,10.91,5.34,2.9,1.31,0.62,0.74,7.67,6.31,13.64,11.19,5.17,7.73,2.1,19.26,3.24,1.42,1.25,0.8,1.65,5.17,3.18,1.76,0.45,0.17,0.28,9.89,0.06,0.17,0.23,0.4,15.74,4.72,1.36,3.07,2.73,2.22,3.81,2.27,1.02,0.91,0.34,0.23,0.06,0.0,0.0,0.11,10.11,3.98,1.02,2.84,1.14,1.31,3.52,13.35,1.65,9.77,1.53,6.14,2.1,2.33,0.23,0.0,0.23,0.57,0.06,0.85,0.0,0.45,0.34,0.28,0.0,16.88,5.91,5.74,0.11,0.34,0.34,0.0,1.02,0.11,3.18,0.0,0.11,345.0,3.45,0.18831877729257643,105.0,1.05,0.05731441048034935,132.0,1.32,0.07205240174672489,375.0,3.75,0.2046943231441048,213.0,0.11626637554585152,0.24215007982969664,0.20383182543906334
41,41,Bush - Speech43 - Edited.txt,19/04/1990,1990-04-19,447,2448000.5,0.3713163064833006,1018.0,378.0,340.0,18.193548387096776,0.0,2.0,27.0,0.0,0.0,46.0,62.0,12.0,46.0,1.0,100.0,7.0,0.0,132.0,47.0,1.0,0.0,23.0,106.0,75.0,11.0,38.0,0.0,1.0,86.0,14.0,68.0,0.0,0.0,1.0,31.0,3.0,51.0,21.0,20.0,25.0,55.0,26.0,4.0,10.0,5.0,0.0,0.0,0.0,1,987,57.41,54.44,59.15,56.38,15.92,18.64,84.8,57.65,15.4,9.93,5.57,2.63,0.81,0.51,0.41,5.47,6.79,14.79,9.93,5.47,6.48,2.63,17.73,1.93,1.22,1.62,0.71,2.23,3.75,2.53,0.91,0.3,0.0,0.1,9.42,0.0,0.1,0.1,0.41,11.85,3.85,0.81,1.52,2.74,1.32,3.55,2.74,1.01,1.32,0.41,0.41,0.2,0.0,0.0,0.2,10.33,4.36,1.62,2.74,1.32,0.71,3.14,12.06,1.72,11.45,1.22,7.6,2.94,1.52,0.2,0.3,0.0,0.3,0.0,0.61,0.0,0.0,0.51,0.1,0.0,15.5,6.79,4.66,0.2,0.0,0.2,0.0,1.32,0.0,2.13,0.0,0.2,230.0,2.3,0.22593320235756384,48.0,0.48,0.047151277013752456,68.0,0.68,0.06679764243614932,198.0,1.98,0.1944990176817289,100.0,0.09823182711198428,0.26750084545147107,0.23199188366587759
42,42,Bush - Speech44 - Edited.txt,03/05/1990,1990-05-03,461,2448014.5,0.2241299303944315,4310.0,966.0,773.0,16.408163265306122,12.0,19.0,158.0,0.0,1.0,215.0,294.0,48.0,201.0,20.0,467.0,31.0,3.0,466.0,190.0,8.0,3.0,97.0,451.0,186.0,14.0,118.0,4.0,8.0,450.0,55.0,267.0,3.0,1.0,22.0,158.0,8.0,274.0,91.0,94.0,96.0,245.0,156.0,28.0,28.0,22.0,1.0,0.0,0.0,1,4065,34.2,60.3,40.5,71.9,13.83,16.11,90.9,60.86,19.53,10.63,4.99,2.36,0.98,1.28,1.01,8.91,6.59,13.63,12.03,5.41,7.45,2.44,21.55,2.78,1.28,1.33,0.62,2.56,4.92,3.64,1.18,0.27,0.32,0.2,10.73,0.15,0.0,0.44,0.96,14.15,3.22,1.18,2.61,3.71,1.35,3.96,2.58,1.11,0.89,0.49,0.47,0.12,0.15,0.07,0.15,8.98,3.32,1.38,2.31,1.97,0.57,3.62,15.2,1.89,11.27,2.41,6.86,2.78,2.68,0.25,0.25,0.49,0.07,0.1,0.47,0.07,0.0,0.27,0.1,0.0,19.61,7.13,5.29,0.15,0.17,0.42,0.02,1.16,0.05,5.07,0.0,0.15,769.0,7.69,0.17842227378190256,201.0,2.01,0.04663573085846868,271.0,2.71,0.06287703016241299,956.0,9.56,0.22180974477958237,505.0,0.11716937354988399,0.26224383466481416,0.22681486627301145
43,43,Bush - Speech45 - Edited.txt,16/05/1990,1990-05-16,474,2448027.5,0.2470362063441204,3121.0,771.0,637.0,19.3,9.0,9.0,143.0,0.0,0.0,168.0,180.0,47.0,160.0,18.0,324.0,18.0,0.0,318.0,153.0,6.0,1.0,71.0,290.0,107.0,13.0,122.0,2.0,5.0,326.0,21.0,241.0,3.0,1.0,20.0,113.0,6.0,198.0,65.0,74.0,51.0,187.0,98.0,17.0,30.0,20.0,0.0,0.0,0.0,1,2940,36.59,56.08,55.54,58.59,16.33,17.62,90.95,60.78,18.33,9.8,5.2,2.93,0.68,0.27,0.71,8.54,6.97,13.4,11.36,5.54,8.27,2.62,21.56,2.96,1.7,1.9,0.92,2.07,5.03,3.33,1.6,0.31,0.34,0.1,9.93,0.07,0.07,0.03,0.27,14.01,3.06,1.33,2.55,3.27,1.16,4.15,2.96,1.02,1.33,0.51,0.24,0.07,0.07,0.03,0.07,10.44,3.54,1.7,2.55,2.18,1.05,3.37,15.82,2.38,12.24,2.76,6.97,3.61,2.96,0.14,0.31,1.22,0.24,0.07,0.51,0.03,0.0,0.34,0.1,0.03,18.33,5.95,5.71,0.17,0.1,0.24,0.0,1.39,0.0,4.63,0.0,0.14,532.0,5.32,0.17045818647869274,160.0,1.6,0.0512656199935918,245.0,2.45,0.07850048061518744,673.0,6.73,0.2156360140980455,347.0,0.11118231336110221,0.2500732064421669,0.21259150805270863
44,44,Bush - Speech46 - Edited.txt,24/05/1990,1990-05-24,482,2448035.5,0.2347826086956521,3335.0,783.0,661.0,17.004587155963304,13.0,6.0,123.0,2.0,1.0,153.0,218.0,44.0,139.0,15.0,341.0,17.0,0.0,337.0,144.0,7.0,2.0,66.0,316.0,136.0,9.0,117.0,2.0,5.0,380.0,22.0,247.0,6.0,2.0,14.0,113.0,5.0,206.0,72.0,80.0,71.0,218.0,128.0,19.0,26.0,24.0,1.0,2.0,0.0,1,3131,31.84,57.23,62.43,66.85,14.3,16.9,90.19,59.89,19.29,10.7,6.04,2.91,0.89,0.35,0.51,8.56,6.58,12.74,11.88,6.29,6.77,2.65,22.74,2.43,1.41,1.92,0.57,2.33,5.08,3.58,1.41,0.32,0.32,0.1,10.38,0.0,0.16,0.06,0.32,14.82,3.67,2.04,2.08,3.13,1.69,3.64,2.14,0.89,0.93,0.26,0.57,0.19,0.13,0.06,0.22,10.06,4.09,1.25,2.62,1.79,0.89,3.8,16.67,2.2,11.98,2.62,6.93,3.13,2.36,0.1,0.26,0.83,0.06,0.0,0.64,0.03,0.0,0.32,0.29,0.0,18.91,6.96,4.89,0.03,0.35,0.16,0.0,1.25,0.06,5.14,0.0,0.06,578.0,5.78,0.17331334332833584,153.0,1.53,0.045877061469265366,255.0,2.55,0.07646176911544228,775.0,7.75,0.23238380809595202,402.0,0.12053973013493254,0.25870033877425314,0.2242069602710194
45,45,Bush - Speech47 - Edited.txt,03/06/1990,1990-06-03,492,2448045.5,0.2975301550832854,1741.0,518.0,455.0,20.92391304347826,0.0,4.0,64.0,0.0,2.0,90.0,92.0,24.0,77.0,8.0,217.0,6.0,0.0,208.0,93.0,3.0,5.0,24.0,204.0,100.0,17.0,63.0,1.0,2.0,153.0,21.0,87.0,5.0,3.0,2.0,59.0,1.0,82.0,30.0,27.0,42.0,95.0,58.0,8.0,6.0,8.0,2.0,0.0,0.0,1,1673,68.29,66.44,60.49,70.74,17.8,20.14,86.79,58.04,15.96,9.32,3.71,4.0,1.02,0.18,0.42,6.63,9.74,14.52,9.8,3.95,6.63,2.21,16.74,3.83,2.93,1.02,0.72,1.49,5.26,3.83,1.43,0.42,0.66,0.12,9.5,0.0,0.0,0.0,0.18,12.85,3.29,1.26,1.14,2.81,1.37,4.36,2.15,1.08,0.6,0.48,0.3,0.18,0.06,0.0,0.06,11.66,5.26,1.97,3.65,1.55,0.66,3.59,12.49,1.26,12.55,1.85,8.25,2.63,3.05,0.12,0.06,0.36,0.06,0.12,0.36,0.0,0.12,0.24,0.0,0.0,16.92,6.34,5.38,0.12,0.3,0.12,0.0,1.43,0.24,2.99,0.0,0.0,384.0,3.84,0.2205628948879954,101.0,1.01,0.058012636415852956,95.0,0.95,0.05456634118322803,334.0,3.34,0.19184376794945435,174.0,0.09994256174612291,,
46,46,Bush - Speech48 - Edited.txt,13/06/1990,1990-06-13,502,2448055.5,0.2889214250854075,2049.0,592.0,512.0,19.56896551724138,8.0,4.0,92.0,1.0,0.0,101.0,116.0,23.0,81.0,21.0,214.0,11.0,0.0,232.0,114.0,4.0,2.0,52.0,194.0,83.0,3.0,75.0,2.0,1.0,222.0,14.0,160.0,1.0,1.0,18.0,60.0,0.0,118.0,31.0,33.0,50.0,142.0,52.0,14.0,13.0,11.0,0.0,0.0,0.0,1,1941,35.44,48.56,63.57,84.11,16.59,16.95,90.88,60.59,18.5,10.05,5.82,1.91,1.65,0.21,0.46,8.45,6.75,13.65,12.31,6.49,6.85,2.42,20.61,3.3,1.65,1.34,1.29,3.09,5.92,4.43,1.13,0.21,0.26,0.15,8.5,0.31,0.0,0.0,0.21,14.99,3.5,1.44,2.42,3.09,1.96,4.17,1.44,0.46,0.77,0.1,0.21,0.05,0.15,0.0,0.0,9.02,2.89,1.44,2.83,1.96,0.57,3.3,14.68,1.55,12.21,1.7,7.68,3.04,3.09,0.36,0.46,0.82,0.0,0.0,0.41,0.0,0.1,0.26,0.15,0.0,17.0,6.03,5.31,0.21,0.05,0.05,0.0,0.93,0.0,4.07,0.0,0.36,355.0,3.55,0.17325524646168863,120.0,1.2,0.05856515373352855,162.0,1.62,0.07906295754026355,426.0,4.26,0.20790629575402636,236.0,0.11517813567593949,,
47,47,Bush - Speech49 - Edited.txt,20/06/1990,1990-06-20,509,2448062.5,0.2567699836867863,3065.0,787.0,653.0,20.11904761904762,7.0,5.0,97.0,1.0,0.0,140.0,168.0,33.0,144.0,17.0,318.0,14.0,0.0,346.0,154.0,2.0,2.0,63.0,324.0,126.0,12.0,97.0,1.0,4.0,308.0,42.0,215.0,6.0,1.0,8.0,112.0,5.0,174.0,70.0,55.0,84.0,180.0,101.0,19.0,23.0,11.0,0.0,0.0,0.0,1,2918,40.95,44.83,58.63,72.6,17.37,17.27,89.86,59.63,18.57,10.62,5.96,2.02,0.69,1.23,0.72,7.95,6.79,13.67,11.48,5.11,6.99,2.47,19.84,3.63,1.58,1.34,0.89,2.33,5.55,3.98,1.47,0.31,0.41,0.03,8.5,0.0,0.07,0.0,1.3,14.67,3.91,1.68,1.85,3.56,1.61,4.04,1.85,1.06,0.55,0.24,0.34,0.1,0.1,0.03,0.17,8.84,2.43,1.75,3.02,1.71,0.51,4.18,13.54,1.95,11.48,2.19,7.4,2.74,2.78,0.17,0.14,0.82,0.07,0.0,0.86,0.03,0.0,0.31,0.45,0.03,16.72,6.17,4.8,0.24,0.27,0.1,0.0,0.82,0.0,3.98,0.0,0.34,559.0,5.59,0.18238172920065251,158.0,1.58,0.05154975530179445,222.0,2.22,0.07243066884176183,664.0,6.64,0.2166394779771615,350.0,0.11419249592169657,,
48,48,Bush - Speech50 - Edited.txt,29/06/1990,1990-06-29,518,2448071.5,0.1991160220994475,4525.0,901.0,738.0,18.305454545454545,16.0,12.0,186.0,1.0,1.0,224.0,275.0,63.0,241.0,34.0,451.0,12.0,0.0,446.0,226.0,19.0,2.0,96.0,471.0,102.0,17.0,169.0,2.0,9.0,488.0,42.0,310.0,9.0,3.0,22.0,159.0,8.0,273.0,100.0,111.0,94.0,289.0,152.0,33.0,48.0,31.0,1.0,0.0,0.0,1,4248,31.3,58.11,61.73,53.66,15.45,16.9,91.6,60.29,19.0,10.64,5.27,3.01,1.13,0.54,0.68,8.36,6.8,12.74,11.86,5.32,8.78,2.35,23.16,3.88,2.02,2.07,1.01,1.98,4.45,2.92,1.44,0.07,0.26,0.12,10.17,0.09,0.05,0.0,0.78,14.31,3.04,1.77,2.28,3.01,1.51,4.64,2.57,1.25,0.89,0.4,0.16,0.05,0.02,0.0,0.09,9.84,3.6,0.94,2.61,2.24,0.87,4.14,15.94,3.18,12.66,3.32,6.8,3.37,3.01,0.14,0.14,1.81,0.02,0.09,0.47,0.0,0.02,0.24,0.16,0.02,18.79,6.29,5.27,0.24,0.09,0.24,0.0,1.32,0.05,5.13,0.0,0.16,759.0,7.59,0.16773480662983425,247.0,2.47,0.05458563535911602,322.0,3.22,0.07116022099447514,1019.0,10.19,0.22519337016574587,530.0,0.11712707182320442,,
49,49,Bush - Speech51 - Edited.txt,06/07/1990,1990-07-06,525,2448078.5,0.2298578199052132,3376.0,776.0,643.0,20.585635359116026,8.0,6.0,116.0,1.0,0.0,164.0,181.0,32.0,128.0,15.0,352.0,12.0,3.0,421.0,153.0,3.0,0.0,82.0,328.0,212.0,17.0,154.0,2.0,5.0,328.0,40.0,236.0,6.0,2.0,13.0,115.0,1.0,176.0,50.0,52.0,89.0,201.0,94.0,24.0,21.0,13.0,0.0,0.0,0.0,1,3233,54.0,60.38,45.3,53.69,17.86,16.46,87.81,59.11,17.41,9.99,4.45,2.1,0.77,1.14,1.52,7.42,7.49,15.03,10.89,4.95,6.77,2.04,19.67,3.4,2.01,1.21,0.68,1.89,4.83,3.15,1.67,0.59,0.65,0.12,9.74,0.0,0.12,0.0,1.27,14.51,3.46,2.23,2.47,2.81,1.45,3.5,2.85,1.48,0.9,0.4,0.71,0.43,0.19,0.0,0.09,8.66,3.31,1.21,2.88,1.45,0.9,3.43,13.61,1.73,12.5,2.72,7.95,2.88,1.58,0.12,0.09,0.49,0.06,0.15,0.65,0.0,0.0,0.25,0.37,0.03,16.21,6.03,5.07,0.15,0.06,0.19,0.0,0.96,0.0,3.4,0.0,0.34,711.0,7.11,0.2106042654028436,156.0,1.56,0.0462085308056872,244.0,2.44,0.07227488151658767,662.0,6.62,0.19609004739336494,368.0,0.10900473933649289,,
50,50,Bush - Speech52 - Edited.txt,11/07/1990,1990-07-11,530,2448083.5,0.2211249463288965,4658.0,1030.0,843.0,20.28174603174603,16.0,10.0,172.0,1.0,2.0,197.0,252.0,76.0,227.0,22.0,481.0,18.0,0.0,554.0,238.0,6.0,8.0,100.0,452.0,179.0,17.0,170.0,4.0,3.0,499.0,46.0,355.0,9.0,1.0,19.0,147.0,0.0,272.0,103.0,93.0,83.0,277.0,120.0,16.0,35.0,25.0,2.0,2.0,0.0,1,4409,40.12,63.23,57.81,75.8,17.5,16.63,89.77,60.2,18.71,10.91,4.83,2.52,0.84,1.45,1.27,7.8,6.83,13.99,10.8,5.26,8.03,2.47,19.57,3.29,1.88,1.5,0.59,2.7,5.01,3.81,1.11,0.18,0.32,0.16,11.34,0.25,0.05,0.07,1.72,15.22,3.97,1.5,2.34,3.54,1.84,3.97,2.02,0.61,0.84,0.52,0.27,0.11,0.09,0.02,0.07,9.57,3.9,1.86,2.88,1.59,0.68,3.77,13.68,1.88,13.2,2.93,8.23,2.88,2.15,0.18,0.07,0.79,0.09,0.02,0.45,0.05,0.0,0.16,0.25,0.0,16.24,5.78,4.47,0.11,0.16,0.18,0.02,1.52,0.09,3.79,0.0,0.11,818.0,8.18,0.17561185057964793,252.0,2.52,0.054100472305710606,365.0,3.65,0.07835981107771575,948.0,9.48,0.20352082438814942,545.0,0.11700300558179476,,
51,51,Bush - Speech53 - Edited.txt,08/08/1990,1990-08-08,558,2448111.5,0.2891352549889135,2255.0,652.0,558.0,17.205479452054796,6.0,5.0,101.0,0.0,0.0,109.0,146.0,29.0,80.0,8.0,221.0,27.0,0.0,254.0,132.0,5.0,0.0,68.0,221.0,96.0,8.0,73.0,1.0,1.0,221.0,18.0,186.0,2.0,0.0,9.0,76.0,5.0,150.0,36.0,47.0,58.0,129.0,58.0,8.0,20.0,10.0,0.0,0.0,0.0,1,2139,32.63,42.76,70.96,51.12,14.65,16.88,90.28,60.82,17.95,9.58,5.14,1.73,1.31,0.33,1.08,8.37,6.26,13.32,13.0,7.25,5.84,2.81,22.02,2.38,1.12,1.5,0.61,2.29,5.19,3.23,1.87,0.28,0.7,0.09,7.9,0.0,0.0,0.0,0.42,16.27,3.74,1.82,2.48,3.83,2.01,4.77,2.48,0.79,0.65,0.75,0.51,0.05,0.09,0.05,0.33,7.25,2.29,0.94,2.2,1.03,1.12,3.65,14.77,3.27,13.46,2.43,7.53,3.69,1.54,0.19,0.05,0.94,0.09,0.14,0.75,0.05,0.0,0.37,0.33,0.0,18.0,6.26,5.1,0.09,0.14,0.56,0.0,1.45,0.0,4.3,0.0,0.09,398.0,3.98,0.17649667405764966,137.0,1.37,0.06075388026607539,188.0,1.88,0.08337028824833703,478.0,4.78,0.21197339246119734,239.0,0.10598669623059867,,
52,52,Bush - Speech54 - Edited.txt,14/08/1990,1990-08-14,564,2448117.5,0.2514932411191449,3181.0,800.0,659.0,18.22680412371134,11.0,4.0,120.0,4.0,0.0,150.0,194.0,54.0,138.0,30.0,351.0,13.0,0.0,317.0,130.0,6.0,5.0,74.0,292.0,125.0,15.0,93.0,1.0,10.0,374.0,26.0,238.0,6.0,1.0,17.0,121.0,3.0,219.0,93.0,67.0,42.0,178.0,92.0,15.0,24.0,18.0,0.0,0.0,0.0,1,2993,32.18,56.11,50.33,69.84,15.12,15.47,89.91,61.81,19.71,11.19,5.21,2.14,1.14,1.4,1.3,8.52,6.88,13.4,11.79,6.31,7.12,2.77,21.32,3.01,1.97,1.67,1.14,2.74,4.28,3.24,0.9,0.13,0.37,0.03,10.59,0.0,0.07,0.0,1.57,14.3,3.17,1.64,2.21,3.21,1.8,4.28,2.17,0.67,1.07,0.33,0.3,0.13,0.07,0.03,0.1,7.75,3.07,0.94,2.41,1.44,0.47,4.64,15.14,1.97,11.99,2.31,6.52,3.51,1.57,0.17,0.23,0.57,0.2,0.0,0.9,0.07,0.2,0.13,0.47,0.0,18.74,6.55,5.05,0.3,0.1,0.33,0.0,1.47,0.0,4.61,0.0,0.33,525.0,5.25,0.16504243948443886,141.0,1.41,0.044325683747249295,245.0,2.45,0.07701980509273813,691.0,6.91,0.2172272870166614,400.0,0.12574662055957248,,
53,53,Bush - Speech55 - Edited.txt,16/08/1990,1990-08-16,566,2448119.5,0.3146551724137931,1392.0,438.0,396.0,22.761194029850746,7.0,7.0,57.0,0.0,0.0,66.0,67.0,25.0,56.0,5.0,151.0,8.0,0.0,170.0,61.0,1.0,1.0,29.0,133.0,51.0,3.0,55.0,2.0,2.0,149.0,12.0,88.0,1.0,0.0,0.0,50.0,1.0,87.0,37.0,25.0,48.0,71.0,43.0,15.0,6.0,6.0,0.0,0.0,0.0,1,1308,35.51,36.83,72.24,59.05,19.52,17.51,90.67,61.85,20.34,10.32,6.73,0.61,0.84,1.07,1.07,10.02,6.57,13.99,12.16,5.73,5.96,2.52,21.1,1.99,0.99,1.68,0.46,3.67,4.05,2.68,0.92,0.08,0.38,0.38,8.26,0.0,0.0,0.0,1.3,15.83,4.74,1.91,1.22,3.67,2.37,3.82,2.83,1.15,0.92,0.61,0.76,0.23,0.0,0.0,0.54,4.59,1.53,0.69,1.07,1.22,0.54,4.59,13.46,1.53,11.54,1.99,7.57,2.29,1.99,0.54,0.08,0.31,0.0,0.15,0.46,0.0,0.08,0.15,0.15,0.08,16.82,5.12,5.05,0.0,0.0,0.15,0.0,1.91,0.0,4.43,0.0,0.15,242.0,2.42,0.17385057471264367,63.0,0.63,0.04525862068965517,89.0,0.89,0.0639367816091954,311.0,3.11,0.22341954022988506,161.0,0.11566091954022989,,
54,54,Bush - Speech56 - Edited.txt,22/08/1990,1990-08-22,572,2448125.5,0.2636511817440913,2454.0,647.0,545.0,18.335570469798657,7.0,3.0,75.0,0.0,1.0,122.0,149.0,36.0,105.0,11.0,243.0,17.0,0.0,249.0,126.0,10.0,3.0,66.0,248.0,126.0,14.0,81.0,3.0,3.0,244.0,14.0,174.0,5.0,1.0,13.0,87.0,8.0,147.0,37.0,58.0,58.0,158.0,72.0,12.0,16.0,12.0,1.0,2.0,0.0,1,2323,39.28,58.01,61.63,41.33,15.18,18.17,89.5,58.76,17.35,9.6,5.04,2.11,0.82,0.52,1.12,7.75,6.72,13.22,12.18,5.68,6.93,2.54,20.45,3.36,2.45,1.42,0.47,2.45,4.69,2.63,1.76,0.39,0.99,0.3,10.63,0.13,0.3,0.0,0.69,14.16,3.49,1.51,1.89,3.23,2.2,3.75,2.11,0.56,0.99,0.39,0.6,0.3,0.13,0.17,0.17,8.35,3.19,1.29,3.19,1.29,0.52,3.14,14.42,2.24,12.91,2.32,7.96,2.97,1.72,0.3,0.43,0.13,0.13,0.04,1.08,0.22,0.17,0.6,0.09,0.0,18.38,6.67,5.25,0.3,0.52,0.3,0.0,0.73,0.09,4.26,0.0,0.26,469.0,4.69,0.1911165444172779,139.0,1.39,0.05664221678891605,180.0,1.8,0.07334963325183375,530.0,5.3,0.21597392013039934,258.0,0.10513447432762836,,
55,55,Bush - Speech57 - Edited.txt,30/08/1990,1990-08-30,580,2448133.5,0.2643631980715146,2489.0,658.0,555.0,18.716216216216218,15.0,3.0,113.0,0.0,0.0,129.0,148.0,34.0,106.0,12.0,239.0,14.0,0.0,267.0,129.0,4.0,2.0,63.0,234.0,85.0,7.0,92.0,2.0,4.0,267.0,26.0,212.0,2.0,3.0,11.0,80.0,1.0,150.0,51.0,52.0,65.0,151.0,83.0,17.0,22.0,5.0,0.0,1.0,0.0,1,2331,28.06,43.0,51.86,50.6,15.64,15.57,91.03,61.86,19.0,10.6,6.31,1.89,0.99,0.77,0.64,8.41,6.31,13.6,13.38,6.26,7.08,3.26,22.69,3.56,2.23,1.29,0.64,2.57,4.42,2.75,1.42,0.0,0.6,0.17,9.09,0.04,0.09,0.0,0.99,15.36,3.35,2.27,2.62,3.3,1.59,4.08,2.45,1.2,0.64,0.6,0.43,0.26,0.09,0.04,0.09,8.71,2.49,1.72,2.92,2.02,0.56,3.9,15.83,1.84,10.94,2.02,6.44,2.66,2.49,0.13,0.13,0.47,0.04,0.04,0.64,0.09,0.04,0.04,0.47,0.0,19.18,6.35,5.53,0.17,0.09,0.17,0.0,1.33,0.0,5.36,0.0,0.17,418.0,4.18,0.16793893129770993,135.0,1.35,0.05423865006026517,217.0,2.17,0.08718360787464845,552.0,5.52,0.2217758135797509,293.0,0.11771795901968662,,
56,56,Bush - Speech58 - Edited.txt,09/09/1990,1990-09-09,590,2448143.5,0.2686993806574559,2099.0,564.0,480.0,20.460176991150444,1.0,3.0,59.0,0.0,0.0,99.0,113.0,22.0,91.0,9.0,234.0,13.0,2.0,256.0,129.0,4.0,4.0,53.0,197.0,135.0,21.0,67.0,1.0,1.0,194.0,26.0,130.0,1.0,2.0,4.0,72.0,0.0,124.0,40.0,32.0,44.0,96.0,69.0,9.0,7.0,10.0,1.0,0.0,0.0,1,2045,47.13,59.27,47.57,77.88,18.1,19.27,88.9,60.24,18.14,9.0,3.91,2.49,0.49,1.37,0.73,9.14,7.38,13.55,11.15,4.94,6.8,1.86,17.46,3.72,2.25,0.88,0.49,1.81,4.45,3.62,0.78,0.1,0.15,0.2,9.34,0.0,0.39,0.0,1.37,15.55,4.79,1.27,2.35,3.08,1.96,4.21,2.44,1.08,0.93,0.44,0.78,0.44,0.1,0.05,0.24,8.75,3.57,1.66,2.4,1.08,0.64,2.89,12.08,1.91,11.44,0.73,8.41,2.4,2.05,0.15,0.05,0.39,0.05,0.0,0.59,0.0,0.0,0.44,0.15,0.0,13.3,5.53,4.84,0.05,0.1,0.2,0.0,0.98,0.0,1.56,0.0,0.05,420.0,4.2,0.20009528346831826,137.0,1.37,0.06526917579799904,133.0,1.33,0.06336350643163412,405.0,4.05,0.19294902334444974,220.0,0.10481181515007146,,
57,57,Bush - Speech59 - Edited.txt,21/09/1990,1990-09-21,602,2448155.5,0.2741219216794509,2477.0,679.0,558.0,17.645569620253166,9.0,7.0,87.0,0.0,1.0,150.0,158.0,28.0,94.0,19.0,255.0,12.0,0.0,253.0,119.0,5.0,2.0,69.0,241.0,86.0,9.0,92.0,2.0,1.0,287.0,33.0,171.0,5.0,0.0,14.0,88.0,1.0,151.0,52.0,79.0,32.0,136.0,95.0,21.0,13.0,13.0,1.0,0.0,0.0,1,2333,29.78,57.48,49.16,43.76,14.67,17.45,89.71,60.31,20.83,11.27,5.74,1.8,1.24,1.67,0.81,9.56,6.34,12.77,11.96,5.62,6.6,2.49,21.77,2.7,1.46,1.29,1.03,2.57,3.64,2.23,1.24,0.43,0.47,0.04,11.02,0.0,0.04,0.04,1.84,14.14,2.83,1.93,2.31,2.96,1.84,3.94,2.44,1.07,1.03,0.34,0.21,0.0,0.09,0.0,0.09,7.72,2.57,1.2,2.66,1.63,0.51,2.87,15.22,1.67,12.34,2.19,7.16,3.21,2.27,0.39,0.09,0.56,0.09,0.09,0.34,0.0,0.04,0.04,0.17,0.0,19.59,6.73,6.43,0.09,0.17,0.13,0.0,0.99,0.09,4.8,0.0,0.17,428.0,4.28,0.1727896649172386,126.0,1.26,0.050867985466289865,176.0,1.76,0.07105369398465886,545.0,5.45,0.22002422285022205,320.0,0.12918853451756157,,
58,58,Bush - Speech60 - Edited.txt,06/10/1990,1990-10-06,617,2448170.5,0.2200488997555012,2863.0,630.0,523.0,16.024875621890548,9.0,9.0,129.0,0.0,6.0,147.0,201.0,49.0,133.0,9.0,325.0,10.0,0.0,247.0,142.0,5.0,0.0,70.0,302.0,68.0,10.0,76.0,1.0,9.0,317.0,26.0,188.0,1.0,3.0,17.0,102.0,11.0,216.0,52.0,59.0,54.0,180.0,108.0,18.0,28.0,23.0,8.0,0.0,0.0,1,2641,29.44,49.55,72.84,69.32,13.07,16.43,93.0,61.08,19.95,10.26,5.83,1.86,1.02,0.27,1.29,9.69,7.46,12.34,13.18,5.07,7.31,2.8,23.51,3.07,1.14,2.12,0.42,2.35,4.28,3.26,0.95,0.15,0.27,0.27,9.92,0.11,0.23,0.04,0.53,13.52,2.92,1.51,1.63,3.67,1.4,4.24,2.54,0.83,1.21,0.45,0.23,0.0,0.11,0.0,0.08,9.69,2.92,1.63,3.94,2.23,0.27,3.67,17.49,2.35,13.56,2.73,8.41,2.84,4.43,0.23,0.45,1.21,0.11,0.0,1.02,0.04,0.0,0.34,0.42,0.0,22.15,7.46,5.57,0.38,0.11,0.19,0.0,1.4,0.53,6.51,0.0,0.0,456.0,4.56,0.159273489346839,147.0,1.47,0.05134474327628362,192.0,1.92,0.067062521830248,669.0,6.69,0.23367097450227034,343.0,0.1198044009779951,,
59,59,Bush - Speech61 - Edited.txt,09/10/1990,1990-10-09,620,2448173.5,0.217983651226158,4404.0,960.0,766.0,17.84115523465704,17.0,12.0,204.0,1.0,0.0,256.0,277.0,58.0,201.0,20.0,447.0,22.0,0.0,448.0,175.0,14.0,2.0,84.0,420.0,154.0,9.0,152.0,1.0,11.0,501.0,31.0,375.0,8.0,1.0,25.0,141.0,9.0,297.0,129.0,94.0,91.0,261.0,121.0,18.0,57.0,31.0,0.0,0.0,0.0,1,4133,32.84,52.32,62.96,57.8,14.92,15.61,91.75,61.09,19.07,10.67,5.69,2.13,1.11,0.44,1.31,8.4,7.23,12.94,11.15,6.65,7.67,2.81,22.26,3.02,1.31,2.2,0.63,2.35,4.57,3.12,1.43,0.22,0.34,0.22,9.75,0.02,0.05,0.02,0.44,15.24,3.85,1.86,2.44,3.41,1.89,3.92,2.18,0.92,0.87,0.31,0.36,0.12,0.12,0.02,0.1,9.05,2.64,2.11,2.78,2.01,0.7,4.55,15.8,1.45,12.41,2.32,6.73,4.02,2.71,0.27,0.51,0.75,0.1,0.0,0.65,0.0,0.0,0.27,0.31,0.0,19.67,6.46,6.19,0.1,0.15,0.29,0.0,1.21,0.0,5.06,0.0,0.22,735.0,7.35,0.16689373297002724,191.0,1.91,0.04336966394187103,384.0,3.84,0.08719346049046321,993.0,9.93,0.22547683923705722,532.0,0.12079927338782924,,
60,60,Bush - Speech62 - Edited.txt,01/11/1990,1990-11-01,643,2448196.5,0.2083128381701918,4066.0,847.0,700.0,19.809734513274336,15.0,7.0,169.0,0.0,0.0,179.0,226.0,68.0,196.0,21.0,395.0,32.0,0.0,443.0,210.0,8.0,0.0,93.0,352.0,161.0,17.0,148.0,2.0,6.0,462.0,44.0,278.0,8.0,0.0,30.0,113.0,3.0,232.0,62.0,93.0,82.0,312.0,125.0,22.0,25.0,29.0,0.0,0.0,0.0,1,3799,24.85,40.96,66.2,58.13,16.81,17.5,89.1,61.62,19.9,11.37,6.82,1.84,1.13,0.63,0.95,8.53,6.42,12.74,13.19,6.11,7.84,2.58,22.37,3.0,1.87,1.55,0.68,2.21,4.53,3.03,1.32,0.21,0.61,0.08,8.29,0.08,0.08,0.05,0.61,15.87,4.61,1.97,2.5,3.26,1.68,4.13,1.87,0.74,0.53,0.5,0.29,0.13,0.03,0.0,0.13,7.24,2.18,1.13,2.47,1.29,0.71,2.97,16.58,1.76,11.08,1.5,6.66,3.05,1.53,0.18,0.24,0.16,0.05,0.13,0.53,0.03,0.0,0.21,0.24,0.0,17.87,5.79,4.71,0.13,0.16,0.16,0.0,1.58,0.0,5.03,0.0,0.32,678.0,6.78,0.16674864731923267,218.0,2.18,0.05361534677816036,286.0,2.86,0.07033939990162322,906.0,9.06,0.22282341367437286,506.0,0.12444663059517953,,
61,61,Bush - Speech63 - Edited.txt,08/11/1990,1990-11-08,650,2448203.5,0.2823244552058111,2065.0,583.0,491.0,21.185185185185187,10.0,4.0,51.0,0.0,1.0,114.0,108.0,20.0,95.0,9.0,226.0,9.0,0.0,239.0,96.0,5.0,2.0,52.0,188.0,109.0,7.0,74.0,2.0,3.0,218.0,27.0,149.0,0.0,0.0,11.0,68.0,1.0,106.0,36.0,35.0,48.0,109.0,84.0,13.0,15.0,8.0,1.0,0.0,0.0,1,1964,36.54,50.61,47.47,54.53,17.85,17.26,89.87,61.97,19.5,10.79,5.3,1.99,0.76,2.24,0.51,8.71,7.28,13.19,11.3,5.91,7.18,2.34,20.11,2.75,1.27,1.48,0.56,2.29,5.5,3.51,1.99,0.36,0.76,0.31,9.93,0.0,0.1,0.2,2.19,16.04,4.38,1.99,2.19,2.55,2.19,4.79,2.04,0.61,0.71,0.56,0.71,0.15,0.15,0.1,0.36,8.4,3.05,1.22,2.6,1.17,0.92,3.21,13.85,1.88,10.59,1.93,6.52,2.44,1.43,0.05,0.31,0.15,0.2,0.0,0.97,0.1,0.1,0.2,0.56,0.0,17.06,5.75,5.8,0.1,0.1,0.05,0.0,0.92,0.1,4.12,0.0,0.1,378.0,3.78,0.18305084745762712,103.0,1.03,0.049878934624697335,149.0,1.49,0.07215496368038742,418.0,4.18,0.20242130750605328,245.0,0.11864406779661017,,
62,62,Bush - Speech64 - Edited.txt,30/11/1990,1990-11-30,672,2448225.5,0.2400616332819722,3245.0,779.0,654.0,16.901869158878505,9.0,5.0,144.0,0.0,0.0,151.0,214.0,37.0,124.0,28.0,342.0,19.0,0.0,336.0,160.0,3.0,9.0,79.0,323.0,142.0,18.0,111.0,2.0,8.0,336.0,25.0,210.0,2.0,1.0,13.0,126.0,6.0,217.0,51.0,53.0,72.0,203.0,121.0,17.0,36.0,21.0,0.0,1.0,0.0,1,3087,38.23,48.7,55.3,79.5,13.97,17.46,90.7,59.48,18.69,10.17,5.86,1.46,1.23,1.04,0.58,8.52,6.87,13.18,12.83,4.89,6.22,2.56,21.87,3.17,1.59,2.01,1.07,2.24,5.28,3.95,1.0,0.03,0.42,0.13,9.2,0.03,0.16,0.0,1.13,14.64,4.02,1.62,1.88,2.69,2.07,3.79,1.98,0.58,0.81,0.45,1.3,0.52,0.45,0.0,0.32,8.16,2.43,1.33,3.34,1.88,0.39,3.43,16.39,2.07,11.05,1.98,6.64,2.66,2.66,0.06,0.39,0.52,0.13,0.1,0.91,0.0,0.23,0.29,0.36,0.0,18.53,7.03,4.89,0.19,0.23,0.39,0.0,1.17,0.0,4.57,0.0,0.06,594.0,5.94,0.18305084745762712,172.0,1.72,0.05300462249614792,213.0,2.13,0.06563944530046224,717.0,7.17,0.2209553158705701,361.0,0.11124807395993837,,
63,63,Bush - Speech65 - Edited.txt,18/12/1990,1990-12-18,690,2448243.5,0.2318768619662363,4028.0,934.0,800.0,19.84070796460177,18.0,6.0,165.0,2.0,3.0,227.0,226.0,60.0,196.0,35.0,438.0,15.0,0.0,427.0,224.0,4.0,11.0,119.0,412.0,136.0,8.0,111.0,1.0,1.0,434.0,41.0,278.0,5.0,4.0,22.0,124.0,4.0,239.0,103.0,66.0,75.0,220.0,122.0,24.0,30.0,31.0,5.0,0.0,1.0,1,3829,30.34,50.21,51.9,57.88,16.79,16.06,90.91,61.45,19.14,10.08,5.51,1.7,1.25,0.97,0.65,9.06,6.84,12.56,12.48,5.38,8.1,2.45,20.11,3.4,1.72,1.88,1.12,2.64,4.6,3.13,1.44,0.21,0.55,0.34,9.35,0.16,0.24,0.0,1.18,16.14,4.18,2.25,2.35,3.71,1.96,4.26,1.88,0.76,0.6,0.34,0.39,0.08,0.18,0.03,0.1,8.91,2.4,1.91,3.55,1.46,0.47,4.05,13.66,2.04,10.66,1.67,6.32,2.79,2.3,0.16,0.13,0.76,0.03,0.08,0.71,0.03,0.08,0.29,0.26,0.03,18.18,5.85,5.93,0.08,0.31,0.34,0.0,1.65,0.16,3.55,0.0,0.31,667.0,6.67,0.16559086395233366,239.0,2.39,0.05933465739821251,287.0,2.87,0.07125124131082423,825.0,8.25,0.2048162859980139,475.0,0.1179245283018868,,
64,64,Bush - Speech66 - Edited.txt,09/01/1991,1991-01-09,712,2448265.5,0.2185368877867328,3226.0,705.0,595.0,16.465753424657535,13.0,4.0,128.0,0.0,0.0,158.0,219.0,39.0,126.0,23.0,325.0,23.0,0.0,343.0,135.0,8.0,4.0,88.0,286.0,178.0,16.0,67.0,0.0,3.0,383.0,18.0,249.0,4.0,2.0,18.0,120.0,3.0,210.0,107.0,53.0,72.0,153.0,114.0,15.0,24.0,13.0,6.0,0.0,1.0,1,3062,28.89,47.39,50.87,38.55,13.98,15.09,90.24,62.25,19.46,10.91,6.21,1.37,0.65,2.29,0.39,8.56,6.56,13.32,13.29,6.07,6.83,2.97,23.06,3.0,1.5,1.34,0.88,2.29,3.89,2.22,1.5,0.2,0.72,0.26,10.52,0.0,0.16,0.03,2.45,15.48,4.83,1.76,2.12,3.07,1.73,4.02,2.12,0.62,0.91,0.52,0.49,0.1,0.23,0.0,0.16,7.97,2.35,1.37,3.23,0.85,0.49,5.0,13.91,2.55,10.48,1.73,6.24,2.71,1.76,0.1,0.16,0.1,0.1,0.16,0.52,0.0,0.03,0.29,0.2,0.0,18.35,7.15,5.16,0.07,0.1,0.13,0.0,1.34,0.0,4.08,0.0,0.33,547.0,5.47,0.16955982641041537,147.0,1.47,0.045567265964042154,255.0,2.55,0.07904525728456292,709.0,7.09,0.21977681339119653,401.0,0.12430254184748915,,
65,65,Bush - Speech67 - Edited.txt,12/01/1991,1991-01-12,715,2448268.5,0.2588,2500.0,647.0,557.0,22.136,9.0,7.0,103.0,0.0,0.0,142.0,125.0,31.0,99.0,13.0,275.0,9.0,1.0,303.0,121.0,4.0,7.0,67.0,238.0,124.0,13.0,79.0,1.0,2.0,224.0,15.0,208.0,4.0,0.0,7.0,89.0,4.0,165.0,67.0,34.0,60.0,112.0,72.0,18.0,22.0,10.0,1.0,1.0,0.0,1,2415,46.21,39.22,66.04,74.37,18.72,17.85,90.31,60.54,17.02,8.36,5.3,1.12,0.87,0.79,0.29,8.65,7.66,13.83,11.35,5.96,6.71,2.73,20.21,2.86,1.74,1.66,0.66,2.69,4.8,3.64,1.04,0.33,0.41,0.12,7.95,0.0,0.12,0.0,0.87,17.47,4.8,2.19,2.53,3.77,2.03,4.64,3.15,0.99,1.16,0.7,0.25,0.0,0.17,0.0,0.08,7.25,1.7,1.49,3.19,1.12,0.75,3.89,13.42,1.74,12.05,1.74,6.92,3.56,1.78,0.04,0.17,0.12,0.08,0.25,0.95,0.0,0.17,0.41,0.37,0.0,15.98,5.71,5.88,0.0,0.08,0.12,0.0,1.53,0.0,2.61,0.0,0.04,454.0,4.54,0.1816,132.0,1.32,0.0528,212.0,2.12,0.0848,510.0,5.1,0.204,239.0,0.0956,,
66,66,Bush - Speech68 - Edited.txt,18/01/1991,1991-01-18,721,2448274.5,0.2854054054054054,1850.0,528.0,465.0,19.81553398058253,10.0,3.0,54.0,0.0,0.0,88.0,103.0,25.0,66.0,2.0,200.0,19.0,0.0,215.0,86.0,1.0,4.0,46.0,194.0,73.0,8.0,52.0,2.0,1.0,169.0,17.0,127.0,7.0,1.0,7.0,71.0,1.0,111.0,27.0,48.0,45.0,107.0,67.0,21.0,19.0,10.0,1.0,0.0,0.0,1,1766,35.47,53.4,64.42,23.98,16.98,16.25,90.66,61.83,19.2,9.06,4.02,1.87,0.85,1.25,1.08,10.14,6.29,14.04,12.97,5.95,6.0,2.38,19.93,2.83,1.53,1.76,0.11,2.83,5.27,2.55,2.66,0.45,1.36,0.11,8.95,0.0,0.11,0.0,1.47,15.18,3.79,1.3,1.36,2.89,2.15,4.42,2.1,0.74,0.91,0.4,0.51,0.11,0.23,0.0,0.17,8.55,2.49,1.87,3.45,0.68,1.08,3.0,14.61,2.1,13.59,1.93,8.38,3.17,1.19,0.17,0.11,0.17,0.06,0.17,0.68,0.0,0.06,0.06,0.57,0.0,16.08,5.72,4.98,0.0,0.06,0.23,0.0,1.53,0.0,3.51,0.0,0.06,327.0,3.27,0.17675675675675676,91.0,0.91,0.049189189189189186,135.0,1.35,0.07297297297297298,405.0,4.05,0.21891891891891893,186.0,0.10054054054054054,,
67,67,Bush - Speech69 - Edited.txt,05/02/1991,1991-02-05,739,2448292.5,0.2195422101895151,4063.0,892.0,742.0,20.368181818181817,13.0,8.0,163.0,5.0,2.0,197.0,220.0,62.0,194.0,30.0,397.0,27.0,1.0,420.0,176.0,5.0,0.0,105.0,382.0,151.0,6.0,143.0,2.0,3.0,419.0,58.0,288.0,6.0,2.0,21.0,160.0,7.0,262.0,75.0,100.0,86.0,233.0,140.0,26.0,45.0,22.0,3.0,0.0,0.0,1,3846,30.39,50.62,56.09,34.82,17.48,15.16,91.13,62.66,19.24,10.56,5.46,2.08,0.96,1.12,0.94,8.68,6.29,13.7,12.48,5.98,7.28,3.15,22.23,2.5,0.91,1.92,0.94,1.59,4.37,2.37,1.85,0.26,0.75,0.44,9.85,0.21,0.13,0.16,1.3,14.95,3.82,1.92,1.79,2.91,2.0,4.11,2.68,1.22,0.96,0.36,0.52,0.21,0.29,0.03,0.0,8.66,2.78,1.87,2.81,1.38,0.65,3.22,15.0,2.78,11.44,2.24,6.86,2.89,1.51,0.36,0.13,0.1,0.13,0.31,0.65,0.03,0.0,0.23,0.39,0.0,17.13,5.59,5.12,0.03,0.29,0.18,0.0,1.61,0.1,3.95,0.0,0.26,682.0,6.82,0.1678562638444499,181.0,1.81,0.04454836327836574,296.0,2.96,0.07285257199113955,896.0,8.96,0.22052670440561162,477.0,0.11740093526950529,,
68,68,Bush - Speech70 - Edited.txt,01/03/1991,1991-03-01,763,2448316.5,0.2180611519317374,4219.0,920.0,766.0,18.10546875,20.0,13.0,200.0,1.0,2.0,156.0,256.0,51.0,200.0,19.0,462.0,28.0,0.0,472.0,213.0,9.0,0.0,107.0,391.0,172.0,25.0,177.0,5.0,10.0,411.0,50.0,287.0,3.0,0.0,25.0,151.0,2.0,267.0,85.0,60.0,116.0,248.0,99.0,31.0,21.0,21.0,2.0,0.0,0.0,1,4037,40.26,61.61,55.28,67.0,15.47,16.22,90.04,61.21,18.03,9.76,4.16,2.33,0.97,0.32,1.98,8.27,7.33,13.6,11.94,5.82,7.36,2.18,20.14,3.05,1.49,1.26,0.82,2.38,4.31,3.22,1.04,0.12,0.57,0.07,10.11,0.15,0.25,0.05,0.47,14.24,3.62,1.66,1.78,2.58,1.88,4.11,2.25,0.89,0.67,0.47,0.47,0.15,0.15,0.0,0.2,8.25,3.24,1.31,2.63,0.97,0.59,4.38,13.72,2.3,12.01,1.81,6.84,3.69,1.73,0.22,0.35,0.35,0.07,0.17,0.47,0.0,0.15,0.1,0.22,0.0,15.98,6.74,3.86,0.1,0.22,0.15,0.0,1.19,0.1,3.54,0.0,0.07,765.0,7.65,0.18132258829106424,222.0,2.22,0.05261910405309315,290.0,2.9,0.0687366674567433,875.0,8.75,0.20739511732638066,461.0,0.10926759895709884,,
69,69,Bush - Speech71 - Edited.txt,13/03/1991,1991-03-13,775,2448328.5,0.2524271844660194,2987.0,754.0,633.0,20.6,6.0,14.0,99.0,0.0,1.0,148.0,160.0,53.0,116.0,14.0,311.0,13.0,0.0,373.0,127.0,4.0,8.0,66.0,299.0,208.0,15.0,101.0,1.0,6.0,281.0,35.0,186.0,10.0,0.0,9.0,99.0,4.0,160.0,50.0,65.0,77.0,150.0,91.0,22.0,21.0,11.0,1.0,0.0,0.0,1,2836,52.33,62.59,58.69,48.68,17.61,17.14,89.14,59.2,17.45,9.66,4.62,2.79,0.63,1.2,0.42,7.79,6.91,15.41,11.57,4.9,6.56,1.97,19.78,4.23,2.61,1.3,0.56,2.54,4.41,2.72,1.48,0.42,0.56,0.35,9.7,0.04,0.56,0.0,1.3,13.15,3.6,1.09,1.87,3.42,1.34,3.31,2.54,0.95,0.99,0.56,0.63,0.25,0.0,0.0,0.35,9.27,4.16,1.48,2.64,1.45,0.78,3.81,12.69,2.26,13.86,2.08,8.89,3.35,2.05,0.25,0.35,0.56,0.28,0.0,0.42,0.0,0.04,0.28,0.11,0.0,16.96,5.57,5.22,0.04,0.21,0.35,0.0,1.9,0.07,3.39,0.0,0.21,623.0,6.23,0.20857047204553064,139.0,1.39,0.04653498493471711,196.0,1.96,0.06561767659859391,593.0,5.93,0.19852695011717442,316.0,0.10579176431201875,,
70,70,Bush - Speech72 - Edited.txt,14/03/1991,1991-03-14,776,2448329.5,0.2536231884057971,2346.0,595.0,512.0,20.00769230769231,6.0,10.0,84.0,0.0,1.0,123.0,130.0,22.0,100.0,11.0,245.0,16.0,0.0,265.0,117.0,3.0,1.0,53.0,249.0,120.0,6.0,73.0,3.0,14.0,192.0,37.0,159.0,5.0,1.0,8.0,98.0,4.0,159.0,69.0,47.0,41.0,97.0,79.0,11.0,32.0,9.0,1.0,0.0,0.0,1,2252,46.29,65.38,48.25,79.88,17.19,16.16,90.14,60.75,17.36,9.28,3.73,2.98,0.89,0.75,0.93,8.08,7.1,14.52,11.9,5.95,6.39,2.26,19.76,2.8,1.51,1.91,0.75,3.06,4.71,3.73,0.75,0.27,0.18,0.18,10.17,0.0,0.13,0.04,0.71,14.92,3.77,1.95,2.09,3.91,1.55,4.09,2.0,0.53,1.07,0.4,0.75,0.09,0.18,0.0,0.49,9.24,3.73,1.29,1.95,1.64,0.84,3.55,13.54,2.26,11.99,2.4,7.06,2.66,2.31,0.36,0.53,0.04,0.0,0.18,0.8,0.0,0.04,0.58,0.18,0.0,17.14,6.35,5.46,0.09,0.04,0.09,0.0,1.33,0.09,3.42,0.0,0.27,448.0,4.48,0.19096334185848252,121.0,1.21,0.051577152600170505,165.0,1.65,0.07033248081841433,492.0,4.92,0.20971867007672634,229.0,0.09761295822676896,,
71,71,Bush - Speech73 - Edited.txt,16/03/1991,1991-03-16,778,2448331.5,0.3104534005037783,1588.0,493.0,438.0,22.935064935064936,4.0,4.0,66.0,0.0,0.0,100.0,77.0,30.0,78.0,4.0,174.0,12.0,1.0,181.0,54.0,2.0,0.0,32.0,149.0,112.0,18.0,56.0,1.0,2.0,136.0,16.0,110.0,0.0,0.0,8.0,61.0,0.0,101.0,34.0,38.0,29.0,85.0,43.0,9.0,9.0,4.0,0.0,0.0,0.0,1,1518,53.96,69.64,35.52,84.07,18.98,16.53,87.48,59.22,16.01,9.42,3.1,3.69,0.66,0.86,1.12,6.59,7.71,14.36,10.74,5.14,7.18,2.57,19.43,2.77,1.58,1.05,0.33,2.31,4.28,3.75,0.46,0.07,0.13,0.2,10.41,0.0,0.07,0.0,0.99,13.04,2.31,1.25,2.04,2.96,1.58,3.95,2.24,1.05,0.92,0.2,0.72,0.0,0.13,0.0,0.53,9.62,4.55,1.32,2.83,0.92,0.59,2.96,14.23,1.65,12.32,2.11,6.98,3.49,2.37,0.4,0.4,0.07,0.66,0.0,0.66,0.0,0.53,0.26,0.07,0.0,18.25,5.93,6.59,0.07,0.07,0.0,0.0,2.24,0.0,3.36,0.0,0.0,335.0,3.35,0.21095717884130982,56.0,0.56,0.03526448362720403,110.0,1.1,0.06926952141057935,330.0,3.3,0.20780856423173805,152.0,0.09571788413098237,,
72,72,Bush - Speech74 - Edited.txt,23/03/1991,1991-03-23,785,2448338.5,0.3163064833005894,1527.0,483.0,417.0,17.06,2.0,2.0,56.0,0.0,2.0,79.0,100.0,23.0,62.0,3.0,156.0,7.0,0.0,175.0,84.0,6.0,2.0,39.0,131.0,101.0,7.0,52.0,0.0,3.0,141.0,12.0,113.0,1.0,0.0,9.0,55.0,5.0,99.0,32.0,30.0,29.0,79.0,44.0,7.0,13.0,3.0,2.0,0.0,0.0,1,1445,48.36,57.95,42.47,81.79,14.45,17.79,89.13,59.93,17.02,9.07,4.15,2.49,0.76,0.55,1.11,7.96,6.78,14.88,11.63,5.95,6.02,2.56,20.69,3.53,1.52,1.18,0.28,2.35,5.81,4.43,1.31,0.35,0.48,0.0,9.55,0.0,0.48,0.0,0.55,15.57,3.46,1.25,3.32,3.32,2.15,4.08,2.42,1.31,0.76,0.28,0.35,0.07,0.14,0.0,0.14,10.24,3.46,1.59,3.53,1.38,1.04,3.67,14.53,1.8,12.04,2.01,7.2,3.04,2.77,0.28,0.42,0.83,0.0,0.14,1.11,0.0,0.0,0.28,0.83,0.0,18.96,6.85,5.47,0.0,0.0,0.35,0.0,1.94,0.28,4.08,0.0,0.0,291.0,2.91,0.1905697445972495,92.0,0.92,0.06024885396201703,114.0,1.14,0.07465618860510806,313.0,3.13,0.20497707924034053,153.0,0.10019646365422397,,
73,73,Bush - Speech75 - Edited.txt,04/04/1991,1991-04-04,797,2448350.5,0.3682539682539683,945.0,348.0,315.0,17.8135593220339,1.0,0.0,33.0,0.0,0.0,47.0,59.0,11.0,40.0,14.0,104.0,4.0,0.0,118.0,58.0,4.0,0.0,23.0,91.0,74.0,9.0,31.0,0.0,4.0,81.0,7.0,45.0,0.0,1.0,4.0,31.0,6.0,58.0,21.0,10.0,12.0,45.0,23.0,6.0,8.0,2.0,0.0,0.0,0.0,1,917,66.9,68.03,34.74,33.29,15.28,17.56,85.93,55.94,15.81,8.62,3.71,3.27,0.76,0.33,0.55,7.2,7.42,14.61,9.27,3.93,6.11,1.74,16.68,3.49,1.09,1.2,1.96,1.85,5.67,2.94,2.51,0.11,1.2,0.44,9.6,0.11,0.11,0.11,0.55,12.87,2.94,1.64,1.85,1.64,2.84,3.27,1.96,1.31,0.22,0.65,0.55,0.33,0.11,0.0,0.11,11.01,4.91,1.09,3.93,1.74,0.65,2.62,12.21,1.53,10.91,1.42,7.42,2.51,1.85,0.11,0.0,0.22,0.98,0.22,1.42,0.22,0.11,0.98,0.11,0.0,15.81,6.43,5.13,0.0,0.0,0.65,0.0,1.42,0.0,2.18,0.0,0.0,205.0,2.05,0.21693121693121692,62.0,0.62,0.0656084656084656,46.0,0.46,0.04867724867724868,169.0,1.69,0.17883597883597885,88.0,0.09312169312169312,,
74,74,Bush - Speech76 - Edited.txt,06/04/1991,1991-04-06,799,2448352.5,0.2845894263217098,1778.0,506.0,443.0,16.33606557377049,7.0,7.0,70.0,0.0,0.0,91.0,122.0,17.0,88.0,10.0,194.0,12.0,0.0,173.0,86.0,6.0,2.0,41.0,168.0,78.0,7.0,57.0,1.0,3.0,198.0,25.0,123.0,1.0,0.0,6.0,73.0,0.0,122.0,28.0,33.0,26.0,106.0,65.0,6.0,13.0,12.0,0.0,0.0,0.0,1,1691,29.61,68.6,44.48,77.02,13.75,15.08,90.66,61.8,20.28,10.7,4.26,3.49,1.42,0.35,1.18,9.58,6.92,12.83,11.83,6.45,7.39,2.25,21.41,3.25,1.36,1.66,0.71,2.19,4.79,3.73,0.95,0.12,0.06,0.12,10.35,0.12,0.18,0.06,0.53,15.43,3.43,2.13,2.9,2.96,1.66,3.9,2.07,1.24,0.59,0.24,0.12,0.0,0.0,0.06,0.06,9.93,4.55,1.66,2.13,1.6,0.65,3.13,15.85,2.72,11.83,2.66,6.39,3.25,1.66,0.06,0.06,0.06,0.18,0.0,0.53,0.0,0.06,0.06,0.41,0.0,18.69,7.1,5.44,0.12,0.24,0.35,0.0,0.89,0.0,4.55,0.0,0.0,310.0,3.1,0.17435320584926883,94.0,0.94,0.052868391451068614,124.0,1.24,0.06974128233970754,380.0,3.8,0.21372328458942633,223.0,0.12542182227221596,,
75,75,Bush - Speech77 - Edited.txt,07/04/1991,1991-04-07,800,2448353.5,0.3325358851674641,1254.0,417.0,369.0,17.34567901234568,5.0,3.0,46.0,0.0,0.0,70.0,81.0,13.0,50.0,11.0,140.0,5.0,0.0,139.0,53.0,5.0,1.0,26.0,116.0,68.0,11.0,53.0,1.0,2.0,125.0,22.0,97.0,0.0,0.0,2.0,40.0,3.0,75.0,22.0,31.0,23.0,82.0,21.0,7.0,9.0,1.0,0.0,0.0,0.0,1,1216,41.81,76.29,60.1,74.74,14.31,16.53,89.72,59.21,18.83,11.43,4.61,4.36,1.64,0.08,0.74,7.4,7.07,12.91,10.2,6.33,6.41,2.06,19.24,2.71,1.07,1.15,1.32,2.63,6.0,4.19,1.56,0.08,0.58,0.41,10.61,0.0,0.25,0.08,0.41,12.91,2.38,2.63,1.4,3.29,1.89,2.8,1.48,0.99,0.33,0.16,0.66,0.25,0.25,0.0,0.16,10.94,5.43,1.32,3.21,1.64,0.49,2.96,14.31,3.62,14.23,2.63,8.14,3.87,2.47,0.0,0.16,0.49,0.16,0.08,0.99,0.0,0.41,0.25,0.33,0.0,17.68,7.4,5.84,0.08,0.08,0.33,0.08,1.15,0.0,2.71,0.0,0.0,248.0,2.48,0.19776714513556617,59.0,0.59,0.04704944178628389,97.0,0.97,0.0773524720893142,254.0,2.54,0.2025518341307815,147.0,0.11722488038277512,,
76,76,Bush - Speech78 - Edited.txt,16/04/1991,1991-04-16,809,2448362.5,0.2220899077106281,3359.0,746.0,624.0,17.97584541062802,13.0,5.0,160.0,0.0,2.0,152.0,207.0,65.0,154.0,21.0,346.0,25.0,0.0,340.0,158.0,7.0,3.0,98.0,273.0,131.0,26.0,153.0,0.0,3.0,337.0,41.0,240.0,2.0,2.0,21.0,103.0,6.0,226.0,54.0,72.0,90.0,202.0,97.0,21.0,37.0,4.0,2.0,0.0,0.0,1,3154,30.66,66.69,36.29,61.85,15.02,15.66,89.7,60.91,18.99,10.81,4.19,2.79,1.14,0.98,1.71,8.18,6.53,12.9,13.28,5.52,6.94,2.73,22.57,3.55,1.71,1.46,0.79,2.12,5.39,3.61,1.71,0.35,0.51,0.1,11.29,0.1,0.03,0.16,1.11,14.97,3.71,1.3,3.3,3.3,1.4,3.99,1.65,0.76,0.6,0.19,0.44,0.1,0.29,0.03,0.03,9.83,3.61,1.24,2.47,1.71,1.4,3.84,15.25,2.89,11.29,1.68,6.91,2.82,1.24,0.0,0.22,0.13,0.1,0.25,0.73,0.0,0.1,0.19,0.41,0.0,19.02,6.47,4.85,0.1,0.32,0.48,0.0,1.9,0.13,4.72,0.0,0.06,583.0,5.83,0.173563560583507,168.0,1.68,0.05001488538255433,244.0,2.44,0.07264066686513844,741.0,7.41,0.220601369455195,378.0,0.11253349211074724,,
77,77,Bush - Speech79 - Edited.txt,20/05/1991,1991-05-20,843,2448396.5,0.494140625,512.0,253.0,234.0,15.45945945945946,1.0,0.0,16.0,0.0,0.0,22.0,37.0,2.0,20.0,4.0,50.0,5.0,0.0,60.0,19.0,1.0,0.0,15.0,48.0,37.0,1.0,20.0,0.0,3.0,52.0,8.0,28.0,0.0,1.0,2.0,21.0,2.0,32.0,23.0,6.0,9.0,24.0,10.0,1.0,6.0,3.0,0.0,0.0,0.0,1,491,54.55,66.56,57.92,36.52,13.27,15.89,87.58,57.84,17.52,10.18,4.89,2.85,0.81,0.2,1.43,7.33,6.52,15.27,10.79,4.89,6.11,1.83,19.96,3.67,2.04,1.83,0.81,2.44,5.09,2.65,2.04,0.0,1.02,0.81,9.37,0.2,0.0,0.0,0.41,11.2,3.67,0.81,1.83,2.04,2.44,2.04,2.24,0.81,0.81,0.2,0.41,0.0,0.0,0.2,0.2,10.18,4.28,1.83,3.05,1.63,0.0,4.68,11.2,1.22,13.65,2.04,8.55,3.46,2.04,0.41,0.2,0.81,0.0,0.2,0.81,0.0,0.0,0.81,0.0,0.0,17.31,7.94,4.48,0.2,0.0,0.41,0.0,0.2,0.0,4.07,0.0,0.0,106.0,1.06,0.20703125,20.0,0.2,0.0390625,29.0,0.29,0.056640625,104.0,1.04,0.203125,60.0,0.1171875,,
78,78,Bush - Speech80 - Edited.txt,28/05/1991,1991-05-28,851,2448404.5,0.2441534144059869,3207.0,783.0,649.0,17.509708737864077,19.0,6.0,128.0,1.0,6.0,189.0,206.0,63.0,164.0,32.0,290.0,14.0,0.0,333.0,137.0,7.0,6.0,60.0,274.0,133.0,7.0,100.0,0.0,5.0,391.0,46.0,239.0,1.0,0.0,23.0,99.0,5.0,190.0,102.0,70.0,56.0,209.0,87.0,17.0,29.0,10.0,6.0,0.0,0.0,1,2970,23.33,52.69,77.1,80.64,14.35,14.11,91.62,61.21,21.55,12.73,6.43,2.86,0.91,1.48,1.04,8.82,5.45,13.2,11.21,6.09,8.25,2.69,22.05,3.67,2.05,1.45,1.21,1.72,4.92,3.94,0.91,0.13,0.2,0.3,11.25,0.24,0.1,0.2,1.41,14.21,3.54,1.48,2.22,3.03,1.01,5.19,2.39,0.84,0.84,0.67,0.91,0.2,0.4,0.0,0.27,9.53,3.87,1.21,2.86,2.32,0.44,4.65,15.22,1.65,14.01,2.96,7.85,3.97,2.53,0.74,0.4,0.98,0.1,0.0,0.88,0.03,0.03,0.24,0.47,0.03,21.68,6.6,6.36,0.1,0.17,0.37,0.0,1.99,0.4,5.39,0.0,0.3,514.0,5.14,0.1602743997505457,150.0,1.5,0.04677268475210477,240.0,2.4,0.07483629560336763,714.0,7.14,0.2226379794200187,437.0,0.13626442157779856,,
79,79,Bush - Speech81 - Edited.txt,01/07/1991,1991-07-01,885,2448438.5,0.1991150442477876,5876.0,1170.0,934.0,19.209302325581397,19.0,14.0,212.0,0.0,9.0,379.0,344.0,25.0,290.0,40.0,558.0,27.0,2.0,660.0,307.0,17.0,14.0,134.0,581.0,238.0,10.0,176.0,4.0,14.0,661.0,78.0,424.0,6.0,2.0,34.0,198.0,16.0,365.0,172.0,104.0,110.0,312.0,184.0,35.0,45.0,25.0,8.0,0.0,0.0,1,5589,31.82,53.44,54.2,72.65,16.25,14.4,91.09,61.32,20.47,11.47,5.55,2.18,1.13,2.13,0.48,9.0,6.26,13.74,11.33,5.14,7.93,2.72,20.72,3.58,2.16,1.49,1.09,2.34,5.05,3.7,1.2,0.11,0.45,0.14,10.63,0.25,0.07,0.18,2.31,14.9,3.54,1.2,2.2,3.36,1.56,4.76,2.5,1.25,0.79,0.36,0.55,0.21,0.16,0.04,0.14,8.95,2.95,1.31,3.33,1.9,0.5,4.51,13.85,1.86,12.11,2.0,7.51,3.01,2.11,0.38,0.36,0.52,0.09,0.05,0.89,0.05,0.0,0.3,0.47,0.02,19.13,6.1,6.78,0.16,0.29,0.25,0.0,0.45,0.29,4.78,0.0,0.04,1005.0,10.05,0.1710347174948945,338.0,3.38,0.05752212389380531,432.0,4.32,0.07351940095302927,1247.0,12.47,0.21221919673247108,739.0,0.12576582709326073,,
80,80,Bush - Speech82 - Edited.txt,09/07/1991,1991-07-09,893,2448446.5,0.3436426116838488,1164.0,400.0,364.0,22.614035087719294,3.0,5.0,41.0,0.0,1.0,68.0,57.0,11.0,52.0,10.0,114.0,2.0,1.0,145.0,56.0,3.0,1.0,28.0,116.0,67.0,7.0,45.0,0.0,0.0,115.0,13.0,62.0,1.0,1.0,5.0,41.0,1.0,65.0,17.0,26.0,23.0,77.0,33.0,8.0,9.0,6.0,1.0,0.0,1.0,1,1113,51.84,62.35,44.81,77.11,19.53,16.44,87.51,58.76,17.88,9.79,4.67,2.88,0.81,0.99,0.45,8.09,7.19,15.09,10.96,4.4,7.64,1.71,20.84,3.68,2.16,1.44,1.17,2.34,3.77,3.23,0.45,0.0,0.09,0.0,8.98,0.0,0.27,0.0,1.17,13.03,3.86,1.8,2.61,2.61,1.44,3.14,1.8,0.99,0.63,0.18,0.27,0.09,0.09,0.0,0.09,10.51,4.13,1.44,3.32,2.25,0.18,3.32,15.09,2.7,12.13,1.89,7.37,3.14,2.88,0.27,0.0,0.18,0.27,0.09,0.45,0.0,0.09,0.09,0.09,0.0,16.62,5.66,6.2,0.0,0.09,0.09,0.0,0.9,0.18,3.5,0.0,0.0,235.0,2.35,0.20189003436426117,60.0,0.6,0.05154639175257732,64.0,0.64,0.054982817869415807,241.0,2.41,0.20704467353951891,128.0,0.10996563573883161,,
81,81,Bush - Speech83 - Edited.txt,11/07/1991,1991-07-11,895,2448448.5,0.3672966310599835,1217.0,447.0,401.0,17.55128205128205,3.0,3.0,41.0,1.0,0.0,73.0,78.0,20.0,54.0,16.0,131.0,8.0,0.0,137.0,74.0,1.0,1.0,35.0,130.0,79.0,4.0,36.0,1.0,3.0,120.0,14.0,71.0,1.0,0.0,7.0,30.0,0.0,70.0,18.0,17.0,23.0,61.0,38.0,6.0,7.0,4.0,0.0,0.0,0.0,1,1156,39.79,71.89,53.6,82.91,14.82,18.17,87.98,57.61,18.25,9.78,3.89,3.2,1.64,0.43,0.61,8.48,6.57,12.54,11.76,5.36,6.23,2.08,18.86,3.63,1.21,0.95,1.9,3.46,4.24,3.72,0.52,0.09,0.09,0.0,10.47,0.0,0.26,0.0,0.69,13.58,3.81,0.69,1.99,4.41,1.56,3.55,1.73,0.43,0.78,0.69,0.78,0.09,0.17,0.0,0.52,10.21,4.33,1.21,2.94,1.82,0.43,2.51,13.24,1.9,12.72,1.56,8.04,3.03,2.34,0.17,0.69,0.52,0.78,0.0,0.35,0.0,0.0,0.26,0.09,0.0,19.55,6.57,6.31,0.09,0.09,0.43,0.0,1.99,0.0,3.98,0.0,0.09,249.0,2.49,0.20460147904683648,76.0,0.76,0.062448644207066556,72.0,0.72,0.05916187345932621,227.0,2.27,0.1865242399342646,134.0,0.11010682004930156,,
82,82,Bush - Speech84 - Edited.txt,14/07/1991,1991-07-14,898,2448451.5,0.3441108545034642,1299.0,447.0,387.0,21.2089552238806,2.0,4.0,56.0,3.0,2.0,52.0,67.0,17.0,66.0,15.0,129.0,4.0,0.0,139.0,50.0,2.0,1.0,28.0,123.0,74.0,7.0,46.0,0.0,3.0,122.0,23.0,100.0,1.0,0.0,7.0,55.0,0.0,84.0,29.0,32.0,28.0,68.0,29.0,5.0,5.0,3.0,2.0,0.0,0.0,1,1249,44.47,62.57,55.68,66.67,18.1,15.21,89.59,60.21,17.93,10.41,4.24,2.32,1.12,1.84,0.88,7.53,6.33,14.49,11.69,4.08,7.29,2.72,20.02,3.2,2.0,0.72,1.44,2.0,5.12,3.52,1.36,0.08,0.72,0.16,10.97,0.0,0.24,0.0,2.08,14.17,3.12,1.44,1.84,2.88,1.92,4.24,1.68,1.04,0.48,0.16,0.64,0.08,0.16,0.0,0.4,9.37,3.36,1.92,2.8,1.6,0.56,3.68,13.37,1.76,13.93,2.4,7.93,4.32,1.44,0.24,0.4,0.32,0.08,0.08,0.56,0.0,0.08,0.24,0.24,0.0,15.29,5.68,4.16,0.16,0.08,0.32,0.0,1.52,0.32,2.8,0.0,0.24,250.0,2.5,0.1924557351809084,53.0,0.53,0.04080061585835258,101.0,1.01,0.07775211701308699,270.0,2.7,0.20785219399538107,145.0,0.11162432640492687,,
83,83,Bush - Speech85 - Edited.txt,17/07/1991,1991-07-17,901,2448454.5,0.601593625498008,251.0,151.0,144.0,17.4375,0.0,2.0,6.0,0.0,0.0,12.0,16.0,4.0,10.0,6.0,30.0,1.0,0.0,30.0,15.0,0.0,2.0,5.0,21.0,12.0,1.0,10.0,1.0,0.0,24.0,2.0,7.0,0.0,0.0,3.0,11.0,1.0,14.0,3.0,5.0,4.0,12.0,13.0,1.0,1.0,2.0,0.0,0.0,0.0,1,237,67.06,70.85,47.83,49.32,14.81,14.35,88.19,58.65,17.72,8.44,4.22,2.95,0.42,0.42,0.42,9.28,8.02,16.88,11.81,4.22,5.91,0.0,19.41,2.53,1.69,1.27,2.95,2.95,6.33,3.8,2.53,0.0,0.42,0.42,9.7,0.0,0.42,0.0,0.84,14.35,2.95,0.42,2.11,5.49,2.11,3.38,1.69,0.0,0.84,0.42,1.27,0.84,0.0,0.0,0.42,10.97,3.8,3.38,3.8,1.69,1.69,2.11,14.35,1.69,12.66,1.69,6.33,4.64,2.53,0.0,0.42,0.84,0.0,0.0,0.84,0.0,0.0,0.0,0.84,0.0,18.57,6.75,5.06,0.0,0.42,0.42,0.0,1.69,0.0,4.22,0.0,0.0,44.0,0.44,0.1752988047808765,17.0,0.17,0.06772908366533864,7.0,0.07,0.027888446215139442,51.0,0.51,0.20318725099601595,26.0,0.10358565737051793,,
84,84,Bush - Speech86 - Edited.txt,17/07/1991,1991-07-17,901,2448454.5,0.2361783439490445,3925.0,927.0,752.0,19.02183406113537,16.0,8.0,116.0,0.0,2.0,202.0,228.0,60.0,179.0,16.0,346.0,19.0,0.0,420.0,218.0,8.0,3.0,73.0,358.0,140.0,15.0,163.0,3.0,6.0,451.0,47.0,280.0,5.0,4.0,35.0,118.0,6.0,201.0,159.0,78.0,90.0,207.0,129.0,19.0,38.0,28.0,2.0,0.0,0.0,1,3705,29.93,67.38,52.87,69.52,16.18,16.55,89.37,59.57,19.97,11.09,3.7,3.24,0.84,1.7,1.62,8.88,5.72,13.41,11.66,5.86,7.99,1.97,21.59,4.13,1.86,2.0,0.67,2.46,4.72,3.48,1.16,0.22,0.13,0.08,10.93,0.0,0.08,0.0,1.78,16.22,3.94,1.86,2.08,3.02,1.78,4.83,1.86,0.92,0.54,0.51,0.62,0.4,0.03,0.0,0.19,10.61,4.29,1.59,2.73,1.92,0.84,6.15,13.12,1.7,12.74,2.29,7.37,3.43,2.54,0.13,0.22,1.21,0.03,0.05,0.73,0.0,0.0,0.24,0.46,0.0,18.62,6.23,5.45,0.03,0.11,0.16,0.0,1.92,0.11,4.56,0.0,0.05,676.0,6.76,0.17222929936305734,229.0,2.29,0.05834394904458599,289.0,2.89,0.07363057324840765,864.0,8.64,0.22012738853503186,498.0,0.12687898089171976,,
85,85,Bush - Speech87 - Edited.txt,18/07/1991,1991-07-18,902,2448455.5,0.3078313253012048,1660.0,511.0,446.0,17.13888888888889,4.0,9.0,78.0,0.0,0.0,83.0,108.0,21.0,76.0,8.0,181.0,10.0,0.0,183.0,90.0,2.0,5.0,39.0,146.0,70.0,9.0,66.0,0.0,4.0,169.0,21.0,109.0,7.0,0.0,9.0,58.0,3.0,99.0,32.0,32.0,26.0,95.0,59.0,15.0,10.0,6.0,0.0,0.0,0.0,1,1585,37.79,58.72,48.38,70.85,14.54,16.97,90.6,61.07,18.8,9.84,5.11,2.97,0.88,0.44,0.44,8.96,7.26,13.5,11.86,5.87,7.7,1.83,19.56,4.42,2.46,1.64,0.5,2.9,5.62,3.97,1.58,0.32,0.5,0.06,8.9,0.0,0.0,0.0,0.76,14.13,3.66,1.2,2.33,4.23,1.01,3.6,1.26,0.57,0.44,0.25,0.5,0.38,0.0,0.0,0.0,10.09,3.66,2.59,3.09,1.01,0.69,2.97,14.13,2.08,11.17,2.08,6.5,2.78,3.34,0.25,0.13,0.5,0.57,0.13,1.01,0.0,0.06,0.38,0.57,0.0,17.67,6.5,5.24,0.0,0.13,0.44,0.0,1.58,0.0,3.79,0.0,0.0,291.0,2.91,0.1753012048192771,97.0,0.97,0.058433734939759036,116.0,1.16,0.06987951807228916,343.0,3.43,0.20662650602409638,190.0,0.1144578313253012,,
86,86,Bush - Speech88 - Edited.txt,20/07/1991,1991-07-20,904,2448457.5,0.2840286557100716,2373.0,674.0,572.0,18.654929577464788,12.0,1.0,87.0,0.0,0.0,128.0,142.0,42.0,108.0,20.0,257.0,5.0,0.0,257.0,131.0,2.0,4.0,51.0,237.0,124.0,11.0,75.0,3.0,4.0,237.0,32.0,163.0,3.0,0.0,8.0,81.0,2.0,130.0,59.0,50.0,55.0,113.0,70.0,6.0,20.0,19.0,0.0,0.0,0.0,1,2257,43.94,61.01,51.49,65.23,15.89,17.24,89.41,58.48,17.9,10.15,4.47,2.35,1.06,1.82,0.44,7.75,6.78,13.78,10.63,5.36,7.67,2.08,18.74,3.23,1.42,1.91,1.15,2.7,5.45,3.72,1.64,0.09,0.53,0.27,9.57,0.0,0.04,0.04,1.82,13.96,3.77,1.86,1.95,3.1,1.6,3.63,1.82,0.62,0.71,0.49,0.97,0.22,0.58,0.0,0.18,10.46,3.19,1.64,3.19,2.44,0.93,3.37,12.8,1.68,13.11,1.95,7.8,4.08,2.22,0.31,0.35,0.27,0.35,0.09,0.35,0.0,0.0,0.09,0.27,0.0,18.12,6.16,5.67,0.27,0.04,0.18,0.0,1.95,0.0,3.68,0.0,0.18,447.0,4.47,0.18836915297092288,137.0,1.37,0.05773282764433207,166.0,1.66,0.06995364517488412,477.0,4.77,0.20101137800252844,269.0,0.11335861778339655,,
87,87,Bush - Speech89 - Edited.txt,31/07/1991,1991-07-31,915,2448468.5,0.390139335476956,933.0,364.0,325.0,26.33333333333333,3.0,2.0,24.0,0.0,0.0,55.0,39.0,21.0,44.0,5.0,103.0,5.0,0.0,101.0,55.0,1.0,0.0,19.0,108.0,42.0,5.0,37.0,1.0,4.0,67.0,12.0,68.0,2.0,1.0,2.0,31.0,0.0,52.0,18.0,15.0,20.0,40.0,35.0,10.0,4.0,4.0,0.0,1.0,0.0,1,878,55.47,50.0,63.1,49.06,22.51,21.07,89.41,57.86,15.72,8.54,5.13,2.51,0.46,0.46,0.0,7.18,9.11,13.44,10.59,5.92,7.63,1.71,17.54,3.99,2.51,1.03,0.8,1.94,5.58,3.3,2.05,0.34,0.57,0.46,8.31,0.11,0.23,0.0,0.57,13.1,3.19,1.25,2.28,2.85,1.14,4.44,1.94,0.91,1.03,0.0,1.03,0.11,0.11,0.0,0.68,9.91,3.99,1.25,2.73,1.94,0.91,3.64,12.64,1.71,12.98,2.28,7.52,3.87,4.56,0.57,0.34,1.03,0.0,0.11,0.46,0.0,0.0,0.0,0.46,0.0,18.11,4.67,6.26,0.0,0.23,0.0,0.0,2.62,0.0,4.1,0.0,0.23,192.0,1.92,0.2057877813504823,56.0,0.56,0.06002143622722401,71.0,0.71,0.07609860664523044,180.0,1.8,0.19292604501607716,79.0,0.08467309753483387,,
88,88,Bush - Speech90 - Edited.txt,02/08/1991,1991-08-02,917,2448470.5,0.2197350388305162,4378.0,962.0,789.0,18.41509433962264,14.0,17.0,206.0,0.0,0.0,233.0,265.0,49.0,179.0,29.0,449.0,23.0,0.0,438.0,210.0,20.0,5.0,93.0,443.0,167.0,12.0,148.0,1.0,17.0,456.0,39.0,340.0,7.0,0.0,20.0,164.0,7.0,303.0,85.0,94.0,85.0,283.0,121.0,28.0,40.0,27.0,0.0,0.0,0.0,1,4139,34.89,51.06,60.46,70.34,15.62,14.47,91.79,59.68,18.72,10.51,6.16,1.84,1.04,0.87,0.6,8.19,6.55,13.46,12.08,6.26,6.89,2.44,22.69,3.48,2.05,1.76,0.89,2.44,5.34,3.79,1.43,0.14,0.39,0.41,9.62,0.12,0.07,0.1,1.01,14.25,3.5,1.45,2.56,3.43,1.45,3.6,2.59,1.11,0.94,0.48,0.7,0.19,0.34,0.0,0.12,9.16,2.59,1.45,3.24,2.05,0.51,3.43,16.09,1.84,12.76,2.46,7.2,3.43,2.92,0.53,0.31,0.63,0.05,0.05,0.63,0.02,0.0,0.19,0.34,0.02,18.39,6.28,5.63,0.1,0.14,0.24,0.0,1.16,0.0,4.83,0.0,0.0,770.0,7.7,0.17587939698492464,235.0,2.35,0.05367747830059388,347.0,3.47,0.07925993604385564,971.0,9.71,0.22179077204202832,495.0,0.11306532663316583,,
89,89,Bush - Speech92 - Edited.txt,21/08/1991,1991-08-21,936,2448489.5,0.2439367311072056,2845.0,694.0,581.0,19.275449101796408,13.0,6.0,121.0,0.0,4.0,202.0,167.0,15.0,131.0,15.0,289.0,15.0,2.0,307.0,140.0,4.0,6.0,83.0,280.0,97.0,6.0,98.0,4.0,3.0,318.0,22.0,219.0,3.0,0.0,13.0,93.0,7.0,172.0,92.0,50.0,68.0,140.0,95.0,13.0,32.0,10.0,4.0,0.0,0.0,1,2750,35.9,64.75,34.78,64.38,16.47,16.44,89.6,60.73,18.4,10.87,3.96,1.42,1.2,2.69,1.6,7.53,6.73,13.31,12.62,5.71,7.27,2.04,21.67,3.02,1.89,1.78,0.76,2.33,4.84,3.38,1.35,0.22,0.4,0.18,10.95,0.0,0.07,0.0,2.76,15.2,3.49,1.78,2.18,3.24,2.25,3.78,2.69,1.24,0.91,0.47,0.47,0.11,0.15,0.0,0.25,7.96,1.85,1.67,3.16,1.49,0.73,4.73,14.25,2.15,12.29,1.96,7.45,3.45,1.38,0.11,0.07,0.33,0.18,0.0,0.76,0.0,0.0,0.29,0.44,0.04,18.25,6.47,7.35,0.18,0.11,0.18,0.0,0.62,0.29,3.05,0.0,0.0,481.0,4.81,0.16906854130052723,150.0,1.5,0.05272407732864675,222.0,2.22,0.07803163444639719,617.0,6.17,0.21687170474516695,340.0,0.1195079086115993,,
90,90,Bush - Speech93 - Edited.txt,26/08/1991,1991-08-26,941,2448494.5,0.2529058116232465,2495.0,631.0,530.0,18.22875816993464,10.0,9.0,99.0,0.0,3.0,137.0,153.0,31.0,98.0,15.0,249.0,14.0,0.0,288.0,122.0,7.0,1.0,48.0,259.0,105.0,15.0,79.0,3.0,10.0,237.0,20.0,169.0,9.0,0.0,13.0,95.0,3.0,151.0,37.0,67.0,46.0,156.0,81.0,17.0,34.0,14.0,3.0,0.0,0.0,1,2333,47.28,74.27,51.73,79.04,15.25,15.65,90.23,59.84,18.0,9.22,3.26,3.47,0.99,0.39,1.11,8.79,7.07,15.43,11.4,6.22,7.03,1.76,21.52,3.73,2.23,2.44,0.81,3.43,4.11,3.51,0.6,0.21,0.21,0.04,10.89,0.0,0.09,0.04,0.64,13.67,3.47,1.63,1.97,2.79,1.59,3.73,2.06,0.86,0.77,0.34,0.6,0.26,0.09,0.09,0.26,8.66,4.5,0.86,2.06,1.59,0.3,3.6,15.17,2.19,13.16,2.91,7.37,3.56,1.46,0.21,0.04,0.56,0.34,0.13,0.56,0.09,0.0,0.3,0.09,0.0,20.1,6.3,5.87,0.21,0.21,0.26,0.0,1.16,0.26,5.79,0.0,0.04,458.0,4.58,0.18356713426853707,130.0,1.3,0.052104208416833664,178.0,1.78,0.07134268537074148,538.0,5.38,0.2156312625250501,257.0,0.10300601202404809,,
91,91,Bush - Speech94 - Edited.txt,29/08/1991,1991-08-29,944,2448497.5,0.285778175313059,2236.0,639.0,534.0,18.8796992481203,10.0,11.0,82.0,0.0,3.0,140.0,133.0,14.0,108.0,14.0,227.0,11.0,0.0,232.0,122.0,8.0,0.0,41.0,246.0,77.0,10.0,76.0,3.0,5.0,215.0,16.0,166.0,4.0,1.0,20.0,79.0,1.0,127.0,53.0,60.0,41.0,127.0,80.0,11.0,19.0,18.0,3.0,0.0,0.0,1,2132,36.84,70.21,55.36,55.85,15.91,16.32,91.42,58.58,18.01,8.63,2.86,3.14,0.94,0.75,0.94,9.33,6.29,13.56,10.88,6.61,8.21,1.78,21.76,3.8,1.64,2.16,0.8,3.19,5.02,3.28,1.69,0.33,0.38,0.05,9.99,0.0,0.09,0.0,0.8,15.38,3.14,1.83,1.97,3.8,2.49,4.13,2.25,0.8,1.31,0.14,0.33,0.05,0.14,0.0,0.14,9.29,3.71,0.8,2.72,1.78,0.84,4.22,14.59,2.35,14.4,3.14,7.22,4.32,1.88,0.28,0.09,1.08,0.28,0.05,0.66,0.0,0.19,0.19,0.28,0.0,18.67,6.43,6.57,0.09,0.14,0.14,0.0,0.7,0.28,4.32,0.0,0.0,409.0,4.09,0.18291592128801432,130.0,1.3,0.05813953488372093,171.0,1.71,0.07647584973166369,488.0,4.88,0.2182468694096601,231.0,0.10330948121645796,,
92,92,Bush - Speech95 - Edited.txt,02/09/1991,1991-09-02,948,2448501.5,0.2323580034423407,3486.0,810.0,679.0,20.684491978609625,7.0,7.0,131.0,1.0,4.0,189.0,187.0,18.0,147.0,22.0,371.0,22.0,0.0,445.0,179.0,4.0,6.0,76.0,405.0,123.0,27.0,105.0,1.0,6.0,353.0,29.0,227.0,4.0,3.0,17.0,104.0,3.0,182.0,60.0,63.0,78.0,201.0,121.0,17.0,37.0,27.0,4.0,0.0,0.0,1,3301,45.48,66.97,59.73,73.31,17.65,16.69,91.09,59.98,17.93,9.48,3.79,2.82,1.12,0.58,1.18,8.45,7.18,15.03,11.75,5.91,7.27,1.88,20.6,3.42,1.79,2.18,0.91,2.79,5.0,3.7,1.15,0.03,0.3,0.0,9.82,0.06,0.18,0.0,0.58,14.75,3.64,1.88,1.76,3.45,2.03,3.7,2.42,1.12,0.88,0.39,0.73,0.33,0.39,0.06,0.06,10.0,4.48,1.3,2.18,1.91,0.82,3.82,14.6,2.39,13.69,1.91,8.09,3.94,2.0,0.33,0.21,0.55,0.06,0.0,0.48,0.0,0.0,0.12,0.36,0.0,17.63,5.57,5.73,0.18,0.15,0.15,0.0,0.48,0.24,5.03,0.0,0.09,660.0,6.6,0.18932874354561102,189.0,1.89,0.05421686746987952,234.0,2.34,0.06712564543889846,705.0,7.05,0.20223752151462995,382.0,0.1095811818703385,,
93,93,Bush - Speech96 - Edited.txt,12/09/1991,1991-09-12,958,2448511.5,0.2687528762080073,2173.0,584.0,515.0,16.385135135135137,8.0,9.0,91.0,1.0,1.0,102.0,148.0,11.0,93.0,16.0,223.0,10.0,0.0,215.0,93.0,7.0,6.0,52.0,231.0,74.0,8.0,48.0,0.0,3.0,230.0,28.0,195.0,3.0,1.0,8.0,88.0,0.0,135.0,21.0,56.0,44.0,155.0,73.0,11.0,21.0,13.0,1.0,0.0,0.0,1,2059,28.16,49.61,53.76,90.59,13.91,15.74,90.72,61.58,19.67,10.83,5.97,2.77,0.58,0.92,0.58,8.84,6.36,13.11,12.63,6.9,6.65,2.67,23.12,3.21,1.75,1.89,1.21,1.8,5.88,4.91,0.97,0.19,0.24,0.24,9.62,0.0,0.15,0.0,1.02,15.01,4.18,1.51,2.53,3.21,1.55,4.37,2.62,1.07,1.07,0.49,0.44,0.19,0.19,0.0,0.05,9.96,3.45,1.6,3.69,2.38,0.29,3.3,16.32,1.99,10.49,1.99,6.41,2.67,2.19,0.1,0.19,0.29,0.19,0.0,0.63,0.05,0.0,0.19,0.34,0.0,18.21,7.04,4.95,0.1,0.0,0.19,0.0,0.68,0.1,5.0,0.0,0.15,361.0,3.61,0.16612977450529223,106.0,1.06,0.04878048780487805,199.0,1.99,0.09157846295444086,484.0,4.84,0.22273354809019788,258.0,0.11872986654394846,,
94,94,Bush - Speech97 - Edited.txt,16/09/1991,1991-09-16,962,2448515.5,0.328393135725429,1282.0,421.0,371.0,16.40909090909091,9.0,6.0,43.0,0.0,1.0,73.0,88.0,2.0,57.0,6.0,130.0,6.0,0.0,154.0,46.0,5.0,6.0,27.0,123.0,49.0,6.0,41.0,1.0,2.0,147.0,8.0,107.0,0.0,1.0,4.0,34.0,0.0,63.0,27.0,26.0,43.0,80.0,51.0,4.0,18.0,7.0,1.0,0.0,0.0,1,1215,25.23,54.9,56.46,93.7,13.81,15.56,91.6,63.21,20.25,10.12,5.1,2.22,0.82,1.56,0.41,10.12,6.26,14.07,14.07,6.58,7.41,2.3,22.72,3.54,2.47,2.06,0.74,2.3,5.1,4.69,0.33,0.08,0.25,0.0,9.47,0.16,0.08,0.0,1.73,14.07,3.21,1.32,1.56,3.21,2.3,3.79,2.3,0.66,0.91,0.74,0.74,0.0,0.16,0.0,0.58,7.65,2.88,1.32,2.39,2.14,0.41,4.69,15.39,2.22,13.0,2.39,7.0,4.36,1.81,0.33,0.41,0.16,0.0,0.0,0.66,0.08,0.0,0.33,0.25,0.0,19.26,6.91,6.01,0.08,0.08,0.41,0.0,0.25,0.16,5.35,0.0,0.0,219.0,2.19,0.17082683307332294,57.0,0.57,0.044461778471138844,108.0,1.08,0.0842433697347894,290.0,2.9,0.22620904836193448,155.0,0.12090483619344773,,
95,95,Bush - Speech98 - Edited.txt,04/10/1991,1991-10-04,980,2448533.5,0.2318878900052882,3782.0,877.0,727.0,16.234615384615385,18.0,18.0,154.0,0.0,3.0,179.0,259.0,32.0,146.0,31.0,370.0,28.0,1.0,418.0,173.0,17.0,6.0,92.0,383.0,111.0,10.0,146.0,5.0,4.0,404.0,25.0,278.0,7.0,0.0,17.0,129.0,7.0,262.0,55.0,102.0,71.0,250.0,120.0,27.0,27.0,22.0,3.0,1.0,0.0,1,3553,33.88,44.52,57.78,65.24,13.61,17.11,91.36,60.37,18.44,9.79,6.05,1.52,1.18,0.28,0.76,8.64,6.61,14.1,12.83,6.98,6.95,2.28,22.46,3.72,2.34,1.63,1.01,2.14,4.9,3.43,1.35,0.28,0.31,0.39,7.82,0.03,0.03,0.03,0.34,14.47,3.26,1.66,2.34,3.21,1.97,3.57,2.22,1.1,0.62,0.37,0.39,0.11,0.17,0.0,0.11,9.32,2.39,1.55,3.69,2.14,0.7,2.93,16.27,1.69,11.91,2.2,6.75,3.21,3.97,0.2,0.34,1.35,0.08,0.03,0.62,0.0,0.06,0.31,0.23,0.0,19.03,7.4,5.07,0.03,0.14,0.17,0.0,0.73,0.17,5.24,0.0,0.08,650.0,6.5,0.1718667371760973,196.0,1.96,0.05182443151771549,285.0,2.85,0.07535695399259651,860.0,8.6,0.22739291380222104,429.0,0.11343204653622423,,
96,96,Bush - Speech99 - Edited.txt,25/10/1991,1991-10-25,1001,2448554.5,0.2177554438860971,4179.0,910.0,734.0,16.728571428571428,14.0,13.0,189.0,0.0,2.0,221.0,280.0,40.0,172.0,19.0,401.0,16.0,0.0,385.0,204.0,15.0,3.0,111.0,425.0,108.0,4.0,183.0,4.0,16.0,472.0,34.0,322.0,3.0,4.0,21.0,149.0,18.0,328.0,82.0,83.0,91.0,247.0,129.0,31.0,30.0,29.0,2.0,0.0,0.0,1,3922,29.08,44.94,54.79,62.04,14.01,16.8,90.39,59.48,19.25,10.48,6.04,1.73,1.1,0.92,0.69,8.77,6.3,12.93,12.62,5.89,6.81,3.31,21.9,2.96,1.56,1.66,0.76,2.27,5.53,3.49,1.58,0.25,0.25,0.31,9.59,0.03,0.05,0.15,1.07,15.35,3.34,1.84,2.58,3.54,1.61,4.33,2.07,0.74,0.89,0.2,0.2,0.05,0.05,0.05,0.05,7.57,2.37,1.2,2.55,1.45,0.66,3.09,15.4,1.96,11.5,2.6,6.63,2.98,2.86,0.15,0.33,1.84,0.05,0.08,0.89,0.0,0.08,0.48,0.33,0.0,20.47,6.94,5.63,0.1,0.18,0.25,0.0,1.17,0.1,5.94,0.0,0.15,720.0,7.2,0.1722900215362527,222.0,2.22,0.05312275664034458,329.0,3.29,0.07872696817420435,960.0,9.6,0.22972002871500358,506.0,0.12108159846853314,,
97,97,Bush - Speech101 - Edited.txt,29/10/1991,1991-10-29,1005,2448558.5,0.3408906882591093,1235.0,421.0,376.0,22.508196721311474,5.0,2.0,36.0,0.0,2.0,76.0,61.0,11.0,51.0,6.0,136.0,7.0,0.0,136.0,56.0,3.0,1.0,28.0,133.0,66.0,4.0,50.0,2.0,1.0,100.0,23.0,92.0,1.0,0.0,4.0,41.0,0.0,65.0,16.0,34.0,29.0,71.0,36.0,7.0,16.0,5.0,2.0,1.0,0.0,1,1180,48.36,66.42,62.84,89.54,19.34,19.32,89.32,58.05,16.95,8.9,4.15,1.69,1.27,0.76,1.02,8.05,7.37,13.47,10.51,6.44,6.44,2.03,19.07,3.81,1.86,1.86,0.68,2.37,5.76,4.75,0.93,0.08,0.08,0.17,10.93,0.08,0.25,0.08,1.02,13.39,4.41,0.85,1.27,3.05,1.53,3.47,2.12,1.02,0.59,0.51,0.25,0.08,0.0,0.0,0.17,6.53,2.63,1.27,2.2,1.19,0.34,2.8,13.64,1.95,12.97,2.2,8.14,2.97,3.14,0.68,0.25,0.17,0.34,0.0,0.51,0.0,0.0,0.08,0.42,0.0,16.95,4.75,6.44,0.08,0.25,0.42,0.0,0.93,0.34,3.73,0.0,0.0,253.0,2.53,0.2048582995951417,60.0,0.6,0.048582995951417005,93.0,0.93,0.07530364372469636,251.0,2.51,0.20323886639676114,123.0,0.09959514170040486,,
98,98,Bush - Speech100 - Edited.txt,29/10/1991,1991-10-29,1005,2448558.5,0.3225806451612903,1395.0,450.0,384.0,18.15116279069768,3.0,4.0,54.0,0.0,1.0,80.0,86.0,5.0,65.0,8.0,136.0,3.0,0.0,137.0,82.0,5.0,4.0,25.0,121.0,72.0,9.0,61.0,1.0,1.0,138.0,24.0,106.0,2.0,0.0,6.0,65.0,0.0,91.0,40.0,21.0,23.0,78.0,32.0,11.0,15.0,6.0,1.0,0.0,0.0,1,1353,51.57,83.54,66.19,86.15,15.73,20.92,89.06,58.54,17.89,10.57,3.84,3.84,1.48,0.89,0.52,7.32,6.36,14.63,9.76,5.69,6.73,1.33,17.96,3.7,2.37,1.85,0.96,2.29,3.77,3.62,0.15,0.0,0.0,0.07,12.86,0.0,0.3,0.0,0.89,12.71,3.7,1.11,1.18,3.03,2.0,3.25,1.48,0.44,0.67,0.22,0.37,0.07,0.07,0.0,0.22,9.61,4.95,1.18,2.73,0.89,0.15,3.62,13.16,1.48,14.78,2.59,8.72,4.36,3.25,0.3,0.22,0.59,0.0,0.0,0.44,0.0,0.0,0.22,0.22,0.0,16.63,6.87,5.91,0.0,0.15,0.44,0.0,0.44,0.15,2.66,0.0,0.0,263.0,2.63,0.18853046594982079,91.0,0.91,0.06523297491039426,108.0,1.08,0.07741935483870968,285.0,2.85,0.20430107526881722,162.0,0.11612903225806452,,
99,99,Bush - Speech102 - Edited.txt,06/11/1991,1991-11-06,1013,2448566.5,0.2913543228385807,2001.0,583.0,502.0,17.358778625954198,7.0,11.0,92.0,0.0,10.0,138.0,131.0,19.0,94.0,16.0,195.0,4.0,0.0,196.0,100.0,6.0,2.0,42.0,203.0,79.0,4.0,83.0,5.0,2.0,203.0,14.0,136.0,4.0,0.0,7.0,63.0,8.0,138.0,49.0,33.0,46.0,133.0,56.0,13.0,9.0,23.0,9.0,1.0,0.0,1,1901,37.64,61.6,45.39,65.63,14.74,15.68,90.74,59.18,16.78,9.31,4.58,1.95,1.26,0.74,0.79,7.47,7.21,12.89,12.36,6.15,7.73,2.42,21.62,3.68,1.32,1.84,0.58,1.84,6.52,4.16,2.05,0.63,0.21,0.58,10.26,0.0,0.21,0.0,1.05,12.15,2.26,1.47,1.74,2.63,1.47,3.47,2.1,0.58,1.0,0.53,0.84,0.37,0.32,0.16,0.05,10.84,3.16,1.95,3.58,3.0,0.84,4.16,15.2,1.63,12.47,1.79,6.26,4.63,3.47,0.11,0.42,1.21,0.0,0.16,0.95,0.05,0.0,0.42,0.37,0.0,20.15,6.68,7.26,0.21,0.26,0.21,0.0,0.89,1.0,3.63,0.0,0.0,369.0,3.69,0.18440779610194902,108.0,1.08,0.053973013493253376,140.0,1.4,0.06996501749125437,455.0,4.55,0.2273863068465767,217.0,0.10844577711144428,,
100,100,Bush - Speech103 - Edited.txt,08/11/1991,1991-11-08,1015,2448568.5,0.2314214463840399,4010.0,928.0,771.0,18.304878048780488,13.0,12.0,174.0,1.0,5.0,244.0,246.0,22.0,172.0,30.0,439.0,19.0,0.0,432.0,201.0,11.0,1.0,93.0,421.0,156.0,9.0,158.0,0.0,14.0,394.0,39.0,297.0,1.0,2.0,17.0,128.0,5.0,259.0,81.0,76.0,76.0,221.0,141.0,26.0,33.0,28.0,5.0,0.0,0.0,1,3826,39.07,52.72,62.08,57.9,15.55,17.12,90.75,60.85,17.88,9.17,4.97,1.54,1.41,0.39,0.86,8.7,7.53,13.43,12.7,5.78,7.0,2.43,21.04,3.35,1.7,1.78,1.07,2.3,5.46,3.55,1.86,0.26,0.52,0.52,9.23,0.03,0.13,0.03,0.44,13.33,3.32,1.57,1.65,3.35,0.99,4.05,2.54,1.1,0.94,0.39,0.89,0.13,0.65,0.26,0.08,8.73,2.74,1.52,3.35,1.49,0.6,3.45,15.42,2.01,12.55,2.54,7.08,3.82,3.01,0.24,0.24,1.07,0.03,0.05,0.71,0.05,0.0,0.18,0.39,0.0,19.0,6.53,6.43,0.08,0.13,0.24,0.0,0.78,0.26,4.47,0.0,0.08,744.0,7.44,0.1855361596009975,213.0,2.13,0.053117206982543644,300.0,3.0,0.07481296758104738,854.0,8.54,0.21296758104738153,433.0,0.10798004987531172,,
101,101,Bush - Speech104 - Edited.txt,09/11/1991,1991-11-09,1016,2448569.5,0.3669885864793679,1139.0,418.0,362.0,17.54794520547945,2.0,4.0,26.0,0.0,2.0,69.0,73.0,5.0,44.0,9.0,120.0,2.0,0.0,119.0,56.0,3.0,2.0,30.0,136.0,35.0,4.0,55.0,1.0,1.0,110.0,15.0,90.0,1.0,1.0,1.0,42.0,0.0,63.0,22.0,24.0,20.0,64.0,40.0,4.0,6.0,10.0,2.0,0.0,0.0,1,1093,50.52,56.55,57.54,81.74,14.97,18.76,88.38,58.01,16.01,9.7,4.76,2.84,0.82,0.82,0.46,6.31,7.87,13.27,10.52,6.22,6.5,2.65,19.4,3.84,1.65,1.56,0.91,1.56,5.86,4.48,1.37,0.09,0.09,0.64,9.97,0.0,0.0,0.18,1.01,15.28,3.84,1.92,1.92,3.2,1.92,4.57,2.2,0.27,1.37,0.46,0.18,0.18,0.0,0.0,0.0,10.25,3.2,1.92,2.2,1.56,2.01,3.2,14.18,2.1,11.71,2.1,7.04,3.2,2.74,0.27,0.18,1.46,0.09,0.09,0.91,0.0,0.0,0.37,0.55,0.0,17.47,6.95,6.31,0.0,0.18,0.0,0.0,0.46,0.37,3.2,0.0,0.0,230.0,2.3,0.2019315188762072,61.0,0.61,0.053555750658472345,92.0,0.92,0.08077260755048288,233.0,2.33,0.20456540825285338,125.0,0.10974539069359086,,
102,102,Bush - Speech105 - Edited.txt,05/12/1991,1991-12-05,1042,2448595.5,0.2288376909137975,3863.0,884.0,738.0,16.61685823754789,21.0,16.0,158.0,0.0,8.0,211.0,261.0,30.0,182.0,18.0,398.0,24.0,0.0,382.0,196.0,7.0,6.0,82.0,396.0,116.0,4.0,159.0,3.0,8.0,389.0,34.0,294.0,6.0,0.0,17.0,141.0,7.0,271.0,43.0,70.0,85.0,265.0,139.0,22.0,31.0,22.0,8.0,2.0,0.0,1,3635,35.83,56.67,63.22,67.37,13.87,15.9,90.98,58.79,18.29,10.29,5.64,2.01,1.05,0.61,0.99,8.01,6.6,13.12,11.53,5.78,7.92,2.23,21.98,3.05,1.62,1.76,0.66,2.75,5.17,3.69,1.49,0.11,0.58,0.25,9.27,0.08,0.08,0.0,0.83,13.12,3.58,1.62,1.4,2.97,2.01,2.78,2.45,1.02,0.99,0.39,0.25,0.11,0.14,0.0,0.0,9.96,2.92,1.79,3.74,2.28,0.36,3.03,16.73,2.67,13.04,2.92,7.1,3.88,3.58,0.28,0.19,1.07,0.08,0.08,0.85,0.0,0.03,0.39,0.41,0.0,20.11,6.96,5.8,0.06,0.08,0.33,0.0,1.07,0.44,5.2,0.0,0.17,675.0,6.75,0.1747346621796531,209.0,2.09,0.054103028734144444,300.0,3.0,0.07765984985762361,873.0,8.73,0.2259901630856847,423.0,0.10950038829924928,,
103,103,Bush - Speech106 - Edited.txt,19/12/1991,1991-12-19,1056,2448609.5,0.2067881835323695,4773.0,987.0,795.0,16.651234567901234,18.0,4.0,203.0,0.0,2.0,291.0,324.0,28.0,197.0,37.0,510.0,23.0,0.0,519.0,242.0,14.0,4.0,114.0,477.0,177.0,23.0,191.0,5.0,9.0,491.0,48.0,358.0,2.0,1.0,22.0,169.0,6.0,267.0,66.0,105.0,109.0,286.0,166.0,35.0,50.0,24.0,2.0,1.0,0.0,1,4587,41.5,75.19,53.3,89.95,14.16,16.79,90.8,60.54,18.57,10.16,4.29,3.03,1.29,0.46,1.09,8.42,6.74,14.32,11.66,6.0,6.89,1.9,20.82,3.47,1.46,1.9,1.13,2.35,5.54,4.67,0.81,0.11,0.15,0.22,11.31,0.02,0.26,0.0,0.68,11.99,3.68,1.31,1.79,2.4,1.48,2.64,1.94,0.94,0.59,0.44,0.35,0.09,0.09,0.0,0.15,8.85,3.82,1.66,2.11,1.48,0.39,2.88,15.0,2.86,13.12,2.49,7.52,3.75,2.53,0.37,0.2,0.83,0.31,0.02,0.78,0.0,0.0,0.24,0.5,0.04,18.03,6.98,6.34,0.15,0.09,0.33,0.0,0.5,0.09,3.55,0.0,0.0,868.0,8.68,0.18185627487953068,260.0,2.6,0.054473077728891685,361.0,3.61,0.07563377330819192,999.0,9.99,0.20930232558139536,539.0,0.11292688036874084,,
104,104,Bush - Speech108 - Edited.txt,02/01/1992,1992-01-02,1070,2448623.5,0.2579505300353357,2830.0,730.0,616.0,19.06024096385542,17.0,6.0,130.0,0.0,6.0,168.0,166.0,26.0,136.0,12.0,270.0,7.0,0.0,296.0,155.0,9.0,2.0,67.0,279.0,118.0,8.0,92.0,1.0,2.0,301.0,25.0,239.0,5.0,0.0,16.0,107.0,4.0,199.0,59.0,57.0,56.0,144.0,77.0,15.0,14.0,19.0,6.0,0.0,1.0,1,2687,33.33,55.47,49.68,84.73,16.09,17.45,89.54,59.51,18.53,10.16,4.65,2.9,0.78,0.37,1.45,8.37,5.73,13.47,10.98,5.95,7.85,2.87,20.69,4.21,2.34,1.41,0.6,2.57,5.06,4.21,0.86,0.0,0.07,0.22,9.42,0.0,0.07,0.0,0.37,15.22,3.46,1.67,2.38,3.28,1.94,4.21,2.46,1.12,0.97,0.37,0.22,0.04,0.07,0.0,0.07,9.94,3.61,1.49,2.72,1.82,0.93,3.65,13.84,1.53,11.39,2.16,7.18,2.42,3.61,0.15,0.15,1.23,0.37,0.07,0.89,0.0,0.04,0.15,0.71,0.0,18.76,6.55,6.25,0.0,0.26,0.19,0.0,1.0,0.45,3.91,0.0,0.15,497.0,4.97,0.1756183745583039,166.0,1.66,0.058657243816254416,244.0,2.44,0.0862190812720848,592.0,5.92,0.20918727915194346,326.0,0.11519434628975266,,
105,105,Bush - Speech109 - Edited.txt,04/01/1992,1992-01-04,1072,2448625.5,0.2655709342560554,2312.0,614.0,518.0,21.88135593220339,2.0,9.0,96.0,0.0,5.0,150.0,118.0,10.0,100.0,15.0,222.0,10.0,0.0,249.0,115.0,17.0,3.0,63.0,245.0,93.0,7.0,90.0,2.0,6.0,212.0,28.0,168.0,8.0,1.0,6.0,102.0,7.0,176.0,23.0,52.0,25.0,130.0,78.0,18.0,18.0,4.0,6.0,0.0,0.0,1,2205,47.14,71.01,40.13,76.82,18.69,17.69,89.84,59.37,17.46,9.21,3.72,3.9,0.73,0.18,0.68,8.25,6.8,14.6,11.79,5.71,6.58,1.81,20.68,3.58,2.59,1.13,0.86,2.31,4.85,3.81,1.04,0.14,0.45,0.05,9.98,0.0,0.23,0.0,0.23,13.88,2.95,1.5,2.49,3.27,1.41,3.49,2.18,0.82,0.95,0.32,0.18,0.09,0.05,0.05,0.05,10.43,4.67,2.04,2.4,1.54,0.91,1.95,15.28,2.09,12.02,2.31,8.12,1.72,3.27,0.18,0.18,2.09,0.5,0.14,0.95,0.05,0.0,0.45,0.32,0.0,17.64,5.35,6.8,0.09,0.18,0.05,0.0,0.5,0.45,4.17,0.0,0.05,435.0,4.35,0.18814878892733564,135.0,1.35,0.05839100346020761,177.0,1.77,0.07655709342560553,484.0,4.84,0.2093425605536332,240.0,0.10380622837370242,,
106,106,Bush - Speech110 - Edited.txt,06/01/1992,1992-01-06,1074,2448627.5,0.3744813278008299,964.0,361.0,322.0,16.348484848484848,4.0,3.0,34.0,0.0,1.0,48.0,66.0,7.0,35.0,4.0,97.0,5.0,0.0,104.0,65.0,2.0,0.0,19.0,102.0,51.0,1.0,32.0,0.0,3.0,83.0,8.0,75.0,0.0,0.0,3.0,43.0,2.0,56.0,14.0,29.0,22.0,40.0,40.0,5.0,13.0,3.0,1.0,0.0,0.0,1,919,47.37,76.04,42.8,87.4,13.72,17.74,89.55,59.52,16.87,8.92,2.61,3.37,1.41,0.33,1.2,7.94,7.07,14.8,11.86,6.42,5.88,2.72,20.46,4.35,1.74,1.74,0.54,1.85,5.11,4.35,0.76,0.11,0.0,0.33,12.08,0.0,0.44,0.0,0.54,13.49,3.05,1.85,1.63,2.94,1.63,4.35,1.96,0.33,1.2,0.22,0.33,0.11,0.0,0.0,0.22,11.32,4.03,2.07,3.16,2.39,1.09,3.48,14.15,1.85,11.86,2.29,7.29,2.29,4.46,0.44,0.0,1.52,0.0,0.0,1.2,0.11,0.11,0.65,0.11,0.0,18.61,7.29,5.22,0.11,0.54,0.22,0.0,0.54,0.22,4.46,0.0,0.0,186.0,1.86,0.19294605809128632,67.0,0.67,0.06950207468879668,75.0,0.75,0.07780082987551867,201.0,2.01,0.20850622406639005,91.0,0.09439834024896265,,
107,107,Bush - Speech111 - Edited.txt,09/01/1992,1992-01-09,1077,2448630.5,0.3139178418148375,1631.0,512.0,463.0,19.157894736842103,11.0,5.0,63.0,0.0,4.0,93.0,95.0,6.0,71.0,8.0,156.0,9.0,0.0,180.0,86.0,5.0,0.0,40.0,185.0,60.0,7.0,61.0,3.0,2.0,162.0,13.0,111.0,3.0,0.0,9.0,58.0,3.0,98.0,32.0,33.0,45.0,99.0,48.0,11.0,8.0,12.0,4.0,0.0,0.0,1,1552,37.22,51.29,73.36,71.71,16.17,15.85,90.46,58.51,17.53,9.79,5.67,2.38,0.97,0.52,0.26,7.73,6.51,13.66,11.98,6.25,7.6,2.32,23.0,3.61,1.74,1.48,0.77,2.19,4.57,3.48,1.03,0.39,0.13,0.13,8.51,0.06,0.06,0.13,0.52,13.92,3.74,1.16,1.87,3.35,2.06,3.54,1.93,0.52,1.03,0.45,1.16,0.19,0.9,0.0,0.06,8.96,3.16,1.87,2.13,2.26,0.52,4.32,15.21,2.45,14.18,2.71,8.31,3.41,3.16,0.26,0.06,1.55,0.19,0.0,0.64,0.0,0.06,0.19,0.32,0.0,18.75,6.44,5.99,0.06,0.06,0.39,0.0,0.64,0.52,4.64,0.0,0.0,313.0,3.13,0.19190680564071122,91.0,0.91,0.055793991416309016,114.0,1.14,0.06989576946658492,355.0,3.55,0.2176578786020846,175.0,0.1072961373390558,,
108,108,Bush - Speech112 - Edited.txt,22/01/1992,1992-01-22,1090,2448643.5,0.3023106546854942,1558.0,471.0,416.0,17.606060606060606,2.0,4.0,64.0,0.0,2.0,86.0,99.0,5.0,74.0,11.0,171.0,6.0,0.0,153.0,92.0,5.0,7.0,50.0,149.0,42.0,6.0,65.0,3.0,4.0,159.0,15.0,96.0,2.0,0.0,6.0,51.0,3.0,111.0,19.0,32.0,38.0,106.0,33.0,17.0,17.0,6.0,2.0,0.0,0.0,1,1467,42.15,67.84,58.07,84.62,14.82,16.77,92.43,59.37,18.61,10.57,5.18,3.82,0.75,0.2,0.61,8.04,7.91,13.02,12.47,5.32,6.88,1.36,22.97,4.64,1.57,1.91,0.82,2.32,6.07,4.64,1.3,0.27,0.48,0.2,9.61,0.0,0.0,0.0,0.2,12.95,3.54,1.3,1.3,3.0,2.04,3.0,2.66,1.7,0.27,0.61,0.68,0.27,0.27,0.0,0.14,13.91,4.7,2.93,5.45,3.14,0.41,3.89,15.54,3.41,12.0,2.18,7.29,3.0,3.89,0.14,0.2,0.82,0.07,0.0,0.68,0.0,0.0,0.34,0.2,0.0,19.22,6.75,5.86,0.0,0.07,0.14,0.0,0.48,0.27,5.52,0.0,0.14,262.0,2.62,0.1681643132220796,104.0,1.04,0.06675224646983312,98.0,0.98,0.06290115532734275,339.0,3.39,0.21758664955070603,174.0,0.1116816431322208,,
109,109,Bush - Speech113 - Edited.txt,01/02/1992,1992-02-01,1100,2448653.5,0.3926585094549499,899.0,353.0,315.0,18.77358490566038,2.0,2.0,27.0,0.0,0.0,43.0,53.0,4.0,34.0,7.0,89.0,3.0,0.0,116.0,58.0,6.0,0.0,19.0,86.0,48.0,3.0,38.0,2.0,1.0,104.0,9.0,54.0,1.0,0.0,1.0,27.0,0.0,44.0,36.0,17.0,15.0,32.0,32.0,6.0,2.0,5.0,0.0,0.0,0.0,1,876,40.83,77.44,27.8,79.78,16.53,18.38,89.84,58.9,19.75,10.96,3.31,2.85,0.23,3.77,0.8,8.79,5.82,13.47,11.19,5.59,5.48,1.48,17.81,3.88,1.71,1.03,0.91,2.97,5.02,4.0,1.03,0.23,0.23,0.11,12.44,0.0,0.23,0.0,3.88,11.19,2.85,0.68,1.6,2.05,1.6,3.2,2.17,0.34,1.03,0.68,1.03,0.34,0.11,0.0,0.57,8.56,4.11,1.03,2.28,1.26,0.46,4.11,11.99,1.37,13.47,1.83,8.79,3.08,3.31,0.0,0.34,1.03,0.0,0.0,0.34,0.0,0.0,0.11,0.23,0.0,14.16,6.28,4.91,0.0,0.23,0.11,0.0,0.46,0.0,2.17,0.0,0.0,175.0,1.75,0.1946607341490545,64.0,0.64,0.07119021134593993,55.0,0.55,0.06117908787541713,176.0,1.76,0.19577308120133483,113.0,0.12569521690767518,,
110,110,Bush - Speech114 - Edited.txt,14/02/1992,1992-02-14,1113,2448666.5,0.3342490842490842,1092.0,365.0,318.0,15.234567901234568,4.0,1.0,47.0,1.0,4.0,60.0,81.0,7.0,45.0,8.0,119.0,3.0,0.0,99.0,36.0,7.0,2.0,26.0,112.0,18.0,0.0,29.0,0.0,3.0,131.0,5.0,82.0,0.0,1.0,6.0,53.0,3.0,90.0,16.0,33.0,15.0,60.0,45.0,8.0,16.0,6.0,4.0,0.0,0.0,1,1016,29.37,44.53,58.21,95.17,12.54,12.7,94.09,61.12,21.36,10.53,6.5,1.18,1.28,0.79,0.79,10.83,6.2,13.58,12.2,5.61,7.09,2.07,24.02,3.74,1.67,2.66,0.89,2.76,5.61,5.12,0.49,0.0,0.2,0.2,8.46,0.1,0.39,0.0,1.28,13.98,2.95,2.07,1.97,2.95,1.67,3.74,2.66,0.59,0.89,0.1,0.3,0.2,0.0,0.0,0.1,8.96,1.67,1.97,3.74,3.25,0.2,2.56,17.32,3.25,11.81,2.95,6.1,3.15,3.94,0.0,0.59,2.46,0.0,0.0,0.69,0.0,0.0,0.1,0.59,0.0,21.85,7.38,6.0,0.1,0.2,0.59,0.1,0.49,0.79,6.1,0.0,0.1,159.0,1.59,0.14560439560439561,45.0,0.45,0.04120879120879121,83.0,0.83,0.076007326007326,259.0,2.59,0.23717948717948717,136.0,0.12454212454212454,,
111,111,Bush - Speech115 - Edited.txt,27/02/1992,1992-02-27,1126,2448679.5,0.2824529991047448,2234.0,631.0,533.0,17.549295774647888,6.0,3.0,76.0,0.0,3.0,114.0,142.0,24.0,91.0,27.0,245.0,10.0,0.0,244.0,128.0,13.0,3.0,46.0,232.0,74.0,14.0,87.0,2.0,4.0,214.0,20.0,173.0,4.0,2.0,5.0,84.0,6.0,132.0,55.0,37.0,35.0,121.0,62.0,13.0,16.0,7.0,3.0,0.0,0.0,1,2135,49.1,72.55,37.34,82.71,15.04,17.8,91.33,59.02,17.38,9.46,4.17,3.33,1.31,0.33,0.33,7.92,7.35,13.82,10.91,5.53,6.65,1.97,19.86,3.93,1.92,1.22,1.59,2.76,5.2,4.17,0.98,0.14,0.09,0.28,11.01,0.05,0.09,0.05,0.52,14.1,3.51,1.69,2.15,3.84,1.26,3.51,1.73,0.23,0.98,0.47,0.33,0.0,0.19,0.0,0.14,11.33,4.26,2.44,3.75,1.59,0.42,3.33,13.96,2.34,10.35,1.59,6.28,2.76,3.61,0.19,0.28,1.55,0.19,0.0,0.75,0.0,0.0,0.33,0.37,0.05,17.28,6.23,5.34,0.09,0.19,0.47,0.0,1.12,0.28,3.51,0.0,0.05,407.0,4.07,0.18218442256042972,144.0,1.44,0.06445837063563116,179.0,1.79,0.0801253357206804,442.0,4.42,0.19785138764547897,234.0,0.10474485228290063,,
112,112,Bush - Speech116 - Edited.txt,11/03/1992,1992-03-11,1139,2448692.5,0.2294704528012279,3909.0,897.0,736.0,15.672597864768685,13.0,8.0,192.0,0.0,3.0,208.0,281.0,23.0,157.0,16.0,413.0,13.0,0.0,385.0,201.0,8.0,8.0,95.0,401.0,128.0,8.0,130.0,6.0,7.0,431.0,34.0,284.0,5.0,2.0,24.0,154.0,14.0,297.0,52.0,114.0,63.0,266.0,102.0,20.0,26.0,22.0,3.0,0.0,0.0,1,3724,39.93,49.68,61.97,62.43,13.21,15.68,92.21,59.99,18.05,10.58,6.26,1.72,1.32,0.51,0.78,7.47,7.38,13.37,11.98,6.53,6.71,2.01,23.28,3.2,1.56,1.45,0.51,2.34,5.24,3.54,1.61,0.16,0.3,0.24,8.83,0.03,0.08,0.05,0.67,14.39,3.73,1.58,2.42,3.03,1.48,3.68,2.47,1.15,0.73,0.51,0.46,0.19,0.11,0.0,0.19,9.91,2.31,2.04,3.76,1.93,0.81,2.95,15.87,2.36,12.08,2.77,6.69,3.03,4.11,0.27,0.21,1.58,0.03,0.05,0.97,0.0,0.05,0.51,0.4,0.03,19.12,7.14,5.59,0.16,0.13,0.59,0.0,0.64,0.16,4.7,0.0,0.0,667.0,6.67,0.17063187515988745,217.0,2.17,0.055512918905090816,291.0,2.91,0.07444359171143515,894.0,8.94,0.22870299309286263,465.0,0.11895625479662318,,
113,113,Bush - Speech117 - Edited.txt,22/03/1992,1992-03-22,1150,2448703.5,0.2982131854590265,1623.0,484.0,423.0,17.980198019801982,7.0,7.0,58.0,0.0,0.0,91.0,101.0,10.0,72.0,8.0,151.0,5.0,0.0,193.0,83.0,6.0,7.0,42.0,166.0,63.0,9.0,54.0,0.0,0.0,170.0,19.0,111.0,3.0,1.0,3.0,62.0,1.0,109.0,40.0,50.0,30.0,83.0,47.0,11.0,8.0,7.0,0.0,0.0,0.0,1,1568,45.9,59.32,78.97,81.07,15.52,16.71,92.09,59.82,17.79,9.95,5.04,2.1,0.64,0.83,1.34,7.84,6.51,14.86,11.8,5.61,6.95,1.59,20.79,4.02,2.49,1.02,0.77,2.36,5.04,4.02,0.96,0.13,0.32,0.19,9.5,0.0,0.0,0.0,0.89,13.84,3.44,1.72,1.34,3.19,2.17,3.25,1.21,0.13,0.57,0.26,0.38,0.13,0.06,0.0,0.19,8.55,2.81,1.98,2.61,1.85,0.64,3.83,14.22,2.61,16.26,3.89,9.5,3.89,2.61,0.45,0.38,1.02,0.0,0.06,0.64,0.0,0.0,0.26,0.32,0.06,16.2,6.12,5.8,0.06,0.26,0.38,0.0,0.45,0.0,3.0,0.0,0.13,292.0,2.92,0.17991373998767715,96.0,0.96,0.059149722735674676,115.0,1.15,0.07085643869377696,359.0,3.59,0.22119531731361675,189.0,0.11645101663585952,,
114,114,Bush - Speech118 - Edited.txt,01/04/1992,1992-04-01,1160,2448713.5,0.3279088689991863,1229.0,403.0,355.0,19.7536231884058,1.0,6.0,55.0,0.0,1.0,64.0,69.0,9.0,48.0,3.0,127.0,4.0,0.0,157.0,72.0,1.0,3.0,35.0,127.0,41.0,5.0,42.0,0.0,3.0,124.0,10.0,72.0,3.0,0.0,6.0,48.0,3.0,78.0,19.0,41.0,25.0,55.0,45.0,8.0,10.0,4.0,1.0,0.0,0.0,1,1176,44.79,74.11,31.53,74.81,17.04,17.43,91.75,62.07,19.13,9.18,3.66,3.32,1.36,0.09,0.77,9.95,6.97,15.31,13.44,4.68,6.04,1.79,21.43,2.98,1.19,1.19,0.51,2.38,5.36,3.91,1.28,0.43,0.34,0.17,9.78,0.0,0.09,0.0,0.09,11.73,1.96,1.19,2.3,2.98,2.13,2.47,1.96,0.34,1.36,0.17,0.34,0.09,0.09,0.0,0.17,9.95,4.59,1.7,2.21,1.96,0.51,3.06,14.8,1.87,12.41,2.38,6.72,3.66,3.23,0.09,0.26,1.36,0.09,0.0,0.68,0.09,0.0,0.43,0.17,0.0,16.5,5.87,5.44,0.09,0.17,0.0,0.0,0.85,0.17,3.74,0.0,0.17,215.0,2.15,0.17493897477624085,76.0,0.76,0.061838893409275834,75.0,0.75,0.061025223759153785,263.0,2.63,0.21399511798209928,134.0,0.10903173311635476,,
115,115,Bush - Speech119 - Edited.txt,10/04/1992,1992-04-10,1169,2448722.5,0.2150755621083671,5426.0,1167.0,945.0,17.209631728045327,20.0,12.0,204.0,10.0,10.0,296.0,352.0,31.0,235.0,55.0,577.0,12.0,0.0,600.0,274.0,16.0,4.0,120.0,584.0,221.0,14.0,194.0,1.0,13.0,566.0,49.0,342.0,10.0,0.0,31.0,182.0,16.0,326.0,67.0,127.0,122.0,317.0,192.0,30.0,42.0,27.0,10.0,0.0,0.0,1,5109,47.84,59.67,58.4,59.11,14.43,16.81,90.9,58.74,17.91,9.69,4.85,2.66,1.19,0.18,0.8,8.22,7.57,14.35,11.45,5.25,6.91,2.11,21.22,3.09,1.43,1.62,1.55,2.54,4.42,3.05,1.29,0.18,0.31,0.31,9.34,0.04,0.0,0.02,0.27,13.09,3.39,1.43,1.96,3.01,1.43,3.72,2.07,1.08,0.55,0.45,0.55,0.14,0.33,0.06,0.08,11.08,3.33,2.11,3.7,2.27,0.63,3.09,15.03,1.72,12.45,2.21,7.16,3.41,4.35,0.22,0.35,1.45,0.02,0.0,0.84,0.06,0.02,0.35,0.39,0.0,19.55,6.81,5.91,0.02,0.1,0.23,0.0,0.65,0.39,5.13,0.0,0.31,1013.0,10.13,0.18669369701437524,294.0,2.94,0.054183560633984516,352.0,3.52,0.0648728345005529,1151.0,11.51,0.21212679690379654,615.0,0.1133431625506819,,
116,116,Bush - Speech120 - Edited.txt,06/05/1992,1992-05-06,1195,2448748.5,0.2141453831041257,3054.0,654.0,545.0,19.238636363636363,3.0,12.0,169.0,0.0,1.0,154.0,176.0,25.0,128.0,13.0,331.0,10.0,0.0,307.0,108.0,15.0,1.0,84.0,300.0,98.0,4.0,111.0,2.0,9.0,343.0,23.0,187.0,3.0,0.0,12.0,144.0,6.0,238.0,43.0,65.0,90.0,190.0,98.0,27.0,25.0,13.0,1.0,1.0,0.0,1,2866,35.82,65.73,66.89,63.48,16.19,15.0,92.5,61.13,20.41,10.75,5.02,4.08,0.77,0.17,0.7,9.67,7.15,13.92,13.29,4.08,6.84,2.48,24.04,2.69,1.78,1.67,0.52,2.16,4.43,3.18,1.19,0.14,0.56,0.17,10.82,0.17,0.07,0.0,0.21,15.0,4.01,0.66,2.27,4.22,1.57,4.12,1.78,0.63,0.77,0.35,0.21,0.07,0.14,0.0,0.0,12.14,5.09,2.97,2.34,2.37,0.56,4.33,16.82,1.92,12.91,2.76,7.22,3.63,3.42,0.17,0.28,0.38,0.03,0.0,0.45,0.0,0.03,0.24,0.17,0.0,18.32,6.04,5.37,0.07,0.38,0.17,0.0,0.49,0.07,5.72,0.0,0.0,513.0,5.13,0.16797642436149313,124.0,1.24,0.04060248853962017,190.0,1.9,0.06221349050425671,724.0,7.24,0.23706614276358873,366.0,0.11984282907662082,,
117,117,Bush - Speech121 - Edited.txt,20/05/1992,1992-05-20,1209,2448762.5,0.3092909535452323,1636.0,506.0,442.0,18.25,2.0,5.0,64.0,0.0,3.0,88.0,100.0,10.0,61.0,11.0,178.0,7.0,0.0,170.0,82.0,6.0,3.0,33.0,172.0,81.0,1.0,65.0,1.0,7.0,179.0,20.0,101.0,4.0,0.0,3.0,56.0,3.0,94.0,25.0,24.0,38.0,102.0,58.0,11.0,13.0,11.0,3.0,1.0,0.0,1,1549,37.77,71.29,51.6,80.7,15.49,15.95,91.22,58.3,19.82,10.97,4.91,3.55,1.1,0.39,1.03,8.84,7.04,12.33,11.36,5.29,6.33,1.87,20.46,4.2,2.13,2.07,0.84,3.03,5.42,4.13,1.1,0.32,0.19,0.26,11.56,0.9,0.06,0.26,0.52,13.49,4.2,0.52,1.74,3.62,1.68,3.81,2.97,1.61,0.58,0.71,0.45,0.0,0.26,0.26,0.0,11.81,4.78,2.26,3.36,2.32,0.39,3.55,15.62,1.74,10.46,1.36,6.65,2.45,2.65,0.71,0.65,0.97,0.71,0.0,0.58,0.0,0.0,0.19,0.32,0.0,18.14,6.2,5.68,0.06,0.19,0.32,0.0,0.58,0.39,4.45,0.0,0.26,319.0,3.19,0.1949877750611247,91.0,0.91,0.055623471882640586,105.0,1.05,0.06418092909535453,341.0,3.41,0.20843520782396088,199.0,0.12163814180929096,,
118,118,Bush - Speech122 - Edited.txt,04/06/1992,1992-06-04,1224,2448777.5,0.2170788416825195,4731.0,1027.0,821.0,16.054054054054053,9.0,12.0,149.0,2.0,21.0,273.0,333.0,31.0,150.0,36.0,509.0,15.0,0.0,460.0,238.0,10.0,7.0,98.0,521.0,156.0,15.0,163.0,4.0,14.0,539.0,49.0,270.0,6.0,3.0,33.0,160.0,8.0,309.0,104.0,126.0,97.0,321.0,143.0,37.0,35.0,29.0,21.0,0.0,0.0,1,4439,44.05,59.25,68.96,69.91,13.29,16.63,90.22,57.76,19.37,11.22,6.06,2.21,1.42,0.77,0.77,8.15,7.28,13.25,11.42,4.66,6.01,2.1,22.91,3.22,1.85,1.51,1.1,1.98,5.16,3.69,1.35,0.23,0.54,0.2,10.25,0.11,0.11,0.05,0.88,12.64,3.33,1.67,1.78,3.06,1.19,3.38,2.43,1.04,0.97,0.38,0.29,0.05,0.16,0.05,0.02,10.93,3.4,2.16,3.65,2.52,0.63,4.26,15.75,2.66,13.74,3.42,7.64,3.0,3.45,0.36,0.38,1.46,0.07,0.14,0.59,0.0,0.02,0.16,0.25,0.02,20.97,7.1,6.15,0.18,0.18,0.52,0.0,0.59,0.95,5.14,0.0,0.18,855.0,8.55,0.18072289156626506,255.0,2.55,0.053899809765377296,279.0,2.79,0.05897273303741281,1100.0,11.0,0.23250898330162756,588.0,0.12428662016487001,,
119,119,Bush - Speech123 - Edited.txt,07/06/1992,1992-06-07,1227,2448780.5,0.292630676949443,2334.0,683.0,584.0,17.86986301369863,4.0,5.0,83.0,1.0,1.0,126.0,146.0,20.0,97.0,20.0,251.0,6.0,0.0,244.0,149.0,2.0,1.0,62.0,252.0,69.0,6.0,77.0,2.0,0.0,240.0,16.0,170.0,1.0,2.0,15.0,78.0,1.0,150.0,72.0,51.0,45.0,101.0,82.0,14.0,19.0,19.0,1.0,0.0,0.0,1,2223,41.21,50.72,67.66,42.07,15.12,16.51,90.19,59.65,17.81,9.54,4.81,2.43,0.76,1.08,0.45,8.28,7.11,13.86,12.1,5.13,7.02,2.97,21.64,3.87,2.11,1.98,1.35,2.29,4.41,2.52,1.62,0.22,0.27,0.31,9.4,0.18,0.04,0.09,1.12,14.17,3.28,1.12,1.89,3.55,1.39,4.63,2.47,0.9,1.12,0.4,0.31,0.27,0.04,0.0,0.0,10.08,3.24,2.07,3.42,2.02,0.67,4.59,13.68,2.29,13.99,3.01,8.1,3.33,2.61,0.18,0.31,0.36,0.36,0.13,0.36,0.0,0.09,0.13,0.18,0.0,17.81,6.66,5.71,0.09,0.54,0.09,0.0,0.4,0.09,4.09,0.0,0.13,404.0,4.04,0.17309340188517566,152.0,1.52,0.06512425021422451,173.0,1.73,0.07412167952013711,501.0,5.01,0.21465295629820053,256.0,0.10968294772922023,,
120,120,Bush - Speech124 - Edited.txt,13/06/1992,1992-06-13,1233,2448786.5,0.2584951456310679,3296.0,852.0,723.0,17.87864077669903,11.0,3.0,105.0,0.0,0.0,179.0,206.0,17.0,110.0,20.0,339.0,10.0,0.0,380.0,212.0,10.0,7.0,63.0,356.0,135.0,12.0,150.0,2.0,11.0,341.0,22.0,216.0,8.0,4.0,17.0,100.0,10.0,168.0,77.0,58.0,77.0,208.0,103.0,12.0,23.0,20.0,0.0,0.0,0.0,1,3165,51.18,62.52,51.55,76.08,15.36,18.17,88.82,57.16,17.57,9.73,4.68,2.81,0.73,0.76,0.76,7.84,7.46,13.52,10.68,5.12,6.16,1.99,19.81,4.49,1.93,1.58,1.14,2.62,5.02,3.82,1.11,0.19,0.57,0.16,9.76,0.06,0.06,0.03,0.79,12.64,3.48,1.61,1.48,2.53,1.64,3.38,2.02,0.6,0.98,0.41,0.38,0.06,0.09,0.03,0.09,10.96,3.41,2.34,4.23,2.15,0.32,4.49,13.68,1.83,11.94,2.37,7.08,3.32,3.79,0.19,0.28,1.23,0.06,0.06,1.01,0.06,0.0,0.44,0.51,0.0,17.44,6.76,5.69,0.06,0.19,0.09,0.0,0.66,0.0,3.92,0.0,0.06,653.0,6.53,0.19811893203883496,229.0,2.29,0.06947815533980582,228.0,2.28,0.0691747572815534,691.0,6.91,0.2096480582524272,363.0,0.11013349514563107,,
121,121,Bush - Speech125 - Edited.txt,17/06/1992,1992-06-17,1237,2448790.5,0.2768334142787761,2059.0,570.0,500.0,19.25423728813559,12.0,6.0,60.0,0.0,6.0,94.0,118.0,15.0,84.0,10.0,239.0,9.0,0.0,242.0,107.0,4.0,1.0,53.0,185.0,114.0,9.0,74.0,0.0,6.0,205.0,19.0,137.0,2.0,2.0,8.0,72.0,2.0,124.0,38.0,35.0,43.0,115.0,58.0,11.0,17.0,8.0,6.0,0.0,0.0,1,1974,45.75,77.79,38.51,82.14,16.73,19.5,90.98,59.27,19.0,9.37,3.5,3.8,0.71,0.96,0.41,9.63,6.94,13.78,10.44,5.88,6.59,1.27,19.5,2.79,1.42,1.27,0.96,2.84,5.27,4.2,1.06,0.0,0.15,0.35,10.84,0.2,0.0,0.0,1.17,12.97,3.85,0.71,1.77,3.8,1.37,2.94,1.52,0.46,0.91,0.15,0.56,0.25,0.15,0.0,0.1,12.01,5.02,1.77,3.75,2.08,0.51,3.44,14.08,2.13,11.7,2.89,6.89,2.94,3.24,0.25,0.51,0.91,0.05,0.05,0.76,0.0,0.0,0.35,0.41,0.0,15.5,5.83,4.76,0.05,0.15,0.2,0.0,0.81,0.61,3.09,0.0,0.0,382.0,3.82,0.18552695483244294,112.0,1.12,0.054395337542496355,141.0,1.41,0.06847984458474989,413.0,4.13,0.20058280718795532,224.0,0.10879067508499271,,
122,122,Bush - Speech126 - Edited.txt,02/07/1992,1992-07-02,1252,2448805.5,0.2287454998615342,3611.0,826.0,690.0,17.897777777777776,9.0,13.0,169.0,0.0,4.0,188.0,225.0,14.0,168.0,20.0,370.0,23.0,0.0,393.0,202.0,3.0,2.0,89.0,328.0,150.0,15.0,137.0,5.0,10.0,378.0,34.0,239.0,4.0,3.0,19.0,128.0,9.0,231.0,55.0,83.0,80.0,220.0,116.0,23.0,30.0,25.0,4.0,0.0,0.0,1,3429,36.18,55.33,66.89,66.61,15.24,15.66,89.94,61.42,18.26,9.77,4.29,3.27,0.64,0.55,1.02,8.49,6.88,14.03,12.6,5.83,7.38,2.74,21.9,3.76,2.16,1.72,0.9,2.36,4.23,3.15,0.99,0.06,0.23,0.15,9.74,0.0,0.15,0.0,0.61,15.25,3.27,1.4,1.98,3.62,1.46,5.25,1.6,0.76,0.58,0.2,0.15,0.06,0.06,0.0,0.06,9.48,3.76,1.63,2.71,1.55,0.76,3.62,14.61,2.22,13.36,2.36,8.17,3.15,2.25,0.06,0.09,0.41,0.15,0.0,0.7,0.03,0.0,0.32,0.35,0.0,18.17,6.65,5.48,0.15,0.17,0.17,0.0,0.32,0.23,4.99,0.0,0.0,630.0,6.3,0.17446690667405151,207.0,2.07,0.05732484076433121,246.0,2.46,0.06812517308224869,785.0,7.85,0.21739130434782608,412.0,0.11409581833287179,,
123,123,Bush - Speech127 - Edited.txt,08/07/1992,1992-07-08,1258,2448811.5,0.2311941083640189,3802.0,879.0,717.0,16.66269841269841,8.0,12.0,152.0,0.0,1.0,144.0,252.0,27.0,144.0,30.0,405.0,14.0,0.0,408.0,215.0,9.0,6.0,81.0,448.0,140.0,18.0,127.0,0.0,7.0,364.0,44.0,262.0,10.0,1.0,18.0,127.0,3.0,228.0,50.0,82.0,85.0,219.0,157.0,22.0,25.0,25.0,1.0,0.0,0.0,1,3607,47.68,68.91,54.16,84.79,14.31,17.97,90.46,57.53,17.3,9.37,3.58,2.74,1.69,0.83,0.53,7.93,7.51,13.36,11.45,5.32,6.29,2.27,21.21,3.91,1.91,1.58,1.11,2.36,5.77,4.49,1.14,0.08,0.36,0.19,9.9,0.03,0.08,0.0,0.94,14.03,3.85,1.75,1.72,3.05,1.77,3.55,1.94,0.86,0.42,0.64,0.36,0.08,0.11,0.0,0.17,10.29,3.77,2.27,2.47,2.11,0.67,2.91,15.28,1.86,13.2,2.88,7.73,3.22,4.02,0.22,0.3,2.0,0.06,0.0,0.58,0.0,0.0,0.17,0.42,0.0,17.6,7.51,4.02,0.03,0.19,0.25,0.0,0.78,0.06,4.66,0.0,0.11,733.0,7.33,0.19279326670173594,230.0,2.3,0.060494476591267755,273.0,2.73,0.07180431351920043,821.0,8.21,0.21593897948448185,408.0,0.10731194108364019,,
124,124,Bush - Speech128 - Edited.txt,14/07/1992,1992-07-14,1264,2448817.5,0.3910950661853189,831.0,325.0,295.0,17.12962962962963,1.0,2.0,40.0,0.0,2.0,40.0,54.0,4.0,36.0,7.0,87.0,2.0,0.0,78.0,38.0,1.0,1.0,18.0,78.0,30.0,3.0,24.0,0.0,2.0,97.0,10.0,67.0,0.0,0.0,4.0,39.0,2.0,58.0,22.0,15.0,20.0,44.0,23.0,8.0,6.0,3.0,2.0,0.0,0.0,1,787,35.77,74.98,51.47,44.37,14.57,15.63,90.85,62.26,20.58,10.93,4.7,4.83,0.76,0.38,0.25,9.66,6.35,14.36,11.82,5.34,6.61,2.41,20.97,3.18,1.4,1.65,1.14,1.65,3.05,2.03,1.02,0.25,0.0,0.13,12.2,0.0,0.0,0.0,0.76,12.07,2.92,1.02,1.4,3.05,0.76,3.94,2.16,0.51,1.27,0.38,0.13,0.13,0.0,0.0,0.0,13.09,5.08,1.52,3.68,1.91,0.89,4.45,14.36,2.54,11.44,1.91,5.84,4.07,3.68,0.51,0.13,0.25,0.0,0.0,0.51,0.0,0.0,0.25,0.25,0.0,17.66,6.48,5.08,0.0,0.25,0.38,0.0,0.38,0.51,4.32,0.0,0.25,135.0,1.35,0.1624548736462094,40.0,0.4,0.048134777376654635,67.0,0.67,0.08062575210589651,182.0,1.82,0.2190132370637786,107.0,0.12876052948255115,,
125,125,Bush - Speech129 - Edited.txt,16/07/1992,1992-07-16,1266,2448819.5,0.3037486218302095,1814.0,551.0,482.0,13.056962025316457,8.0,3.0,57.0,0.0,0.0,89.0,158.0,8.0,75.0,13.0,201.0,9.0,0.0,178.0,86.0,5.0,2.0,29.0,176.0,56.0,0.0,62.0,3.0,10.0,232.0,19.0,148.0,3.0,3.0,8.0,51.0,7.0,85.0,67.0,32.0,55.0,116.0,49.0,4.0,14.0,10.0,0.0,0.0,0.0,1,1714,27.02,34.78,78.76,79.88,10.85,14.18,90.78,60.21,20.3,11.96,7.41,1.34,1.4,1.63,0.18,8.34,6.88,12.31,11.84,5.54,6.83,4.2,20.95,4.38,2.16,1.52,0.99,2.68,4.84,3.79,0.82,0.12,0.23,0.29,9.86,0.41,0.35,0.18,1.75,14.59,3.73,1.11,1.17,2.57,2.04,4.9,3.15,1.05,1.17,0.82,0.53,0.06,0.06,0.0,0.29,6.59,2.57,1.69,2.1,1.4,0.29,5.89,13.3,1.52,12.54,2.16,6.83,3.91,1.75,1.11,0.7,0.35,0.06,0.06,0.88,0.0,0.0,0.35,0.53,0.0,21.65,8.98,5.19,0.0,0.0,0.29,0.0,1.05,0.0,6.01,0.0,0.12,294.0,2.94,0.16207276736493936,93.0,0.93,0.051267916207276734,154.0,1.54,0.08489525909592062,404.0,4.04,0.2227122381477398,251.0,0.13836824696802646,,
126,126,Bush - Speech130 - Edited.txt,07/08/1992,1992-08-07,1288,2448841.5,0.3072289156626506,1660.0,510.0,450.0,18.595959595959595,3.0,6.0,65.0,0.0,0.0,82.0,99.0,7.0,68.0,4.0,176.0,7.0,2.0,175.0,86.0,1.0,1.0,33.0,164.0,57.0,4.0,57.0,5.0,6.0,163.0,16.0,129.0,0.0,0.0,9.0,73.0,4.0,107.0,19.0,43.0,38.0,98.0,67.0,12.0,20.0,9.0,0.0,0.0,0.0,1,1576,34.68,53.81,50.44,74.25,15.6,17.32,90.29,61.74,18.53,9.52,4.63,1.97,0.89,1.27,0.76,9.01,6.54,14.28,12.82,6.85,6.98,2.09,22.46,3.11,1.14,2.22,0.44,2.54,5.14,3.87,1.27,0.19,0.38,0.06,8.57,0.13,0.0,0.06,1.4,15.86,3.62,2.03,1.21,4.38,2.47,3.74,1.33,0.44,0.7,0.19,0.32,0.0,0.25,0.0,0.06,9.96,2.41,2.03,3.87,2.09,0.7,3.11,15.8,3.11,11.55,2.54,5.84,3.36,2.73,0.25,0.13,0.25,0.13,0.13,0.95,0.0,0.13,0.25,0.51,0.0,17.89,6.6,5.27,0.0,0.19,0.0,0.0,0.57,0.0,5.14,0.0,0.13,282.0,2.82,0.16987951807228915,88.0,0.88,0.05301204819277108,129.0,1.29,0.07771084337349397,372.0,3.72,0.22409638554216868,179.0,0.10783132530120482,,
127,127,Bush - Speech131 - Edited.txt,08/08/1992,1992-08-08,1289,2448842.5,0.2884241245136186,2056.0,593.0,500.0,16.73913043478261,1.0,6.0,89.0,0.0,3.0,115.0,138.0,14.0,77.0,11.0,203.0,20.0,0.0,206.0,109.0,7.0,0.0,29.0,205.0,81.0,9.0,77.0,2.0,6.0,227.0,10.0,155.0,2.0,0.0,9.0,81.0,3.0,136.0,40.0,58.0,51.0,128.0,70.0,4.0,8.0,14.0,2.0,0.0,0.0,1,1940,32.73,44.68,68.65,44.66,13.96,18.09,89.9,58.14,17.89,9.85,5.1,2.22,1.13,0.41,0.98,8.04,5.88,12.84,11.91,5.62,7.06,3.45,22.84,5.36,2.01,1.29,0.77,2.06,4.95,2.89,1.86,0.26,0.67,0.21,8.87,0.0,0.0,0.31,0.21,17.11,4.48,2.53,2.73,2.84,1.8,5.0,1.65,0.52,0.82,0.26,0.67,0.31,0.36,0.0,0.05,10.05,2.89,2.01,3.09,1.7,1.03,3.56,16.03,2.06,12.47,2.37,7.06,3.45,2.78,0.15,0.05,0.31,0.05,0.31,0.57,0.0,0.05,0.21,0.26,0.0,19.64,7.32,5.93,0.0,0.21,0.1,0.0,0.57,0.21,5.1,0.0,0.21,372.0,3.72,0.18093385214007782,116.0,1.16,0.05642023346303502,157.0,1.57,0.07636186770428016,483.0,4.83,0.23492217898832685,237.0,0.11527237354085604,,
128,128,Bush - Speech132 - Edited.txt,11/08/1992,1992-08-11,1292,2448845.5,0.3205033308660251,1351.0,433.0,376.0,19.243589743589745,5.0,2.0,53.0,0.0,2.0,72.0,78.0,7.0,57.0,6.0,129.0,7.0,0.0,142.0,70.0,2.0,1.0,34.0,138.0,47.0,9.0,35.0,0.0,3.0,148.0,16.0,108.0,1.0,0.0,3.0,51.0,0.0,91.0,19.0,38.0,27.0,77.0,57.0,10.0,9.0,5.0,2.0,0.0,0.0,1,1283,29.98,63.12,42.06,83.82,16.45,18.47,90.02,60.95,19.41,10.83,4.75,3.35,0.86,1.4,0.47,8.57,6.55,12.7,12.55,6.31,6.7,2.57,21.98,3.59,1.64,1.33,0.47,1.87,4.99,4.13,0.86,0.31,0.23,0.08,11.07,0.0,0.31,0.08,1.4,14.58,3.2,1.25,2.1,3.12,2.42,4.52,1.79,0.62,0.94,0.16,0.16,0.0,0.0,0.08,0.08,10.37,4.21,1.79,2.88,1.56,0.55,2.57,15.2,2.65,10.83,2.81,5.92,2.65,2.26,0.16,0.55,0.31,0.55,0.0,0.78,0.08,0.0,0.16,0.55,0.0,17.23,6.31,5.61,0.0,0.08,0.08,0.0,0.55,0.31,4.29,0.0,0.0,229.0,2.29,0.1695040710584752,73.0,0.73,0.0540340488527017,109.0,1.09,0.08068097705403404,309.0,3.09,0.22871946706143598,164.0,0.12139156180606958,,
129,129,Bush - Speech133 - Edited.txt,28/08/1992,1992-08-28,1309,2448862.5,0.2835820895522388,1474.0,418.0,370.0,16.5,3.0,7.0,60.0,0.0,3.0,75.0,100.0,13.0,54.0,6.0,148.0,10.0,0.0,145.0,72.0,3.0,1.0,27.0,128.0,55.0,0.0,48.0,0.0,6.0,175.0,12.0,116.0,2.0,0.0,4.0,57.0,1.0,96.0,53.0,39.0,33.0,91.0,46.0,5.0,13.0,10.0,3.0,0.0,0.0,1,1382,23.24,64.41,52.31,61.45,13.82,15.99,93.63,61.43,20.77,11.58,5.64,2.82,0.72,1.23,1.16,9.19,5.86,12.45,13.82,6.37,6.01,2.53,23.08,3.18,1.23,1.88,0.65,2.46,4.2,3.04,1.16,0.22,0.58,0.22,12.3,0.0,0.0,0.0,1.3,13.24,2.68,1.52,2.1,3.62,1.23,3.98,1.95,0.72,1.01,0.29,0.43,0.07,0.14,0.0,0.22,13.02,4.2,2.53,5.28,1.81,0.43,5.72,15.12,2.03,12.37,2.32,6.73,3.69,3.26,0.29,0.22,0.14,0.0,0.07,0.72,0.0,0.0,0.22,0.51,0.0,19.61,7.02,5.43,0.07,0.07,0.22,0.0,0.94,0.43,5.43,0.0,0.0,231.0,2.31,0.15671641791044777,76.0,0.76,0.051560379918588875,118.0,1.18,0.08005427408412483,358.0,3.58,0.24287652645861602,187.0,0.12686567164179105,,
130,130,Bush - Speech134 - Edited.txt,03/01/1993,1993-01-03,1437,2448990.5,0.4819587628865979,388.0,187.0,172.0,23.444444444444443,1.0,0.0,17.0,0.0,0.0,16.0,18.0,1.0,17.0,2.0,39.0,0.0,0.0,46.0,22.0,0.0,1.0,20.0,37.0,18.0,2.0,10.0,0.0,0.0,40.0,6.0,23.0,0.0,1.0,0.0,14.0,0.0,29.0,4.0,9.0,12.0,21.0,7.0,3.0,2.0,2.0,0.0,0.0,0.0,1,381,42.43,63.35,44.77,82.25,21.17,18.64,85.83,58.53,19.69,9.71,4.99,3.15,0.26,0.52,0.79,9.97,6.3,13.65,12.34,3.15,7.09,1.31,18.37,4.46,2.89,1.31,1.57,2.1,4.99,3.94,0.79,0.0,0.26,0.52,8.66,0.0,0.26,0.0,0.52,11.81,3.67,0.0,1.05,2.89,2.89,2.36,2.62,2.1,0.26,0.26,0.52,0.52,0.0,0.0,0.0,8.92,4.2,1.05,3.15,1.31,0.52,1.57,12.6,4.72,10.76,0.79,7.09,2.89,3.15,0.0,0.0,0.26,0.0,0.0,0.52,0.0,0.0,0.0,0.52,0.0,13.39,4.99,4.2,0.0,0.0,0.26,0.0,1.31,0.0,2.62,0.0,0.0,67.0,0.67,0.17268041237113402,23.0,0.23,0.059278350515463915,24.0,0.24,0.061855670103092786,82.0,0.82,0.211340206185567,46.0,0.11855670103092783,,
131,131,Bush - Speech135 - Edited.txt,16/01/1993,1993-01-16,1450,2449003.5,0.3848878394332939,847.0,326.0,288.0,11.571428571428571,7.0,6.0,37.0,0.0,0.0,40.0,84.0,6.0,33.0,4.0,84.0,3.0,0.0,85.0,42.0,0.0,0.0,18.0,84.0,31.0,2.0,26.0,3.0,0.0,108.0,6.0,55.0,0.0,0.0,1.0,34.0,2.0,53.0,17.0,36.0,16.0,59.0,27.0,2.0,7.0,4.0,0.0,0.0,0.0,1,772,19.93,64.17,63.42,93.96,9.19,16.06,93.52,61.01,20.85,11.66,5.57,3.24,1.42,0.65,0.78,9.2,5.31,13.99,14.51,5.96,6.87,3.89,26.55,2.59,1.3,1.42,0.39,1.94,6.09,5.18,0.78,0.0,0.39,0.26,11.79,0.0,0.65,0.0,0.91,13.08,2.33,0.91,2.07,3.63,2.2,3.37,3.5,2.07,0.91,0.39,1.3,0.52,0.65,0.0,0.0,8.68,4.66,1.3,1.81,0.91,0.26,4.4,16.71,3.63,14.51,3.76,6.35,5.05,2.2,0.91,0.26,0.13,0.26,0.0,1.04,0.0,0.0,0.26,0.78,0.0,26.17,10.75,5.18,0.13,0.13,0.26,0.0,0.65,0.0,8.81,0.0,0.26,143.0,1.43,0.16883116883116883,42.0,0.42,0.049586776859504134,55.0,0.55,0.06493506493506493,208.0,2.08,0.24557260920897284,114.0,0.1345926800472255,,
